{"componentChunkName":"component---src-pages-mdx-fields-slug-index-js","path":"/api/metadata-block/","result":{"data":{"mdx":{"fields":{"slug":"/api/metadata-block/"},"frontmatter":{"title":"Metadata Block","date":"December 2, 2017","sidebar":{"match":"/api/","order":1}},"body":"const _excluded = [\"components\"];\n\nfunction _extends() { _extends = Object.assign ? Object.assign.bind() : function (target) { for (var i = 1; i < arguments.length; i++) { var source = arguments[i]; for (var key in source) { if (Object.prototype.hasOwnProperty.call(source, key)) { target[key] = source[key]; } } } return target; }; return _extends.apply(this, arguments); }\n\nfunction _objectWithoutProperties(source, excluded) { if (source == null) return {}; var target = _objectWithoutPropertiesLoose(source, excluded); var key, i; if (Object.getOwnPropertySymbols) { var sourceSymbolKeys = Object.getOwnPropertySymbols(source); for (i = 0; i < sourceSymbolKeys.length; i++) { key = sourceSymbolKeys[i]; if (excluded.indexOf(key) >= 0) continue; if (!Object.prototype.propertyIsEnumerable.call(source, key)) continue; target[key] = source[key]; } } return target; }\n\nfunction _objectWithoutPropertiesLoose(source, excluded) { if (source == null) return {}; var target = {}; var sourceKeys = Object.keys(source); var key, i; for (i = 0; i < sourceKeys.length; i++) { key = sourceKeys[i]; if (excluded.indexOf(key) >= 0) continue; target[key] = source[key]; } return target; }\n\n/* @jsxRuntime classic */\n\n/* @jsx mdx */\nconst _frontmatter = {\n  \"title\": \"Metadata Block\",\n  \"date\": \"2017-12-02T21:20:04.000Z\",\n  \"path\": \"/api/metadata-block/\",\n  \"sidebar\": {\n    \"match\": \"/api/\",\n    \"order\": 1\n  }\n};\nconst layoutProps = {\n  _frontmatter\n};\nconst MDXLayout = \"wrapper\";\nreturn function MDXContent(_ref) {\n  let {\n    components\n  } = _ref,\n      props = _objectWithoutProperties(_ref, _excluded);\n\n  return mdx(MDXLayout, _extends({}, layoutProps, props, {\n    components: components,\n    mdxType: \"MDXLayout\"\n  }), mdx(\"p\", null, `The metadata must follow the format:`), mdx(\"div\", {\n    \"className\": \"gatsby-highlight\",\n    \"data-language\": \"js\"\n  }, mdx(\"pre\", {\n    parentName: \"div\",\n    \"className\": \"language-js\"\n  }, mdx(\"code\", {\n    parentName: \"pre\",\n    \"className\": \"language-js\"\n  }, mdx(\"span\", {\n    parentName: \"code\",\n    \"className\": \"token comment\"\n  }, `// ==UserScript==`), `\n`, mdx(\"span\", {\n    parentName: \"code\",\n    \"className\": \"token comment\"\n  }, `// @key value`), `\n`, mdx(\"span\", {\n    parentName: \"code\",\n    \"className\": \"token comment\"\n  }, `// ==/UserScript==`)))), mdx(\"p\", null, `Each line of the block must start with `, mdx(\"code\", {\n    parentName: \"p\",\n    \"className\": \"language-text\"\n  }, `//`), `, the first line must be `, mdx(\"code\", {\n    parentName: \"p\",\n    \"className\": \"language-text\"\n  }, `// ==UserScript==`), ` and the last line must be `, mdx(\"code\", {\n    parentName: \"p\",\n    \"className\": \"language-text\"\n  }, `// ==/UserScript==`), `. No extra space is allowed at the beginning or ending of line.`), mdx(\"p\", null, `Some of the keys can be localized for multiple languages, by adding a colon and the locale code to the key, e.g. `, mdx(\"code\", {\n    parentName: \"p\",\n    \"className\": \"language-text\"\n  }, `@name:zh-CN`), `. The locale code is case insensitive.`), mdx(\"p\", null, `Labels:`), mdx(\"ul\", null, mdx(\"li\", {\n    parentName: \"ul\"\n  }, mdx(\"span\", {\n    className: \"label\"\n  }, \"required\"), \" The key must be set.\"), mdx(\"li\", {\n    parentName: \"ul\"\n  }, mdx(\"span\", {\n    className: \"label\"\n  }, \"multilingual\"), \" The key can be localized by appending a colon and the locale code, e.g. `@name:zh-CN`.\"), mdx(\"li\", {\n    parentName: \"ul\"\n  }, mdx(\"span\", {\n    className: \"label\"\n  }, \"multiple\"), \" The key can be set multiple times.\")), mdx(\"h3\", {\n    \"id\": \"name\",\n    \"style\": {\n      \"position\": \"relative\"\n    }\n  }, mdx(\"a\", {\n    parentName: \"h3\",\n    \"href\": \"#name\",\n    \"aria-label\": \"name permalink\",\n    \"className\": \"anchor before\"\n  }, mdx(\"svg\", {\n    parentName: \"a\",\n    \"aria-hidden\": \"true\",\n    \"focusable\": \"false\",\n    \"height\": \"16\",\n    \"version\": \"1.1\",\n    \"viewBox\": \"0 0 16 16\",\n    \"width\": \"16\"\n  }, mdx(\"path\", {\n    parentName: \"svg\",\n    \"fillRule\": \"evenodd\",\n    \"d\": \"M4 9h1v1H4c-1.5 0-3-1.69-3-3.5S2.55 3 4 3h4c1.45 0 3 1.69 3 3.5 0 1.41-.91 2.72-2 3.25V8.59c.58-.45 1-1.27 1-2.09C10 5.22 8.98 4 8 4H4c-.98 0-2 1.22-2 2.5S3 9 4 9zm9-3h-1v1h1c1 0 2 1.22 2 2.5S13.98 12 13 12H9c-.98 0-2-1.22-2-2.5 0-.83.42-1.64 1-2.09V6.25c-1.09.53-2 1.84-2 3.25C6 11.31 7.55 13 9 13h4c1.45 0 3-1.69 3-3.5S14.5 6 13 6z\"\n  }))), `@name`), mdx(\"span\", {\n    className: \"label\"\n  }, \"required\"), mdx(\"span\", {\n    className: \"label\"\n  }, \"multilingual\"), mdx(\"p\", null, `The name of the script, shown in script list and menus. It must be unique within a `, mdx(\"code\", {\n    parentName: \"p\",\n    \"className\": \"language-text\"\n  }, `@namespace`), `. If a script is being installed, and a script with the same `, mdx(\"code\", {\n    parentName: \"p\",\n    \"className\": \"language-text\"\n  }, `@namespace`), ` and `, mdx(\"code\", {\n    parentName: \"p\",\n    \"className\": \"language-text\"\n  }, `@name`), ` already exists, it will be replaced by the new one. Creating a script with same `, mdx(\"code\", {\n    parentName: \"p\",\n    \"className\": \"language-text\"\n  }, `@namespace`), ` and `, mdx(\"code\", {\n    parentName: \"p\",\n    \"className\": \"language-text\"\n  }, `@name`), ` will cause a conflict error.`), mdx(\"p\", null, `Examples:`), mdx(\"div\", {\n    \"className\": \"gatsby-highlight\",\n    \"data-language\": \"js\"\n  }, mdx(\"pre\", {\n    parentName: \"div\",\n    \"className\": \"language-js\"\n  }, mdx(\"code\", {\n    parentName: \"pre\",\n    \"className\": \"language-js\"\n  }, mdx(\"span\", {\n    parentName: \"code\",\n    \"className\": \"token comment\"\n  }, `// @name          Violentmonkey Script`), `\n`, mdx(\"span\", {\n    parentName: \"code\",\n    \"className\": \"token comment\"\n  }, `// @name:zh-CN    暴力猴脚本`)))), mdx(\"h3\", {\n    \"id\": \"namespace\",\n    \"style\": {\n      \"position\": \"relative\"\n    }\n  }, mdx(\"a\", {\n    parentName: \"h3\",\n    \"href\": \"#namespace\",\n    \"aria-label\": \"namespace permalink\",\n    \"className\": \"anchor before\"\n  }, mdx(\"svg\", {\n    parentName: \"a\",\n    \"aria-hidden\": \"true\",\n    \"focusable\": \"false\",\n    \"height\": \"16\",\n    \"version\": \"1.1\",\n    \"viewBox\": \"0 0 16 16\",\n    \"width\": \"16\"\n  }, mdx(\"path\", {\n    parentName: \"svg\",\n    \"fillRule\": \"evenodd\",\n    \"d\": \"M4 9h1v1H4c-1.5 0-3-1.69-3-3.5S2.55 3 4 3h4c1.45 0 3 1.69 3 3.5 0 1.41-.91 2.72-2 3.25V8.59c.58-.45 1-1.27 1-2.09C10 5.22 8.98 4 8 4H4c-.98 0-2 1.22-2 2.5S3 9 4 9zm9-3h-1v1h1c1 0 2 1.22 2 2.5S13.98 12 13 12H9c-.98 0-2-1.22-2-2.5 0-.83.42-1.64 1-2.09V6.25c-1.09.53-2 1.84-2 3.25C6 11.31 7.55 13 9 13h4c1.45 0 3-1.69 3-3.5S14.5 6 13 6z\"\n  }))), `@namespace`), mdx(\"p\", null, `The combination of `, mdx(\"code\", {\n    parentName: \"p\",\n    \"className\": \"language-text\"\n  }, `@namespace`), ` and `, mdx(\"code\", {\n    parentName: \"p\",\n    \"className\": \"language-text\"\n  }, `@name`), ` is the unique identifier for a userscript. `, mdx(\"code\", {\n    parentName: \"p\",\n    \"className\": \"language-text\"\n  }, `@namespace`), ` can be any string, for example the homepage of a group of userscripts by the same author. If not provided the `, mdx(\"code\", {\n    parentName: \"p\",\n    \"className\": \"language-text\"\n  }, `@namespace`), ` falls back to an empty string (`, mdx(\"code\", {\n    parentName: \"p\",\n    \"className\": \"language-text\"\n  }, `''`), `).`), mdx(\"p\", null, `Examples:`), mdx(\"div\", {\n    \"className\": \"gatsby-highlight\",\n    \"data-language\": \"js\"\n  }, mdx(\"pre\", {\n    parentName: \"div\",\n    \"className\": \"language-js\"\n  }, mdx(\"code\", {\n    parentName: \"pre\",\n    \"className\": \"language-js\"\n  }, mdx(\"span\", {\n    parentName: \"code\",\n    \"className\": \"token comment\"\n  }, `// @namespace https://violentmonkey.github.io`)))), mdx(\"h3\", {\n    \"id\": \"match--exclude-match\",\n    \"style\": {\n      \"position\": \"relative\"\n    }\n  }, mdx(\"a\", {\n    parentName: \"h3\",\n    \"href\": \"#match--exclude-match\",\n    \"aria-label\": \"match  exclude match permalink\",\n    \"className\": \"anchor before\"\n  }, mdx(\"svg\", {\n    parentName: \"a\",\n    \"aria-hidden\": \"true\",\n    \"focusable\": \"false\",\n    \"height\": \"16\",\n    \"version\": \"1.1\",\n    \"viewBox\": \"0 0 16 16\",\n    \"width\": \"16\"\n  }, mdx(\"path\", {\n    parentName: \"svg\",\n    \"fillRule\": \"evenodd\",\n    \"d\": \"M4 9h1v1H4c-1.5 0-3-1.69-3-3.5S2.55 3 4 3h4c1.45 0 3 1.69 3 3.5 0 1.41-.91 2.72-2 3.25V8.59c.58-.45 1-1.27 1-2.09C10 5.22 8.98 4 8 4H4c-.98 0-2 1.22-2 2.5S3 9 4 9zm9-3h-1v1h1c1 0 2 1.22 2 2.5S13.98 12 13 12H9c-.98 0-2-1.22-2-2.5 0-.83.42-1.64 1-2.09V6.25c-1.09.53-2 1.84-2 3.25C6 11.31 7.55 13 9 13h4c1.45 0 3-1.69 3-3.5S14.5 6 13 6z\"\n  }))), `@match / @exclude-match`), mdx(\"span\", {\n    className: \"label\"\n  }, \"multiple\"), mdx(\"p\", null, `Define rules to decide whether a script should be executed. It is recommended to use `, mdx(\"code\", {\n    parentName: \"p\",\n    \"className\": \"language-text\"\n  }, `@match`), ` instead of `, mdx(\"code\", {\n    parentName: \"p\",\n    \"className\": \"language-text\"\n  }, `@include`), `.`), mdx(\"p\", null, `See `, mdx(\"a\", {\n    parentName: \"p\",\n    \"href\": \"../matching/\"\n  }, `more about matching`), `.`), mdx(\"h3\", {\n    \"id\": \"include--exclude\",\n    \"style\": {\n      \"position\": \"relative\"\n    }\n  }, mdx(\"a\", {\n    parentName: \"h3\",\n    \"href\": \"#include--exclude\",\n    \"aria-label\": \"include  exclude permalink\",\n    \"className\": \"anchor before\"\n  }, mdx(\"svg\", {\n    parentName: \"a\",\n    \"aria-hidden\": \"true\",\n    \"focusable\": \"false\",\n    \"height\": \"16\",\n    \"version\": \"1.1\",\n    \"viewBox\": \"0 0 16 16\",\n    \"width\": \"16\"\n  }, mdx(\"path\", {\n    parentName: \"svg\",\n    \"fillRule\": \"evenodd\",\n    \"d\": \"M4 9h1v1H4c-1.5 0-3-1.69-3-3.5S2.55 3 4 3h4c1.45 0 3 1.69 3 3.5 0 1.41-.91 2.72-2 3.25V8.59c.58-.45 1-1.27 1-2.09C10 5.22 8.98 4 8 4H4c-.98 0-2 1.22-2 2.5S3 9 4 9zm9-3h-1v1h1c1 0 2 1.22 2 2.5S13.98 12 13 12H9c-.98 0-2-1.22-2-2.5 0-.83.42-1.64 1-2.09V6.25c-1.09.53-2 1.84-2 3.25C6 11.31 7.55 13 9 13h4c1.45 0 3-1.69 3-3.5S14.5 6 13 6z\"\n  }))), `@include / @exclude`), mdx(\"span\", {\n    className: \"label\"\n  }, \"multiple\"), mdx(\"p\", null, `The old way to decide whether a script should be executed.`), mdx(\"p\", null, `See `, mdx(\"a\", {\n    parentName: \"p\",\n    \"href\": \"../matching/\"\n  }, `more about matching`), `.`), mdx(\"h3\", {\n    \"id\": \"version\",\n    \"style\": {\n      \"position\": \"relative\"\n    }\n  }, mdx(\"a\", {\n    parentName: \"h3\",\n    \"href\": \"#version\",\n    \"aria-label\": \"version permalink\",\n    \"className\": \"anchor before\"\n  }, mdx(\"svg\", {\n    parentName: \"a\",\n    \"aria-hidden\": \"true\",\n    \"focusable\": \"false\",\n    \"height\": \"16\",\n    \"version\": \"1.1\",\n    \"viewBox\": \"0 0 16 16\",\n    \"width\": \"16\"\n  }, mdx(\"path\", {\n    parentName: \"svg\",\n    \"fillRule\": \"evenodd\",\n    \"d\": \"M4 9h1v1H4c-1.5 0-3-1.69-3-3.5S2.55 3 4 3h4c1.45 0 3 1.69 3 3.5 0 1.41-.91 2.72-2 3.25V8.59c.58-.45 1-1.27 1-2.09C10 5.22 8.98 4 8 4H4c-.98 0-2 1.22-2 2.5S3 9 4 9zm9-3h-1v1h1c1 0 2 1.22 2 2.5S13.98 12 13 12H9c-.98 0-2-1.22-2-2.5 0-.83.42-1.64 1-2.09V6.25c-1.09.53-2 1.84-2 3.25C6 11.31 7.55 13 9 13h4c1.45 0 3-1.69 3-3.5S14.5 6 13 6z\"\n  }))), `@version`), mdx(\"p\", null, `Version of the script, it can be used to check if a script has new versions. It is composed of several parts, joined by `, mdx(\"code\", {\n    parentName: \"p\",\n    \"className\": \"language-text\"\n  }, `.`), `. Each part must start with numbers, and can be followed by alphabetic characters.`), mdx(\"p\", null, mdx(\"strong\", {\n    parentName: \"p\"\n  }, `Note:`), ` If no `, mdx(\"code\", {\n    parentName: \"p\",\n    \"className\": \"language-text\"\n  }, `@version`), ` is specified, the script will not be updated automatically.`), mdx(\"p\", null, `Examples:`), mdx(\"div\", {\n    \"className\": \"gatsby-highlight\",\n    \"data-language\": \"js\"\n  }, mdx(\"pre\", {\n    parentName: \"div\",\n    \"className\": \"language-js\"\n  }, mdx(\"code\", {\n    parentName: \"pre\",\n    \"className\": \"language-js\"\n  }, mdx(\"span\", {\n    parentName: \"code\",\n    \"className\": \"token comment\"\n  }, `// @version 1.0`), `\n\n`, mdx(\"span\", {\n    parentName: \"code\",\n    \"className\": \"token comment\"\n  }, `// @version 1.2a.3`)))), mdx(\"h3\", {\n    \"id\": \"description\",\n    \"style\": {\n      \"position\": \"relative\"\n    }\n  }, mdx(\"a\", {\n    parentName: \"h3\",\n    \"href\": \"#description\",\n    \"aria-label\": \"description permalink\",\n    \"className\": \"anchor before\"\n  }, mdx(\"svg\", {\n    parentName: \"a\",\n    \"aria-hidden\": \"true\",\n    \"focusable\": \"false\",\n    \"height\": \"16\",\n    \"version\": \"1.1\",\n    \"viewBox\": \"0 0 16 16\",\n    \"width\": \"16\"\n  }, mdx(\"path\", {\n    parentName: \"svg\",\n    \"fillRule\": \"evenodd\",\n    \"d\": \"M4 9h1v1H4c-1.5 0-3-1.69-3-3.5S2.55 3 4 3h4c1.45 0 3 1.69 3 3.5 0 1.41-.91 2.72-2 3.25V8.59c.58-.45 1-1.27 1-2.09C10 5.22 8.98 4 8 4H4c-.98 0-2 1.22-2 2.5S3 9 4 9zm9-3h-1v1h1c1 0 2 1.22 2 2.5S13.98 12 13 12H9c-.98 0-2-1.22-2-2.5 0-.83.42-1.64 1-2.09V6.25c-1.09.53-2 1.84-2 3.25C6 11.31 7.55 13 9 13h4c1.45 0 3-1.69 3-3.5S14.5 6 13 6z\"\n  }))), `@description`), mdx(\"span\", {\n    className: \"label\"\n  }, \"multilingual\"), mdx(\"p\", null, `A brief summary to describe the script.`), mdx(\"p\", null, `Examples:`), mdx(\"div\", {\n    \"className\": \"gatsby-highlight\",\n    \"data-language\": \"js\"\n  }, mdx(\"pre\", {\n    parentName: \"div\",\n    \"className\": \"language-js\"\n  }, mdx(\"code\", {\n    parentName: \"pre\",\n    \"className\": \"language-js\"\n  }, mdx(\"span\", {\n    parentName: \"code\",\n    \"className\": \"token comment\"\n  }, `// @description         This script rocks.`), `\n`, mdx(\"span\", {\n    parentName: \"code\",\n    \"className\": \"token comment\"\n  }, `// @description:zh-CN   这个脚本很棒！`)))), mdx(\"h3\", {\n    \"id\": \"icon\",\n    \"style\": {\n      \"position\": \"relative\"\n    }\n  }, mdx(\"a\", {\n    parentName: \"h3\",\n    \"href\": \"#icon\",\n    \"aria-label\": \"icon permalink\",\n    \"className\": \"anchor before\"\n  }, mdx(\"svg\", {\n    parentName: \"a\",\n    \"aria-hidden\": \"true\",\n    \"focusable\": \"false\",\n    \"height\": \"16\",\n    \"version\": \"1.1\",\n    \"viewBox\": \"0 0 16 16\",\n    \"width\": \"16\"\n  }, mdx(\"path\", {\n    parentName: \"svg\",\n    \"fillRule\": \"evenodd\",\n    \"d\": \"M4 9h1v1H4c-1.5 0-3-1.69-3-3.5S2.55 3 4 3h4c1.45 0 3 1.69 3 3.5 0 1.41-.91 2.72-2 3.25V8.59c.58-.45 1-1.27 1-2.09C10 5.22 8.98 4 8 4H4c-.98 0-2 1.22-2 2.5S3 9 4 9zm9-3h-1v1h1c1 0 2 1.22 2 2.5S13.98 12 13 12H9c-.98 0-2-1.22-2-2.5 0-.83.42-1.64 1-2.09V6.25c-1.09.53-2 1.84-2 3.25C6 11.31 7.55 13 9 13h4c1.45 0 3-1.69 3-3.5S14.5 6 13 6z\"\n  }))), `@icon`), mdx(\"p\", null, `Specify an icon for the script.`), mdx(\"p\", null, `Examples:`), mdx(\"div\", {\n    \"className\": \"gatsby-highlight\",\n    \"data-language\": \"js\"\n  }, mdx(\"pre\", {\n    parentName: \"div\",\n    \"className\": \"language-js\"\n  }, mdx(\"code\", {\n    parentName: \"pre\",\n    \"className\": \"language-js\"\n  }, mdx(\"span\", {\n    parentName: \"code\",\n    \"className\": \"token comment\"\n  }, `// @icon https://my.cdn.com/icon.png`)))), mdx(\"h3\", {\n    \"id\": \"require\",\n    \"style\": {\n      \"position\": \"relative\"\n    }\n  }, mdx(\"a\", {\n    parentName: \"h3\",\n    \"href\": \"#require\",\n    \"aria-label\": \"require permalink\",\n    \"className\": \"anchor before\"\n  }, mdx(\"svg\", {\n    parentName: \"a\",\n    \"aria-hidden\": \"true\",\n    \"focusable\": \"false\",\n    \"height\": \"16\",\n    \"version\": \"1.1\",\n    \"viewBox\": \"0 0 16 16\",\n    \"width\": \"16\"\n  }, mdx(\"path\", {\n    parentName: \"svg\",\n    \"fillRule\": \"evenodd\",\n    \"d\": \"M4 9h1v1H4c-1.5 0-3-1.69-3-3.5S2.55 3 4 3h4c1.45 0 3 1.69 3 3.5 0 1.41-.91 2.72-2 3.25V8.59c.58-.45 1-1.27 1-2.09C10 5.22 8.98 4 8 4H4c-.98 0-2 1.22-2 2.5S3 9 4 9zm9-3h-1v1h1c1 0 2 1.22 2 2.5S13.98 12 13 12H9c-.98 0-2-1.22-2-2.5 0-.83.42-1.64 1-2.09V6.25c-1.09.53-2 1.84-2 3.25C6 11.31 7.55 13 9 13h4c1.45 0 3-1.69 3-3.5S14.5 6 13 6z\"\n  }))), `@require`), mdx(\"span\", {\n    className: \"label\"\n  }, \"multiple\"), mdx(\"p\", null, `Require another script to execute before the current one. The value is the URL to the required script, which may be relative to the URL the script is being installed from.`), mdx(\"p\", null, `The required script will be downloaded along with installation and execute before the script.`), mdx(\"p\", null, `Local files are not allowed to be required due to security concern. Also it does not make sense since scripts are supposed to work on different devices.`), mdx(\"p\", null, `Examples:`), mdx(\"div\", {\n    \"className\": \"gatsby-highlight\",\n    \"data-language\": \"js\"\n  }, mdx(\"pre\", {\n    parentName: \"div\",\n    \"className\": \"language-js\"\n  }, mdx(\"code\", {\n    parentName: \"pre\",\n    \"className\": \"language-js\"\n  }, mdx(\"span\", {\n    parentName: \"code\",\n    \"className\": \"token comment\"\n  }, `// @require https://my.cdn.com/jquery.js`)))), mdx(\"h3\", {\n    \"id\": \"resource\",\n    \"style\": {\n      \"position\": \"relative\"\n    }\n  }, mdx(\"a\", {\n    parentName: \"h3\",\n    \"href\": \"#resource\",\n    \"aria-label\": \"resource permalink\",\n    \"className\": \"anchor before\"\n  }, mdx(\"svg\", {\n    parentName: \"a\",\n    \"aria-hidden\": \"true\",\n    \"focusable\": \"false\",\n    \"height\": \"16\",\n    \"version\": \"1.1\",\n    \"viewBox\": \"0 0 16 16\",\n    \"width\": \"16\"\n  }, mdx(\"path\", {\n    parentName: \"svg\",\n    \"fillRule\": \"evenodd\",\n    \"d\": \"M4 9h1v1H4c-1.5 0-3-1.69-3-3.5S2.55 3 4 3h4c1.45 0 3 1.69 3 3.5 0 1.41-.91 2.72-2 3.25V8.59c.58-.45 1-1.27 1-2.09C10 5.22 8.98 4 8 4H4c-.98 0-2 1.22-2 2.5S3 9 4 9zm9-3h-1v1h1c1 0 2 1.22 2 2.5S13.98 12 13 12H9c-.98 0-2-1.22-2-2.5 0-.83.42-1.64 1-2.09V6.25c-1.09.53-2 1.84-2 3.25C6 11.31 7.55 13 9 13h4c1.45 0 3-1.69 3-3.5S14.5 6 13 6z\"\n  }))), `@resource`), mdx(\"span\", {\n    className: \"label\"\n  }, \"multiple\"), mdx(\"p\", null, `Some static resources that can be accessed in the script by `, mdx(\"code\", {\n    parentName: \"p\",\n    \"className\": \"language-text\"\n  }, `GM_getResourceText`), ` and `, mdx(\"code\", {\n    parentName: \"p\",\n    \"className\": \"language-text\"\n  }, `GM_getResourceURL`), `. The value is composed of two parts, joined with one or more white spaces. The first part is the name of the resource, no white space is allowed in it. The second part is the URL to the resource, which may be relative to the URL the script is being installed from.`), mdx(\"p\", null, `The resource will be downloaded along with installation and can be accessed when the script executes.`), mdx(\"p\", null, `Examples:`), mdx(\"div\", {\n    \"className\": \"gatsby-highlight\",\n    \"data-language\": \"js\"\n  }, mdx(\"pre\", {\n    parentName: \"div\",\n    \"className\": \"language-js\"\n  }, mdx(\"code\", {\n    parentName: \"pre\",\n    \"className\": \"language-js\"\n  }, mdx(\"span\", {\n    parentName: \"code\",\n    \"className\": \"token comment\"\n  }, `// @resource logo https://my.cdn.com/logo.png`), `\n`, mdx(\"span\", {\n    parentName: \"code\",\n    \"className\": \"token comment\"\n  }, `// @resource text https://my.cdn.com/some-text.txt`)))), mdx(\"h3\", {\n    \"id\": \"run-at\",\n    \"style\": {\n      \"position\": \"relative\"\n    }\n  }, mdx(\"a\", {\n    parentName: \"h3\",\n    \"href\": \"#run-at\",\n    \"aria-label\": \"run at permalink\",\n    \"className\": \"anchor before\"\n  }, mdx(\"svg\", {\n    parentName: \"a\",\n    \"aria-hidden\": \"true\",\n    \"focusable\": \"false\",\n    \"height\": \"16\",\n    \"version\": \"1.1\",\n    \"viewBox\": \"0 0 16 16\",\n    \"width\": \"16\"\n  }, mdx(\"path\", {\n    parentName: \"svg\",\n    \"fillRule\": \"evenodd\",\n    \"d\": \"M4 9h1v1H4c-1.5 0-3-1.69-3-3.5S2.55 3 4 3h4c1.45 0 3 1.69 3 3.5 0 1.41-.91 2.72-2 3.25V8.59c.58-.45 1-1.27 1-2.09C10 5.22 8.98 4 8 4H4c-.98 0-2 1.22-2 2.5S3 9 4 9zm9-3h-1v1h1c1 0 2 1.22 2 2.5S13.98 12 13 12H9c-.98 0-2-1.22-2-2.5 0-.83.42-1.64 1-2.09V6.25c-1.09.53-2 1.84-2 3.25C6 11.31 7.55 13 9 13h4c1.45 0 3-1.69 3-3.5S14.5 6 13 6z\"\n  }))), `@run-at`), mdx(\"p\", null, `Decide when the script will execute.`), mdx(\"p\", null, `Several values can be set for `, mdx(\"code\", {\n    parentName: \"p\",\n    \"className\": \"language-text\"\n  }, `@run-at`), `:`), mdx(\"ul\", null, mdx(\"li\", {\n    parentName: \"ul\"\n  }, mdx(\"p\", {\n    parentName: \"li\"\n  }, mdx(\"code\", {\n    parentName: \"p\",\n    \"className\": \"language-text\"\n  }, `document-end`), ` `, mdx(\"span\", {\n    className: \"label\"\n  }, `default`)), mdx(\"p\", {\n    parentName: \"li\"\n  }, `The script executes when `, mdx(\"code\", {\n    parentName: \"p\",\n    \"className\": \"language-text\"\n  }, `DOMContentLoaded`), ` is fired. At this time, the basic HTML of the page is ready and other resources like images might still be on the way.`)), mdx(\"li\", {\n    parentName: \"ul\"\n  }, mdx(\"p\", {\n    parentName: \"li\"\n  }, mdx(\"code\", {\n    parentName: \"p\",\n    \"className\": \"language-text\"\n  }, `document-start`)), mdx(\"p\", {\n    parentName: \"li\"\n  }, `The script executes as soon as possible. There is no guarantee for the script to execute before other scripts in the page.`), mdx(\"p\", {\n    parentName: \"li\"\n  }, `Note: in Greasemonkey v3, the script may be ensured to execute even before HTML is loaded, but this is impossible for Violentmonkey as a web extension.`)), mdx(\"li\", {\n    parentName: \"ul\"\n  }, mdx(\"p\", {\n    parentName: \"li\"\n  }, mdx(\"code\", {\n    parentName: \"p\",\n    \"className\": \"language-text\"\n  }, `document-idle`)), mdx(\"p\", {\n    parentName: \"li\"\n  }, `The script executes after `, mdx(\"code\", {\n    parentName: \"p\",\n    \"className\": \"language-text\"\n  }, `DOMContentLoaded`), ` is fired.`))), mdx(\"h3\", {\n    \"id\": \"noframes\",\n    \"style\": {\n      \"position\": \"relative\"\n    }\n  }, mdx(\"a\", {\n    parentName: \"h3\",\n    \"href\": \"#noframes\",\n    \"aria-label\": \"noframes permalink\",\n    \"className\": \"anchor before\"\n  }, mdx(\"svg\", {\n    parentName: \"a\",\n    \"aria-hidden\": \"true\",\n    \"focusable\": \"false\",\n    \"height\": \"16\",\n    \"version\": \"1.1\",\n    \"viewBox\": \"0 0 16 16\",\n    \"width\": \"16\"\n  }, mdx(\"path\", {\n    parentName: \"svg\",\n    \"fillRule\": \"evenodd\",\n    \"d\": \"M4 9h1v1H4c-1.5 0-3-1.69-3-3.5S2.55 3 4 3h4c1.45 0 3 1.69 3 3.5 0 1.41-.91 2.72-2 3.25V8.59c.58-.45 1-1.27 1-2.09C10 5.22 8.98 4 8 4H4c-.98 0-2 1.22-2 2.5S3 9 4 9zm9-3h-1v1h1c1 0 2 1.22 2 2.5S13.98 12 13 12H9c-.98 0-2-1.22-2-2.5 0-.83.42-1.64 1-2.09V6.25c-1.09.53-2 1.84-2 3.25C6 11.31 7.55 13 9 13h4c1.45 0 3-1.69 3-3.5S14.5 6 13 6z\"\n  }))), `@noframes`), mdx(\"p\", null, `When present, the script will execute only in top level document, but not in nested frames.`), mdx(\"div\", {\n    \"className\": \"gatsby-highlight\",\n    \"data-language\": \"js\"\n  }, mdx(\"pre\", {\n    parentName: \"div\",\n    \"className\": \"language-js\"\n  }, mdx(\"code\", {\n    parentName: \"pre\",\n    \"className\": \"language-js\"\n  }, mdx(\"span\", {\n    parentName: \"code\",\n    \"className\": \"token comment\"\n  }, `// @noframes`)))), mdx(\"h3\", {\n    \"id\": \"grant\",\n    \"style\": {\n      \"position\": \"relative\"\n    }\n  }, mdx(\"a\", {\n    parentName: \"h3\",\n    \"href\": \"#grant\",\n    \"aria-label\": \"grant permalink\",\n    \"className\": \"anchor before\"\n  }, mdx(\"svg\", {\n    parentName: \"a\",\n    \"aria-hidden\": \"true\",\n    \"focusable\": \"false\",\n    \"height\": \"16\",\n    \"version\": \"1.1\",\n    \"viewBox\": \"0 0 16 16\",\n    \"width\": \"16\"\n  }, mdx(\"path\", {\n    parentName: \"svg\",\n    \"fillRule\": \"evenodd\",\n    \"d\": \"M4 9h1v1H4c-1.5 0-3-1.69-3-3.5S2.55 3 4 3h4c1.45 0 3 1.69 3 3.5 0 1.41-.91 2.72-2 3.25V8.59c.58-.45 1-1.27 1-2.09C10 5.22 8.98 4 8 4H4c-.98 0-2 1.22-2 2.5S3 9 4 9zm9-3h-1v1h1c1 0 2 1.22 2 2.5S13.98 12 13 12H9c-.98 0-2-1.22-2-2.5 0-.83.42-1.64 1-2.09V6.25c-1.09.53-2 1.84-2 3.25C6 11.31 7.55 13 9 13h4c1.45 0 3-1.69 3-3.5S14.5 6 13 6z\"\n  }))), `@grant`), mdx(\"span\", {\n    className: \"label\"\n  }, \"multiple\"), mdx(\"p\", null, `Specify which special APIs should be granted and can be used when the script executes.`), mdx(\"p\", null, `If no `, mdx(\"code\", {\n    parentName: \"p\",\n    \"className\": \"language-text\"\n  }, `@grant`), ` is present, `, mdx(\"code\", {\n    parentName: \"p\",\n    \"className\": \"language-text\"\n  }, `@grant none`), ` is assumed.`), mdx(\"ul\", null, mdx(\"li\", {\n    parentName: \"ul\"\n  }, mdx(\"p\", {\n    parentName: \"li\"\n  }, `In case you don't need special API or sandboxing`), mdx(\"div\", {\n    parentName: \"li\",\n    \"className\": \"gatsby-highlight\",\n    \"data-language\": \"js\"\n  }, mdx(\"pre\", {\n    parentName: \"div\",\n    \"className\": \"language-js\"\n  }, mdx(\"code\", {\n    parentName: \"pre\",\n    \"className\": \"language-js\"\n  }, mdx(\"span\", {\n    parentName: \"code\",\n    \"className\": \"token comment\"\n  }, `// @grant none`)))), mdx(\"p\", {\n    parentName: \"li\"\n  }, `  Sandbox is disabled in this mode, meaning the script can add/modify globals directly without the need to use `, mdx(\"code\", {\n    parentName: \"p\",\n    \"className\": \"language-text\"\n  }, `unsafeWindow`), `.\n`)), mdx(\"li\", {\n    parentName: \"ul\"\n  }, mdx(\"p\", {\n    parentName: \"li\"\n  }, `In case any special API is used, it must be explicitly granted`), mdx(\"div\", {\n    parentName: \"li\",\n    \"className\": \"gatsby-highlight\",\n    \"data-language\": \"js\"\n  }, mdx(\"pre\", {\n    parentName: \"div\",\n    \"className\": \"language-js\"\n  }, mdx(\"code\", {\n    parentName: \"pre\",\n    \"className\": \"language-js\"\n  }, mdx(\"span\", {\n    parentName: \"code\",\n    \"className\": \"token comment\"\n  }, `// @grant GM_getValue`), `\n`, mdx(\"span\", {\n    parentName: \"code\",\n    \"className\": \"token comment\"\n  }, `// @grant GM_setValue`)))), mdx(\"p\", {\n    parentName: \"li\"\n  }, `  …or for the new `, mdx(\"code\", {\n    parentName: \"p\",\n    \"className\": \"language-text\"\n  }, `GM.*`), ` API methods `, mdx(\"em\", {\n    parentName: \"p\"\n  }, `(Since VM2.12.10)`), `:`), mdx(\"div\", {\n    parentName: \"li\",\n    \"className\": \"gatsby-highlight\",\n    \"data-language\": \"js\"\n  }, mdx(\"pre\", {\n    parentName: \"div\",\n    \"className\": \"language-js\"\n  }, mdx(\"code\", {\n    parentName: \"pre\",\n    \"className\": \"language-js\"\n  }, mdx(\"span\", {\n    parentName: \"code\",\n    \"className\": \"token comment\"\n  }, `// @grant GM.getValue`), `\n`, mdx(\"span\", {\n    parentName: \"code\",\n    \"className\": \"token comment\"\n  }, `// @grant GM.setValue`)))))), mdx(\"p\", null, `In addition to `, mdx(\"a\", {\n    parentName: \"p\",\n    \"href\": \"../gm/\"\n  }, `GM API`), ` the following privileges may be granted:`), mdx(\"ul\", null, mdx(\"li\", {\n    parentName: \"ul\"\n  }, mdx(\"p\", {\n    parentName: \"li\"\n  }, mdx(\"code\", {\n    parentName: \"p\",\n    \"className\": \"language-text\"\n  }, `// @grant window.close`)), mdx(\"p\", {\n    parentName: \"li\"\n  }, mdx(\"em\", {\n    parentName: \"p\"\n  }, `Since VM2.6.2`), mdx(\"br\", {\n    parentName: \"p\"\n  }), `\n`, `Allows closing the tab via `, mdx(\"code\", {\n    parentName: \"p\",\n    \"className\": \"language-text\"\n  }, `window.close()`))), mdx(\"li\", {\n    parentName: \"ul\"\n  }, mdx(\"p\", {\n    parentName: \"li\"\n  }, mdx(\"code\", {\n    parentName: \"p\",\n    \"className\": \"language-text\"\n  }, `// @grant window.focus`)), mdx(\"p\", {\n    parentName: \"li\"\n  }, mdx(\"em\", {\n    parentName: \"p\"\n  }, `Since VM2.12.10`), mdx(\"br\", {\n    parentName: \"p\"\n  }), `\n`, `Allows focusing the tab via `, mdx(\"code\", {\n    parentName: \"p\",\n    \"className\": \"language-text\"\n  }, `window.focus()`), ` even if the user didn't interact with it first.`))), mdx(\"h3\", {\n    \"id\": \"inject-into\",\n    \"style\": {\n      \"position\": \"relative\"\n    }\n  }, mdx(\"a\", {\n    parentName: \"h3\",\n    \"href\": \"#inject-into\",\n    \"aria-label\": \"inject into permalink\",\n    \"className\": \"anchor before\"\n  }, mdx(\"svg\", {\n    parentName: \"a\",\n    \"aria-hidden\": \"true\",\n    \"focusable\": \"false\",\n    \"height\": \"16\",\n    \"version\": \"1.1\",\n    \"viewBox\": \"0 0 16 16\",\n    \"width\": \"16\"\n  }, mdx(\"path\", {\n    parentName: \"svg\",\n    \"fillRule\": \"evenodd\",\n    \"d\": \"M4 9h1v1H4c-1.5 0-3-1.69-3-3.5S2.55 3 4 3h4c1.45 0 3 1.69 3 3.5 0 1.41-.91 2.72-2 3.25V8.59c.58-.45 1-1.27 1-2.09C10 5.22 8.98 4 8 4H4c-.98 0-2 1.22-2 2.5S3 9 4 9zm9-3h-1v1h1c1 0 2 1.22 2 2.5S13.98 12 13 12H9c-.98 0-2-1.22-2-2.5 0-.83.42-1.64 1-2.09V6.25c-1.09.53-2 1.84-2 3.25C6 11.31 7.55 13 9 13h4c1.45 0 3-1.69 3-3.5S14.5 6 13 6z\"\n  }))), `@inject-into`), mdx(\"p\", null, mdx(\"em\", {\n    parentName: \"p\"\n  }, `Added in Violentmonkey v2.10.0`)), mdx(\"p\", null, `Decide which context the script will be injected into.`), mdx(\"p\", null, `If not set in the metadata block, the default value `, mdx(\"code\", {\n    parentName: \"p\",\n    \"className\": \"language-text\"\n  }, `page`), ` will be used.\nHowever, you can change the default value in Violentmonkey settings.`), mdx(\"p\", null, `Possible values:`), mdx(\"ul\", null, mdx(\"li\", {\n    parentName: \"ul\"\n  }, mdx(\"p\", {\n    parentName: \"li\"\n  }, mdx(\"code\", {\n    parentName: \"p\",\n    \"className\": \"language-text\"\n  }, `page`), ` `, mdx(\"span\", {\n    className: \"label\"\n  }, `default`)), mdx(\"p\", {\n    parentName: \"li\"\n  }, `  Inject into context of the web page.`), mdx(\"p\", {\n    parentName: \"li\"\n  }, `  In this mode, `, mdx(\"code\", {\n    parentName: \"p\",\n    \"className\": \"language-text\"\n  }, `unsafeWindow`), ` refers to the `, mdx(\"code\", {\n    parentName: \"p\",\n    \"className\": \"language-text\"\n  }, `window`), ` object,\nallowing the script to access JavaScript objects of the web page,\njust like normal page scripts can.`)), mdx(\"li\", {\n    parentName: \"ul\"\n  }, mdx(\"p\", {\n    parentName: \"li\"\n  }, mdx(\"code\", {\n    parentName: \"p\",\n    \"className\": \"language-text\"\n  }, `content`)), mdx(\"p\", {\n    parentName: \"li\"\n  }, `  Inject into context of `, mdx(\"a\", {\n    parentName: \"p\",\n    \"href\": \"https://developer.mozilla.org/en-US/docs/Mozilla/Add-ons/WebExtensions/Content_scripts\",\n    \"target\": \"_blank\",\n    \"rel\": \"noopener noreferrer\"\n  }, `content scripts`), `.`), mdx(\"p\", {\n    parentName: \"li\"\n  }, `  In this mode, `, mdx(\"code\", {\n    parentName: \"p\",\n    \"className\": \"language-text\"\n  }, `unsafeWindow`), ` refers to the `, mdx(\"code\", {\n    parentName: \"p\",\n    \"className\": \"language-text\"\n  }, `global`), ` object in content script.\nAs a result, the script can access and modify the page's DOM,\nbut cannot access JavaScript objects of the web page.`)), mdx(\"li\", {\n    parentName: \"ul\"\n  }, mdx(\"p\", {\n    parentName: \"li\"\n  }, mdx(\"code\", {\n    parentName: \"p\",\n    \"className\": \"language-text\"\n  }, `auto`)), mdx(\"p\", {\n    parentName: \"li\"\n  }, `  Try to inject into context of the web page. If blocked by CSP rules, inject as a content script.`))), mdx(\"h3\", {\n    \"id\": \"downloadurl\",\n    \"style\": {\n      \"position\": \"relative\"\n    }\n  }, mdx(\"a\", {\n    parentName: \"h3\",\n    \"href\": \"#downloadurl\",\n    \"aria-label\": \"downloadurl permalink\",\n    \"className\": \"anchor before\"\n  }, mdx(\"svg\", {\n    parentName: \"a\",\n    \"aria-hidden\": \"true\",\n    \"focusable\": \"false\",\n    \"height\": \"16\",\n    \"version\": \"1.1\",\n    \"viewBox\": \"0 0 16 16\",\n    \"width\": \"16\"\n  }, mdx(\"path\", {\n    parentName: \"svg\",\n    \"fillRule\": \"evenodd\",\n    \"d\": \"M4 9h1v1H4c-1.5 0-3-1.69-3-3.5S2.55 3 4 3h4c1.45 0 3 1.69 3 3.5 0 1.41-.91 2.72-2 3.25V8.59c.58-.45 1-1.27 1-2.09C10 5.22 8.98 4 8 4H4c-.98 0-2 1.22-2 2.5S3 9 4 9zm9-3h-1v1h1c1 0 2 1.22 2 2.5S13.98 12 13 12H9c-.98 0-2-1.22-2-2.5 0-.83.42-1.64 1-2.09V6.25c-1.09.53-2 1.84-2 3.25C6 11.31 7.55 13 9 13h4c1.45 0 3-1.69 3-3.5S14.5 6 13 6z\"\n  }))), `@downloadURL`), mdx(\"p\", null, `The URL the script can be downloaded from.  Checked for updates automatically at a regular interval, and also manually on user request.  Automatically added when using \"Install from URL.\"`), mdx(\"h3\", {\n    \"id\": \"supporturl\",\n    \"style\": {\n      \"position\": \"relative\"\n    }\n  }, mdx(\"a\", {\n    parentName: \"h3\",\n    \"href\": \"#supporturl\",\n    \"aria-label\": \"supporturl permalink\",\n    \"className\": \"anchor before\"\n  }, mdx(\"svg\", {\n    parentName: \"a\",\n    \"aria-hidden\": \"true\",\n    \"focusable\": \"false\",\n    \"height\": \"16\",\n    \"version\": \"1.1\",\n    \"viewBox\": \"0 0 16 16\",\n    \"width\": \"16\"\n  }, mdx(\"path\", {\n    parentName: \"svg\",\n    \"fillRule\": \"evenodd\",\n    \"d\": \"M4 9h1v1H4c-1.5 0-3-1.69-3-3.5S2.55 3 4 3h4c1.45 0 3 1.69 3 3.5 0 1.41-.91 2.72-2 3.25V8.59c.58-.45 1-1.27 1-2.09C10 5.22 8.98 4 8 4H4c-.98 0-2 1.22-2 2.5S3 9 4 9zm9-3h-1v1h1c1 0 2 1.22 2 2.5S13.98 12 13 12H9c-.98 0-2-1.22-2-2.5 0-.83.42-1.64 1-2.09V6.25c-1.09.53-2 1.84-2 3.25C6 11.31 7.55 13 9 13h4c1.45 0 3-1.69 3-3.5S14.5 6 13 6z\"\n  }))), `@supportURL`), mdx(\"p\", null, `If supplied, the question mark icon in the user scripts list will link to this.`), mdx(\"h3\", {\n    \"id\": \"homepageurl\",\n    \"style\": {\n      \"position\": \"relative\"\n    }\n  }, mdx(\"a\", {\n    parentName: \"h3\",\n    \"href\": \"#homepageurl\",\n    \"aria-label\": \"homepageurl permalink\",\n    \"className\": \"anchor before\"\n  }, mdx(\"svg\", {\n    parentName: \"a\",\n    \"aria-hidden\": \"true\",\n    \"focusable\": \"false\",\n    \"height\": \"16\",\n    \"version\": \"1.1\",\n    \"viewBox\": \"0 0 16 16\",\n    \"width\": \"16\"\n  }, mdx(\"path\", {\n    parentName: \"svg\",\n    \"fillRule\": \"evenodd\",\n    \"d\": \"M4 9h1v1H4c-1.5 0-3-1.69-3-3.5S2.55 3 4 3h4c1.45 0 3 1.69 3 3.5 0 1.41-.91 2.72-2 3.25V8.59c.58-.45 1-1.27 1-2.09C10 5.22 8.98 4 8 4H4c-.98 0-2 1.22-2 2.5S3 9 4 9zm9-3h-1v1h1c1 0 2 1.22 2 2.5S13.98 12 13 12H9c-.98 0-2-1.22-2-2.5 0-.83.42-1.64 1-2.09V6.25c-1.09.53-2 1.84-2 3.25C6 11.31 7.55 13 9 13h4c1.45 0 3-1.69 3-3.5S14.5 6 13 6z\"\n  }))), `@homepageURL`), mdx(\"p\", null, `If supplied, the home icon in the user scripts list will link to this.`), mdx(\"h3\", {\n    \"id\": \"unwrap\",\n    \"style\": {\n      \"position\": \"relative\"\n    }\n  }, mdx(\"a\", {\n    parentName: \"h3\",\n    \"href\": \"#unwrap\",\n    \"aria-label\": \"unwrap permalink\",\n    \"className\": \"anchor before\"\n  }, mdx(\"svg\", {\n    parentName: \"a\",\n    \"aria-hidden\": \"true\",\n    \"focusable\": \"false\",\n    \"height\": \"16\",\n    \"version\": \"1.1\",\n    \"viewBox\": \"0 0 16 16\",\n    \"width\": \"16\"\n  }, mdx(\"path\", {\n    parentName: \"svg\",\n    \"fillRule\": \"evenodd\",\n    \"d\": \"M4 9h1v1H4c-1.5 0-3-1.69-3-3.5S2.55 3 4 3h4c1.45 0 3 1.69 3 3.5 0 1.41-.91 2.72-2 3.25V8.59c.58-.45 1-1.27 1-2.09C10 5.22 8.98 4 8 4H4c-.98 0-2 1.22-2 2.5S3 9 4 9zm9-3h-1v1h1c1 0 2 1.22 2 2.5S13.98 12 13 12H9c-.98 0-2-1.22-2-2.5 0-.83.42-1.64 1-2.09V6.25c-1.09.53-2 1.84-2 3.25C6 11.31 7.55 13 9 13h4c1.45 0 3-1.69 3-3.5S14.5 6 13 6z\"\n  }))), `@unwrap`), mdx(\"p\", null, `Since VM2.13.1.`), mdx(\"p\", null, `If supplied, the script will be injected as is into the global scope of the page, i.e. without our standard wrapper like `, mdx(\"code\", {\n    parentName: \"p\",\n    \"className\": \"language-text\"\n  }, `window.VMxxx=function(){...}`), `.`), mdx(\"p\", null, `The `, mdx(\"a\", {\n    parentName: \"p\",\n    \"href\": \"#grant\"\n  }, mdx(\"code\", {\n    parentName: \"a\",\n    \"className\": \"language-text\"\n  }, `@grant`)), ` key is ignored so the script won't have access to `, mdx(\"code\", {\n    parentName: \"p\",\n    \"className\": \"language-text\"\n  }, `GM.*`), ` or `, mdx(\"code\", {\n    parentName: \"p\",\n    \"className\": \"language-text\"\n  }, `GM_*`), ` API.\nThe `, mdx(\"a\", {\n    parentName: \"p\",\n    \"href\": \"#inject-into\"\n  }, mdx(\"code\", {\n    parentName: \"a\",\n    \"className\": \"language-text\"\n  }, `@inject-into`)), ` key is supported as usual.`), mdx(\"p\", null, `A typical use case is direct access to global page variables declared as `, mdx(\"code\", {\n    parentName: \"p\",\n    \"className\": \"language-text\"\n  }, `const`), ` or `, mdx(\"code\", {\n    parentName: \"p\",\n    \"className\": \"language-text\"\n  }, `let`), `. In a standard userscript you would have to create a `, mdx(\"code\", {\n    parentName: \"p\",\n    \"className\": \"language-text\"\n  }, `script`), ` element yourself explicitly by using `, mdx(\"code\", {\n    parentName: \"p\",\n    \"className\": \"language-text\"\n  }, `document.createElement`), ` or  `, mdx(\"a\", {\n    parentName: \"p\",\n    \"href\": \"/api/gm/#gm_addelement\"\n  }, mdx(\"code\", {\n    parentName: \"a\",\n    \"className\": \"language-text\"\n  }, `GM_addElement`)), `, then transfer the result via a `, mdx(\"code\", {\n    parentName: \"p\",\n    \"className\": \"language-text\"\n  }, `CustomEvent`), ` or `, mdx(\"code\", {\n    parentName: \"p\",\n    \"className\": \"language-text\"\n  }, `unsafeWindow.foo`), `.`), mdx(\"p\", null, `Another use case is migration from other extensions that run your JavaScript code as is, without userscript API.`));\n}\n;\nMDXContent.isMDXComponent = true;","tableOfContents":{"items":[{"url":"#name","title":"@name"},{"url":"#namespace","title":"@namespace"},{"url":"#match--exclude-match","title":"@match / @exclude-match"},{"url":"#include--exclude","title":"@include / @exclude"},{"url":"#version","title":"@version"},{"url":"#description","title":"@description"},{"url":"#icon","title":"@icon"},{"url":"#require","title":"@require"},{"url":"#resource","title":"@resource"},{"url":"#run-at","title":"@run-at"},{"url":"#noframes","title":"@noframes"},{"url":"#grant","title":"@grant"},{"url":"#inject-into","title":"@inject-into"},{"url":"#downloadurl","title":"@downloadURL"},{"url":"#supporturl","title":"@supportURL"},{"url":"#homepageurl","title":"@homepageURL"},{"url":"#unwrap","title":"@unwrap"}]}}},"pageContext":{"id":"df6f63cf-e376-5f88-87e5-e380a70ac562","fields__slug":"/api/metadata-block/","__params":{"fields__slug":"api"}}},"staticQueryHashes":["1878747374","2344890832","323714418"]}