{"componentChunkName":"component---src-pages-mdx-fields-slug-index-js","path":"/api/gm/","result":{"data":{"mdx":{"fields":{"slug":"/api/gm/"},"frontmatter":{"title":"GM_* APIs","date":"April 25, 2018","sidebar":{"match":"/api/","order":0}},"body":"const _excluded = [\"components\"];\n\nfunction _extends() { _extends = Object.assign ? Object.assign.bind() : function (target) { for (var i = 1; i < arguments.length; i++) { var source = arguments[i]; for (var key in source) { if (Object.prototype.hasOwnProperty.call(source, key)) { target[key] = source[key]; } } } return target; }; return _extends.apply(this, arguments); }\n\nfunction _objectWithoutProperties(source, excluded) { if (source == null) return {}; var target = _objectWithoutPropertiesLoose(source, excluded); var key, i; if (Object.getOwnPropertySymbols) { var sourceSymbolKeys = Object.getOwnPropertySymbols(source); for (i = 0; i < sourceSymbolKeys.length; i++) { key = sourceSymbolKeys[i]; if (excluded.indexOf(key) >= 0) continue; if (!Object.prototype.propertyIsEnumerable.call(source, key)) continue; target[key] = source[key]; } } return target; }\n\nfunction _objectWithoutPropertiesLoose(source, excluded) { if (source == null) return {}; var target = {}; var sourceKeys = Object.keys(source); var key, i; for (i = 0; i < sourceKeys.length; i++) { key = sourceKeys[i]; if (excluded.indexOf(key) >= 0) continue; target[key] = source[key]; } return target; }\n\n/* @jsxRuntime classic */\n\n/* @jsx mdx */\nconst _frontmatter = {\n  \"title\": \"GM_* APIs\",\n  \"date\": \"2018-04-25T15:15:15.000Z\",\n  \"path\": \"/api/gm/\",\n  \"redirect_from\": [\"/api/\"],\n  \"sidebar\": {\n    \"match\": \"/api/\",\n    \"order\": 0\n  }\n};\nconst layoutProps = {\n  _frontmatter\n};\nconst MDXLayout = \"wrapper\";\nreturn function MDXContent(_ref) {\n  let {\n    components\n  } = _ref,\n      props = _objectWithoutProperties(_ref, _excluded);\n\n  return mdx(MDXLayout, _extends({}, layoutProps, props, {\n    components: components,\n    mdxType: \"MDXLayout\"\n  }), mdx(\"p\", null, `Violentmonkey APIs are derived from those in Greasemonkey v3, and most of them work the same way, `, mdx(\"code\", {\n    parentName: \"p\",\n    \"className\": \"language-text\"\n  }, `GM.*`), ` `, mdx(\"a\", {\n    parentName: \"p\",\n    \"href\": \"https://wiki.greasespot.net/Greasemonkey_Manual:API\",\n    \"target\": \"_blank\",\n    \"rel\": \"noopener noreferrer\"\n  }, `Greasemonkey v4-compatible`), ` aliases were added in VM2.12.0.`), mdx(\"h2\", {\n    \"id\": \"gm_\",\n    \"style\": {\n      \"position\": \"relative\"\n    }\n  }, mdx(\"a\", {\n    parentName: \"h2\",\n    \"href\": \"#gm_\",\n    \"aria-label\": \"gm_ permalink\",\n    \"className\": \"anchor before\"\n  }, mdx(\"svg\", {\n    parentName: \"a\",\n    \"aria-hidden\": \"true\",\n    \"focusable\": \"false\",\n    \"height\": \"16\",\n    \"version\": \"1.1\",\n    \"viewBox\": \"0 0 16 16\",\n    \"width\": \"16\"\n  }, mdx(\"path\", {\n    parentName: \"svg\",\n    \"fillRule\": \"evenodd\",\n    \"d\": \"M4 9h1v1H4c-1.5 0-3-1.69-3-3.5S2.55 3 4 3h4c1.45 0 3 1.69 3 3.5 0 1.41-.91 2.72-2 3.25V8.59c.58-.45 1-1.27 1-2.09C10 5.22 8.98 4 8 4H4c-.98 0-2 1.22-2 2.5S3 9 4 9zm9-3h-1v1h1c1 0 2 1.22 2 2.5S13.98 12 13 12H9c-.98 0-2-1.22-2-2.5 0-.83.42-1.64 1-2.09V6.25c-1.09.53-2 1.84-2 3.25C6 11.31 7.55 13 9 13h4c1.45 0 3-1.69 3-3.5S14.5 6 13 6z\"\n  }))), `GM_*`), mdx(\"p\", null, mdx(\"code\", {\n    parentName: \"p\",\n    \"className\": \"language-text\"\n  }, `GM_*`), ` are a group of special APIs provided by Violentmonkey.`), mdx(\"h3\", {\n    \"id\": \"gm_info\",\n    \"style\": {\n      \"position\": \"relative\"\n    }\n  }, mdx(\"a\", {\n    parentName: \"h3\",\n    \"href\": \"#gm_info\",\n    \"aria-label\": \"gm_info permalink\",\n    \"className\": \"anchor before\"\n  }, mdx(\"svg\", {\n    parentName: \"a\",\n    \"aria-hidden\": \"true\",\n    \"focusable\": \"false\",\n    \"height\": \"16\",\n    \"version\": \"1.1\",\n    \"viewBox\": \"0 0 16 16\",\n    \"width\": \"16\"\n  }, mdx(\"path\", {\n    parentName: \"svg\",\n    \"fillRule\": \"evenodd\",\n    \"d\": \"M4 9h1v1H4c-1.5 0-3-1.69-3-3.5S2.55 3 4 3h4c1.45 0 3 1.69 3 3.5 0 1.41-.91 2.72-2 3.25V8.59c.58-.45 1-1.27 1-2.09C10 5.22 8.98 4 8 4H4c-.98 0-2 1.22-2 2.5S3 9 4 9zm9-3h-1v1h1c1 0 2 1.22 2 2.5S13.98 12 13 12H9c-.98 0-2-1.22-2-2.5 0-.83.42-1.64 1-2.09V6.25c-1.09.53-2 1.84-2 3.25C6 11.31 7.55 13 9 13h4c1.45 0 3-1.69 3-3.5S14.5 6 13 6z\"\n  }))), `GM_info`), mdx(\"p\", null, `An object that exposes information about the current userscript. It has following properties:`), mdx(\"ul\", null, mdx(\"li\", {\n    parentName: \"ul\"\n  }, mdx(\"p\", {\n    parentName: \"li\"\n  }, mdx(\"code\", {\n    parentName: \"p\",\n    \"className\": \"language-text\"\n  }, `uuid`), ` `, mdx(\"em\", {\n    parentName: \"p\"\n  }, `string`)), mdx(\"p\", {\n    parentName: \"li\"\n  }, `  A unique ID of the script.`)), mdx(\"li\", {\n    parentName: \"ul\"\n  }, mdx(\"p\", {\n    parentName: \"li\"\n  }, mdx(\"code\", {\n    parentName: \"p\",\n    \"className\": \"language-text\"\n  }, `scriptMetaStr`), ` `, mdx(\"em\", {\n    parentName: \"p\"\n  }, `string`)), mdx(\"p\", {\n    parentName: \"li\"\n  }, `  The meta block of the script.`)), mdx(\"li\", {\n    parentName: \"ul\"\n  }, mdx(\"p\", {\n    parentName: \"li\"\n  }, mdx(\"code\", {\n    parentName: \"p\",\n    \"className\": \"language-text\"\n  }, `scriptWillUpdate`), ` `, mdx(\"em\", {\n    parentName: \"p\"\n  }, `boolean`)), mdx(\"p\", {\n    parentName: \"li\"\n  }, `  Whether the script will be updated automatically.`)), mdx(\"li\", {\n    parentName: \"ul\"\n  }, mdx(\"p\", {\n    parentName: \"li\"\n  }, mdx(\"code\", {\n    parentName: \"p\",\n    \"className\": \"language-text\"\n  }, `scriptHandler`), ` `, mdx(\"em\", {\n    parentName: \"p\"\n  }, `string`)), mdx(\"p\", {\n    parentName: \"li\"\n  }, `  The name of userscript manager, which should be the string `, mdx(\"code\", {\n    parentName: \"p\",\n    \"className\": \"language-text\"\n  }, `Violentmonkey`), `.`)), mdx(\"li\", {\n    parentName: \"ul\"\n  }, mdx(\"p\", {\n    parentName: \"li\"\n  }, mdx(\"code\", {\n    parentName: \"p\",\n    \"className\": \"language-text\"\n  }, `version`), ` `, mdx(\"em\", {\n    parentName: \"p\"\n  }, `string`)), mdx(\"p\", {\n    parentName: \"li\"\n  }, `  Version of Violentmonkey.`)), mdx(\"li\", {\n    parentName: \"ul\"\n  }, mdx(\"p\", {\n    parentName: \"li\"\n  }, mdx(\"code\", {\n    parentName: \"p\",\n    \"className\": \"language-text\"\n  }, `platform`), ` `, mdx(\"em\", {\n    parentName: \"p\"\n  }, `object`), ` `, mdx(\"em\", {\n    parentName: \"p\"\n  }, `(since VM2.12.4)`)), mdx(\"p\", {\n    parentName: \"li\"\n  }, `  Unlike `, mdx(\"code\", {\n    parentName: \"p\",\n    \"className\": \"language-text\"\n  }, `navigator.userAgent`), `, which can be overriden by other extensions/userscripts or by devtools in device-emulation mode, `, mdx(\"code\", {\n    parentName: \"p\",\n    \"className\": \"language-text\"\n  }, `GM_info.platform`), ` is more reliable as the data is obtained in the background page of Violentmonkey using a specialized extension API (browser.runtime.getPlatformInfo and getBrowserInfo).`), mdx(\"ul\", {\n    parentName: \"li\"\n  }, mdx(\"li\", {\n    parentName: \"ul\"\n  }, mdx(\"p\", {\n    parentName: \"li\"\n  }, mdx(\"code\", {\n    parentName: \"p\",\n    \"className\": \"language-text\"\n  }, `arch`), ` `, mdx(\"em\", {\n    parentName: \"p\"\n  }, `string`)), mdx(\"p\", {\n    parentName: \"li\"\n  }, `  One of \"arm\", \"mips\", \"mips64\", \"x86-32\", \"x86-64\".\n`)), mdx(\"li\", {\n    parentName: \"ul\"\n  }, mdx(\"p\", {\n    parentName: \"li\"\n  }, mdx(\"code\", {\n    parentName: \"p\",\n    \"className\": \"language-text\"\n  }, `browserName`), ` `, mdx(\"em\", {\n    parentName: \"p\"\n  }, `string`)), mdx(\"p\", {\n    parentName: \"li\"\n  }, `  \"chrome\", \"firefox\" or whatever was returned by the API.`)), mdx(\"li\", {\n    parentName: \"ul\"\n  }, mdx(\"p\", {\n    parentName: \"li\"\n  }, mdx(\"code\", {\n    parentName: \"p\",\n    \"className\": \"language-text\"\n  }, `browserVersion`), ` `, mdx(\"em\", {\n    parentName: \"p\"\n  }, `string`))), mdx(\"li\", {\n    parentName: \"ul\"\n  }, mdx(\"p\", {\n    parentName: \"li\"\n  }, mdx(\"code\", {\n    parentName: \"p\",\n    \"className\": \"language-text\"\n  }, `os`), ` `, mdx(\"em\", {\n    parentName: \"p\"\n  }, `string`)), mdx(\"p\", {\n    parentName: \"li\"\n  }, `  One of \"android\", \"cros\", \"linux\", \"mac\", \"openbsd\", \"win\".\n`)))), mdx(\"li\", {\n    parentName: \"ul\"\n  }, mdx(\"p\", {\n    parentName: \"li\"\n  }, mdx(\"code\", {\n    parentName: \"p\",\n    \"className\": \"language-text\"\n  }, `script`), ` `, mdx(\"em\", {\n    parentName: \"p\"\n  }, `object`)), mdx(\"p\", {\n    parentName: \"li\"\n  }, `  Contains structured fields from the `, mdx(\"a\", {\n    parentName: \"p\",\n    \"href\": \"../metadata-block/\"\n  }, `Metadata Block`), `:`), mdx(\"ul\", {\n    parentName: \"li\"\n  }, mdx(\"li\", {\n    parentName: \"ul\"\n  }, mdx(\"code\", {\n    parentName: \"li\",\n    \"className\": \"language-text\"\n  }, `description`), ` `, mdx(\"em\", {\n    parentName: \"li\"\n  }, `string`)), mdx(\"li\", {\n    parentName: \"ul\"\n  }, mdx(\"code\", {\n    parentName: \"li\",\n    \"className\": \"language-text\"\n  }, `excludes`), ` `, mdx(\"em\", {\n    parentName: \"li\"\n  }, `array of string`)), mdx(\"li\", {\n    parentName: \"ul\"\n  }, mdx(\"code\", {\n    parentName: \"li\",\n    \"className\": \"language-text\"\n  }, `includes`), ` `, mdx(\"em\", {\n    parentName: \"li\"\n  }, `array of string`)), mdx(\"li\", {\n    parentName: \"ul\"\n  }, mdx(\"code\", {\n    parentName: \"li\",\n    \"className\": \"language-text\"\n  }, `matches`), ` `, mdx(\"em\", {\n    parentName: \"li\"\n  }, `array of string`)), mdx(\"li\", {\n    parentName: \"ul\"\n  }, mdx(\"code\", {\n    parentName: \"li\",\n    \"className\": \"language-text\"\n  }, `name`), ` `, mdx(\"em\", {\n    parentName: \"li\"\n  }, `string`)), mdx(\"li\", {\n    parentName: \"ul\"\n  }, mdx(\"code\", {\n    parentName: \"li\",\n    \"className\": \"language-text\"\n  }, `namespace`), ` `, mdx(\"em\", {\n    parentName: \"li\"\n  }, `string`)), mdx(\"li\", {\n    parentName: \"ul\"\n  }, mdx(\"code\", {\n    parentName: \"li\",\n    \"className\": \"language-text\"\n  }, `resources`), ` `, mdx(\"em\", {\n    parentName: \"li\"\n  }, `array of {name, url}`)), mdx(\"li\", {\n    parentName: \"ul\"\n  }, mdx(\"code\", {\n    parentName: \"li\",\n    \"className\": \"language-text\"\n  }, `runAt`), ` `, mdx(\"em\", {\n    parentName: \"li\"\n  }, `string`)), mdx(\"li\", {\n    parentName: \"ul\"\n  }, mdx(\"code\", {\n    parentName: \"li\",\n    \"className\": \"language-text\"\n  }, `version`), ` `, mdx(\"em\", {\n    parentName: \"li\"\n  }, `string`)))), mdx(\"li\", {\n    parentName: \"ul\"\n  }, mdx(\"p\", {\n    parentName: \"li\"\n  }, mdx(\"code\", {\n    parentName: \"p\",\n    \"className\": \"language-text\"\n  }, `injectInto`), ` `, mdx(\"em\", {\n    parentName: \"p\"\n  }, `string`), ` `, mdx(\"em\", {\n    parentName: \"p\"\n  }, `(since VM2.10.0)`)), mdx(\"p\", {\n    parentName: \"li\"\n  }, `  The injection mode of current script. See `, mdx(\"a\", {\n    parentName: \"p\",\n    \"href\": \"/api/metadata-block/#inject-into\"\n  }, mdx(\"code\", {\n    parentName: \"a\",\n    \"className\": \"language-text\"\n  }, `@inject-mode`)), ` for more information.`))), mdx(\"h3\", {\n    \"id\": \"gm_getvalue\",\n    \"style\": {\n      \"position\": \"relative\"\n    }\n  }, mdx(\"a\", {\n    parentName: \"h3\",\n    \"href\": \"#gm_getvalue\",\n    \"aria-label\": \"gm_getvalue permalink\",\n    \"className\": \"anchor before\"\n  }, mdx(\"svg\", {\n    parentName: \"a\",\n    \"aria-hidden\": \"true\",\n    \"focusable\": \"false\",\n    \"height\": \"16\",\n    \"version\": \"1.1\",\n    \"viewBox\": \"0 0 16 16\",\n    \"width\": \"16\"\n  }, mdx(\"path\", {\n    parentName: \"svg\",\n    \"fillRule\": \"evenodd\",\n    \"d\": \"M4 9h1v1H4c-1.5 0-3-1.69-3-3.5S2.55 3 4 3h4c1.45 0 3 1.69 3 3.5 0 1.41-.91 2.72-2 3.25V8.59c.58-.45 1-1.27 1-2.09C10 5.22 8.98 4 8 4H4c-.98 0-2 1.22-2 2.5S3 9 4 9zm9-3h-1v1h1c1 0 2 1.22 2 2.5S13.98 12 13 12H9c-.98 0-2-1.22-2-2.5 0-.83.42-1.64 1-2.09V6.25c-1.09.53-2 1.84-2 3.25C6 11.31 7.55 13 9 13h4c1.45 0 3-1.69 3-3.5S14.5 6 13 6z\"\n  }))), `GM_getValue`), mdx(\"p\", null, `Retrieves a value for current script from storage.`), mdx(\"div\", {\n    \"className\": \"gatsby-highlight\",\n    \"data-language\": \"js\"\n  }, mdx(\"pre\", {\n    parentName: \"div\",\n    \"className\": \"language-js\"\n  }, mdx(\"code\", {\n    parentName: \"pre\",\n    \"className\": \"language-js\"\n  }, mdx(\"span\", {\n    parentName: \"code\",\n    \"className\": \"token keyword\"\n  }, `let`), ` value `, mdx(\"span\", {\n    parentName: \"code\",\n    \"className\": \"token operator\"\n  }, `=`), ` `, mdx(\"span\", {\n    parentName: \"code\",\n    \"className\": \"token function\"\n  }, `GM_getValue`), mdx(\"span\", {\n    parentName: \"code\",\n    \"className\": \"token punctuation\"\n  }, `(`), `key`, mdx(\"span\", {\n    parentName: \"code\",\n    \"className\": \"token punctuation\"\n  }, `,`), ` defaultValue`, mdx(\"span\", {\n    parentName: \"code\",\n    \"className\": \"token punctuation\"\n  }, `)`)))), mdx(\"ul\", null, mdx(\"li\", {\n    parentName: \"ul\"\n  }, mdx(\"p\", {\n    parentName: \"li\"\n  }, mdx(\"code\", {\n    parentName: \"p\",\n    \"className\": \"language-text\"\n  }, `key`), ` `, mdx(\"em\", {\n    parentName: \"p\"\n  }, `string`)), mdx(\"p\", {\n    parentName: \"li\"\n  }, `  The name for `, mdx(\"code\", {\n    parentName: \"p\",\n    \"className\": \"language-text\"\n  }, `value`), ` to load.`)), mdx(\"li\", {\n    parentName: \"ul\"\n  }, mdx(\"p\", {\n    parentName: \"li\"\n  }, mdx(\"code\", {\n    parentName: \"p\",\n    \"className\": \"language-text\"\n  }, `defaultValue`), ` `, mdx(\"em\", {\n    parentName: \"p\"\n  }, `any`)), mdx(\"p\", {\n    parentName: \"li\"\n  }, `  The default value to return if no value exists in the storage.`))), mdx(\"h3\", {\n    \"id\": \"gm_setvalue\",\n    \"style\": {\n      \"position\": \"relative\"\n    }\n  }, mdx(\"a\", {\n    parentName: \"h3\",\n    \"href\": \"#gm_setvalue\",\n    \"aria-label\": \"gm_setvalue permalink\",\n    \"className\": \"anchor before\"\n  }, mdx(\"svg\", {\n    parentName: \"a\",\n    \"aria-hidden\": \"true\",\n    \"focusable\": \"false\",\n    \"height\": \"16\",\n    \"version\": \"1.1\",\n    \"viewBox\": \"0 0 16 16\",\n    \"width\": \"16\"\n  }, mdx(\"path\", {\n    parentName: \"svg\",\n    \"fillRule\": \"evenodd\",\n    \"d\": \"M4 9h1v1H4c-1.5 0-3-1.69-3-3.5S2.55 3 4 3h4c1.45 0 3 1.69 3 3.5 0 1.41-.91 2.72-2 3.25V8.59c.58-.45 1-1.27 1-2.09C10 5.22 8.98 4 8 4H4c-.98 0-2 1.22-2 2.5S3 9 4 9zm9-3h-1v1h1c1 0 2 1.22 2 2.5S13.98 12 13 12H9c-.98 0-2-1.22-2-2.5 0-.83.42-1.64 1-2.09V6.25c-1.09.53-2 1.84-2 3.25C6 11.31 7.55 13 9 13h4c1.45 0 3-1.69 3-3.5S14.5 6 13 6z\"\n  }))), `GM_setValue`), mdx(\"p\", null, `Sets a key / value pair for current script to storage.`), mdx(\"div\", {\n    \"className\": \"gatsby-highlight\",\n    \"data-language\": \"js\"\n  }, mdx(\"pre\", {\n    parentName: \"div\",\n    \"className\": \"language-js\"\n  }, mdx(\"code\", {\n    parentName: \"pre\",\n    \"className\": \"language-js\"\n  }, mdx(\"span\", {\n    parentName: \"code\",\n    \"className\": \"token function\"\n  }, `GM_setValue`), mdx(\"span\", {\n    parentName: \"code\",\n    \"className\": \"token punctuation\"\n  }, `(`), `key`, mdx(\"span\", {\n    parentName: \"code\",\n    \"className\": \"token punctuation\"\n  }, `,`), ` value`, mdx(\"span\", {\n    parentName: \"code\",\n    \"className\": \"token punctuation\"\n  }, `)`)))), mdx(\"ul\", null, mdx(\"li\", {\n    parentName: \"ul\"\n  }, mdx(\"p\", {\n    parentName: \"li\"\n  }, mdx(\"code\", {\n    parentName: \"p\",\n    \"className\": \"language-text\"\n  }, `key`), ` `, mdx(\"em\", {\n    parentName: \"p\"\n  }, `string`)), mdx(\"p\", {\n    parentName: \"li\"\n  }, `  The unique name for `, mdx(\"code\", {\n    parentName: \"p\",\n    \"className\": \"language-text\"\n  }, `value`), ` within this script.`)), mdx(\"li\", {\n    parentName: \"ul\"\n  }, mdx(\"p\", {\n    parentName: \"li\"\n  }, mdx(\"code\", {\n    parentName: \"p\",\n    \"className\": \"language-text\"\n  }, `value`), ` `, mdx(\"em\", {\n    parentName: \"p\"\n  }, `any`)), mdx(\"p\", {\n    parentName: \"li\"\n  }, `  The value to be stored, which must be `, mdx(\"em\", {\n    parentName: \"p\"\n  }, `JSON serializable`), ` (string, number, boolean, null, or an array/object consisting of these types) so for example you can't store DOM elements or objects with cyclic dependencies.`))), mdx(\"h3\", {\n    \"id\": \"gm_deletevalue\",\n    \"style\": {\n      \"position\": \"relative\"\n    }\n  }, mdx(\"a\", {\n    parentName: \"h3\",\n    \"href\": \"#gm_deletevalue\",\n    \"aria-label\": \"gm_deletevalue permalink\",\n    \"className\": \"anchor before\"\n  }, mdx(\"svg\", {\n    parentName: \"a\",\n    \"aria-hidden\": \"true\",\n    \"focusable\": \"false\",\n    \"height\": \"16\",\n    \"version\": \"1.1\",\n    \"viewBox\": \"0 0 16 16\",\n    \"width\": \"16\"\n  }, mdx(\"path\", {\n    parentName: \"svg\",\n    \"fillRule\": \"evenodd\",\n    \"d\": \"M4 9h1v1H4c-1.5 0-3-1.69-3-3.5S2.55 3 4 3h4c1.45 0 3 1.69 3 3.5 0 1.41-.91 2.72-2 3.25V8.59c.58-.45 1-1.27 1-2.09C10 5.22 8.98 4 8 4H4c-.98 0-2 1.22-2 2.5S3 9 4 9zm9-3h-1v1h1c1 0 2 1.22 2 2.5S13.98 12 13 12H9c-.98 0-2-1.22-2-2.5 0-.83.42-1.64 1-2.09V6.25c-1.09.53-2 1.84-2 3.25C6 11.31 7.55 13 9 13h4c1.45 0 3-1.69 3-3.5S14.5 6 13 6z\"\n  }))), `GM_deleteValue`), mdx(\"p\", null, `Deletes an existing key / value pair for current script from storage.`), mdx(\"div\", {\n    \"className\": \"gatsby-highlight\",\n    \"data-language\": \"js\"\n  }, mdx(\"pre\", {\n    parentName: \"div\",\n    \"className\": \"language-js\"\n  }, mdx(\"code\", {\n    parentName: \"pre\",\n    \"className\": \"language-js\"\n  }, mdx(\"span\", {\n    parentName: \"code\",\n    \"className\": \"token function\"\n  }, `GM_deleteValue`), mdx(\"span\", {\n    parentName: \"code\",\n    \"className\": \"token punctuation\"\n  }, `(`), `key`, mdx(\"span\", {\n    parentName: \"code\",\n    \"className\": \"token punctuation\"\n  }, `)`)))), mdx(\"ul\", null, mdx(\"li\", {\n    parentName: \"ul\"\n  }, mdx(\"p\", {\n    parentName: \"li\"\n  }, mdx(\"code\", {\n    parentName: \"p\",\n    \"className\": \"language-text\"\n  }, `key`), ` `, mdx(\"em\", {\n    parentName: \"p\"\n  }, `string`)), mdx(\"p\", {\n    parentName: \"li\"\n  }, `  The unique name for `, mdx(\"code\", {\n    parentName: \"p\",\n    \"className\": \"language-text\"\n  }, `value`), ` within this script.`))), mdx(\"h3\", {\n    \"id\": \"gm_listvalues\",\n    \"style\": {\n      \"position\": \"relative\"\n    }\n  }, mdx(\"a\", {\n    parentName: \"h3\",\n    \"href\": \"#gm_listvalues\",\n    \"aria-label\": \"gm_listvalues permalink\",\n    \"className\": \"anchor before\"\n  }, mdx(\"svg\", {\n    parentName: \"a\",\n    \"aria-hidden\": \"true\",\n    \"focusable\": \"false\",\n    \"height\": \"16\",\n    \"version\": \"1.1\",\n    \"viewBox\": \"0 0 16 16\",\n    \"width\": \"16\"\n  }, mdx(\"path\", {\n    parentName: \"svg\",\n    \"fillRule\": \"evenodd\",\n    \"d\": \"M4 9h1v1H4c-1.5 0-3-1.69-3-3.5S2.55 3 4 3h4c1.45 0 3 1.69 3 3.5 0 1.41-.91 2.72-2 3.25V8.59c.58-.45 1-1.27 1-2.09C10 5.22 8.98 4 8 4H4c-.98 0-2 1.22-2 2.5S3 9 4 9zm9-3h-1v1h1c1 0 2 1.22 2 2.5S13.98 12 13 12H9c-.98 0-2-1.22-2-2.5 0-.83.42-1.64 1-2.09V6.25c-1.09.53-2 1.84-2 3.25C6 11.31 7.55 13 9 13h4c1.45 0 3-1.69 3-3.5S14.5 6 13 6z\"\n  }))), `GM_listValues`), mdx(\"p\", null, `Returns an array of keys of all available values within this script.`), mdx(\"div\", {\n    \"className\": \"gatsby-highlight\",\n    \"data-language\": \"js\"\n  }, mdx(\"pre\", {\n    parentName: \"div\",\n    \"className\": \"language-js\"\n  }, mdx(\"code\", {\n    parentName: \"pre\",\n    \"className\": \"language-js\"\n  }, mdx(\"span\", {\n    parentName: \"code\",\n    \"className\": \"token keyword\"\n  }, `let`), ` arrayOfKeys `, mdx(\"span\", {\n    parentName: \"code\",\n    \"className\": \"token operator\"\n  }, `=`), ` `, mdx(\"span\", {\n    parentName: \"code\",\n    \"className\": \"token function\"\n  }, `GM_listValues`), mdx(\"span\", {\n    parentName: \"code\",\n    \"className\": \"token punctuation\"\n  }, `(`), mdx(\"span\", {\n    parentName: \"code\",\n    \"className\": \"token punctuation\"\n  }, `)`)))), mdx(\"h3\", {\n    \"id\": \"gm_addvaluechangelistener\",\n    \"style\": {\n      \"position\": \"relative\"\n    }\n  }, mdx(\"a\", {\n    parentName: \"h3\",\n    \"href\": \"#gm_addvaluechangelistener\",\n    \"aria-label\": \"gm_addvaluechangelistener permalink\",\n    \"className\": \"anchor before\"\n  }, mdx(\"svg\", {\n    parentName: \"a\",\n    \"aria-hidden\": \"true\",\n    \"focusable\": \"false\",\n    \"height\": \"16\",\n    \"version\": \"1.1\",\n    \"viewBox\": \"0 0 16 16\",\n    \"width\": \"16\"\n  }, mdx(\"path\", {\n    parentName: \"svg\",\n    \"fillRule\": \"evenodd\",\n    \"d\": \"M4 9h1v1H4c-1.5 0-3-1.69-3-3.5S2.55 3 4 3h4c1.45 0 3 1.69 3 3.5 0 1.41-.91 2.72-2 3.25V8.59c.58-.45 1-1.27 1-2.09C10 5.22 8.98 4 8 4H4c-.98 0-2 1.22-2 2.5S3 9 4 9zm9-3h-1v1h1c1 0 2 1.22 2 2.5S13.98 12 13 12H9c-.98 0-2-1.22-2-2.5 0-.83.42-1.64 1-2.09V6.25c-1.09.53-2 1.84-2 3.25C6 11.31 7.55 13 9 13h4c1.45 0 3-1.69 3-3.5S14.5 6 13 6z\"\n  }))), `GM_addValueChangeListener`), mdx(\"p\", null, `Adds a change listener to the storage and returns the listener ID.`), mdx(\"div\", {\n    \"className\": \"gatsby-highlight\",\n    \"data-language\": \"js\"\n  }, mdx(\"pre\", {\n    parentName: \"div\",\n    \"className\": \"language-js\"\n  }, mdx(\"code\", {\n    parentName: \"pre\",\n    \"className\": \"language-js\"\n  }, mdx(\"span\", {\n    parentName: \"code\",\n    \"className\": \"token keyword\"\n  }, `let`), ` listenerId `, mdx(\"span\", {\n    parentName: \"code\",\n    \"className\": \"token operator\"\n  }, `=`), ` `, mdx(\"span\", {\n    parentName: \"code\",\n    \"className\": \"token function\"\n  }, `GM_addValueChangeListener`), mdx(\"span\", {\n    parentName: \"code\",\n    \"className\": \"token punctuation\"\n  }, `(`), `name`, mdx(\"span\", {\n    parentName: \"code\",\n    \"className\": \"token punctuation\"\n  }, `,`), ` callback`, mdx(\"span\", {\n    parentName: \"code\",\n    \"className\": \"token punctuation\"\n  }, `)`)))), mdx(\"ul\", null, mdx(\"li\", {\n    parentName: \"ul\"\n  }, mdx(\"p\", {\n    parentName: \"li\"\n  }, mdx(\"code\", {\n    parentName: \"p\",\n    \"className\": \"language-text\"\n  }, `name`), ` `, mdx(\"em\", {\n    parentName: \"p\"\n  }, `string`)), mdx(\"p\", {\n    parentName: \"li\"\n  }, `  The name of the observed variable`)), mdx(\"li\", {\n    parentName: \"ul\"\n  }, mdx(\"p\", {\n    parentName: \"li\"\n  }, mdx(\"code\", {\n    parentName: \"p\",\n    \"className\": \"language-text\"\n  }, `callback`), ` `, mdx(\"em\", {\n    parentName: \"p\"\n  }, `function(name, oldValue, newValue, remote) {}`)), mdx(\"ul\", {\n    parentName: \"li\"\n  }, mdx(\"li\", {\n    parentName: \"ul\"\n  }, mdx(\"p\", {\n    parentName: \"li\"\n  }, mdx(\"code\", {\n    parentName: \"p\",\n    \"className\": \"language-text\"\n  }, `name`), ` `, mdx(\"em\", {\n    parentName: \"p\"\n  }, `string`)), mdx(\"p\", {\n    parentName: \"li\"\n  }, `  The name of the observed variable`)), mdx(\"li\", {\n    parentName: \"ul\"\n  }, mdx(\"p\", {\n    parentName: \"li\"\n  }, mdx(\"code\", {\n    parentName: \"p\",\n    \"className\": \"language-text\"\n  }, `oldValue`), ` `, mdx(\"em\", {\n    parentName: \"p\"\n  }, `any`)), mdx(\"p\", {\n    parentName: \"li\"\n  }, `  The old value of the observed variable (`, mdx(\"code\", {\n    parentName: \"p\",\n    \"className\": \"language-text\"\n  }, `undefined`), ` if it was created)`)), mdx(\"li\", {\n    parentName: \"ul\"\n  }, mdx(\"p\", {\n    parentName: \"li\"\n  }, mdx(\"code\", {\n    parentName: \"p\",\n    \"className\": \"language-text\"\n  }, `newValue`), ` `, mdx(\"em\", {\n    parentName: \"p\"\n  }, `any`)), mdx(\"p\", {\n    parentName: \"li\"\n  }, `  The new value of the observed variable (`, mdx(\"code\", {\n    parentName: \"p\",\n    \"className\": \"language-text\"\n  }, `undefined`), ` if it was deleted)`)), mdx(\"li\", {\n    parentName: \"ul\"\n  }, mdx(\"p\", {\n    parentName: \"li\"\n  }, mdx(\"code\", {\n    parentName: \"p\",\n    \"className\": \"language-text\"\n  }, `remote`), ` `, mdx(\"em\", {\n    parentName: \"p\"\n  }, `boolean`)), mdx(\"p\", {\n    parentName: \"li\"\n  }, `  `, mdx(\"code\", {\n    parentName: \"p\",\n    \"className\": \"language-text\"\n  }, `true`), ` if modified by the userscript instance of another tab or `, mdx(\"code\", {\n    parentName: \"p\",\n    \"className\": \"language-text\"\n  }, `false`), ` for this script instance. Can be used by scripts of different browser tabs to communicate with each other.`))))), mdx(\"h3\", {\n    \"id\": \"gm_removevaluechangelistener\",\n    \"style\": {\n      \"position\": \"relative\"\n    }\n  }, mdx(\"a\", {\n    parentName: \"h3\",\n    \"href\": \"#gm_removevaluechangelistener\",\n    \"aria-label\": \"gm_removevaluechangelistener permalink\",\n    \"className\": \"anchor before\"\n  }, mdx(\"svg\", {\n    parentName: \"a\",\n    \"aria-hidden\": \"true\",\n    \"focusable\": \"false\",\n    \"height\": \"16\",\n    \"version\": \"1.1\",\n    \"viewBox\": \"0 0 16 16\",\n    \"width\": \"16\"\n  }, mdx(\"path\", {\n    parentName: \"svg\",\n    \"fillRule\": \"evenodd\",\n    \"d\": \"M4 9h1v1H4c-1.5 0-3-1.69-3-3.5S2.55 3 4 3h4c1.45 0 3 1.69 3 3.5 0 1.41-.91 2.72-2 3.25V8.59c.58-.45 1-1.27 1-2.09C10 5.22 8.98 4 8 4H4c-.98 0-2 1.22-2 2.5S3 9 4 9zm9-3h-1v1h1c1 0 2 1.22 2 2.5S13.98 12 13 12H9c-.98 0-2-1.22-2-2.5 0-.83.42-1.64 1-2.09V6.25c-1.09.53-2 1.84-2 3.25C6 11.31 7.55 13 9 13h4c1.45 0 3-1.69 3-3.5S14.5 6 13 6z\"\n  }))), `GM_removeValueChangeListener`), mdx(\"p\", null, `Removes a change listener by its ID.`), mdx(\"div\", {\n    \"className\": \"gatsby-highlight\",\n    \"data-language\": \"js\"\n  }, mdx(\"pre\", {\n    parentName: \"div\",\n    \"className\": \"language-js\"\n  }, mdx(\"code\", {\n    parentName: \"pre\",\n    \"className\": \"language-js\"\n  }, mdx(\"span\", {\n    parentName: \"code\",\n    \"className\": \"token function\"\n  }, `GM_removeValueChangeListener`), mdx(\"span\", {\n    parentName: \"code\",\n    \"className\": \"token punctuation\"\n  }, `(`), `listenerId`, mdx(\"span\", {\n    parentName: \"code\",\n    \"className\": \"token punctuation\"\n  }, `)`)))), mdx(\"ul\", null, mdx(\"li\", {\n    parentName: \"ul\"\n  }, mdx(\"code\", {\n    parentName: \"li\",\n    \"className\": \"language-text\"\n  }, `listenerId`), ` `, mdx(\"em\", {\n    parentName: \"li\"\n  }, `string`))), mdx(\"h3\", {\n    \"id\": \"gm_getresourcetext\",\n    \"style\": {\n      \"position\": \"relative\"\n    }\n  }, mdx(\"a\", {\n    parentName: \"h3\",\n    \"href\": \"#gm_getresourcetext\",\n    \"aria-label\": \"gm_getresourcetext permalink\",\n    \"className\": \"anchor before\"\n  }, mdx(\"svg\", {\n    parentName: \"a\",\n    \"aria-hidden\": \"true\",\n    \"focusable\": \"false\",\n    \"height\": \"16\",\n    \"version\": \"1.1\",\n    \"viewBox\": \"0 0 16 16\",\n    \"width\": \"16\"\n  }, mdx(\"path\", {\n    parentName: \"svg\",\n    \"fillRule\": \"evenodd\",\n    \"d\": \"M4 9h1v1H4c-1.5 0-3-1.69-3-3.5S2.55 3 4 3h4c1.45 0 3 1.69 3 3.5 0 1.41-.91 2.72-2 3.25V8.59c.58-.45 1-1.27 1-2.09C10 5.22 8.98 4 8 4H4c-.98 0-2 1.22-2 2.5S3 9 4 9zm9-3h-1v1h1c1 0 2 1.22 2 2.5S13.98 12 13 12H9c-.98 0-2-1.22-2-2.5 0-.83.42-1.64 1-2.09V6.25c-1.09.53-2 1.84-2 3.25C6 11.31 7.55 13 9 13h4c1.45 0 3-1.69 3-3.5S14.5 6 13 6z\"\n  }))), `GM_getResourceText`), mdx(\"p\", null, `Retrieves a text resource from the metadata block.`), mdx(\"div\", {\n    \"className\": \"gatsby-highlight\",\n    \"data-language\": \"js\"\n  }, mdx(\"pre\", {\n    parentName: \"div\",\n    \"className\": \"language-js\"\n  }, mdx(\"code\", {\n    parentName: \"pre\",\n    \"className\": \"language-js\"\n  }, mdx(\"span\", {\n    parentName: \"code\",\n    \"className\": \"token keyword\"\n  }, `let`), ` text `, mdx(\"span\", {\n    parentName: \"code\",\n    \"className\": \"token operator\"\n  }, `=`), ` `, mdx(\"span\", {\n    parentName: \"code\",\n    \"className\": \"token function\"\n  }, `GM_getResourceText`), mdx(\"span\", {\n    parentName: \"code\",\n    \"className\": \"token punctuation\"\n  }, `(`), `name`, mdx(\"span\", {\n    parentName: \"code\",\n    \"className\": \"token punctuation\"\n  }, `)`)))), mdx(\"ul\", null, mdx(\"li\", {\n    parentName: \"ul\"\n  }, mdx(\"p\", {\n    parentName: \"li\"\n  }, mdx(\"code\", {\n    parentName: \"p\",\n    \"className\": \"language-text\"\n  }, `name`), ` `, mdx(\"em\", {\n    parentName: \"p\"\n  }, `string`)), mdx(\"p\", {\n    parentName: \"li\"\n  }, `  Name of a resource defined in the `, mdx(\"a\", {\n    parentName: \"p\",\n    \"href\": \"../metadata-block/#resource\"\n  }, `metadata block`), `.`))), mdx(\"h3\", {\n    \"id\": \"gm_getresourceurl\",\n    \"style\": {\n      \"position\": \"relative\"\n    }\n  }, mdx(\"a\", {\n    parentName: \"h3\",\n    \"href\": \"#gm_getresourceurl\",\n    \"aria-label\": \"gm_getresourceurl permalink\",\n    \"className\": \"anchor before\"\n  }, mdx(\"svg\", {\n    parentName: \"a\",\n    \"aria-hidden\": \"true\",\n    \"focusable\": \"false\",\n    \"height\": \"16\",\n    \"version\": \"1.1\",\n    \"viewBox\": \"0 0 16 16\",\n    \"width\": \"16\"\n  }, mdx(\"path\", {\n    parentName: \"svg\",\n    \"fillRule\": \"evenodd\",\n    \"d\": \"M4 9h1v1H4c-1.5 0-3-1.69-3-3.5S2.55 3 4 3h4c1.45 0 3 1.69 3 3.5 0 1.41-.91 2.72-2 3.25V8.59c.58-.45 1-1.27 1-2.09C10 5.22 8.98 4 8 4H4c-.98 0-2 1.22-2 2.5S3 9 4 9zm9-3h-1v1h1c1 0 2 1.22 2 2.5S13.98 12 13 12H9c-.98 0-2-1.22-2-2.5 0-.83.42-1.64 1-2.09V6.25c-1.09.53-2 1.84-2 3.25C6 11.31 7.55 13 9 13h4c1.45 0 3-1.69 3-3.5S14.5 6 13 6z\"\n  }))), `GM_getResourceURL`), mdx(\"p\", null, `Retrieves a `, mdx(\"code\", {\n    parentName: \"p\",\n    \"className\": \"language-text\"\n  }, `blob:`), ` or `, mdx(\"code\", {\n    parentName: \"p\",\n    \"className\": \"language-text\"\n  }, `data:`), ` URL of a resource from the metadata block.`), mdx(\"div\", {\n    \"className\": \"gatsby-highlight\",\n    \"data-language\": \"js\"\n  }, mdx(\"pre\", {\n    parentName: \"div\",\n    \"className\": \"language-js\"\n  }, mdx(\"code\", {\n    parentName: \"pre\",\n    \"className\": \"language-js\"\n  }, mdx(\"span\", {\n    parentName: \"code\",\n    \"className\": \"token keyword\"\n  }, `let`), ` blobUrl `, mdx(\"span\", {\n    parentName: \"code\",\n    \"className\": \"token operator\"\n  }, `=`), ` `, mdx(\"span\", {\n    parentName: \"code\",\n    \"className\": \"token function\"\n  }, `GM_getResourceURL`), mdx(\"span\", {\n    parentName: \"code\",\n    \"className\": \"token punctuation\"\n  }, `(`), `name`, mdx(\"span\", {\n    parentName: \"code\",\n    \"className\": \"token punctuation\"\n  }, `)`), mdx(\"span\", {\n    parentName: \"code\",\n    \"className\": \"token punctuation\"\n  }, `;`), `\n`, mdx(\"span\", {\n    parentName: \"code\",\n    \"className\": \"token keyword\"\n  }, `let`), ` blobOrDataUrl `, mdx(\"span\", {\n    parentName: \"code\",\n    \"className\": \"token operator\"\n  }, `=`), ` `, mdx(\"span\", {\n    parentName: \"code\",\n    \"className\": \"token function\"\n  }, `GM_getResourceURL`), mdx(\"span\", {\n    parentName: \"code\",\n    \"className\": \"token punctuation\"\n  }, `(`), `name`, mdx(\"span\", {\n    parentName: \"code\",\n    \"className\": \"token punctuation\"\n  }, `,`), ` isBlobUrl`, mdx(\"span\", {\n    parentName: \"code\",\n    \"className\": \"token punctuation\"\n  }, `)`), mdx(\"span\", {\n    parentName: \"code\",\n    \"className\": \"token punctuation\"\n  }, `;`)))), mdx(\"ul\", null, mdx(\"li\", {\n    parentName: \"ul\"\n  }, mdx(\"p\", {\n    parentName: \"li\"\n  }, mdx(\"code\", {\n    parentName: \"p\",\n    \"className\": \"language-text\"\n  }, `name`), ` `, mdx(\"em\", {\n    parentName: \"p\"\n  }, `string`)), mdx(\"p\", {\n    parentName: \"li\"\n  }, `  Name of a resource defined in the `, mdx(\"a\", {\n    parentName: \"p\",\n    \"href\": \"../metadata-block/#resource\"\n  }, `metadata block`), `.`)), mdx(\"li\", {\n    parentName: \"ul\"\n  }, mdx(\"p\", {\n    parentName: \"li\"\n  }, mdx(\"code\", {\n    parentName: \"p\",\n    \"className\": \"language-text\"\n  }, `isBlobUrl`), ` `, mdx(\"em\", {\n    parentName: \"p\"\n  }, `boolean`), ` (`, mdx(\"em\", {\n    parentName: \"p\"\n  }, `since VM2.13.1`), `, optional, default: `, mdx(\"code\", {\n    parentName: \"p\",\n    \"className\": \"language-text\"\n  }, `true`), `)`), mdx(\"ul\", {\n    parentName: \"li\"\n  }, mdx(\"li\", {\n    parentName: \"ul\"\n  }, mdx(\"p\", {\n    parentName: \"li\"\n  }, mdx(\"code\", {\n    parentName: \"p\",\n    \"className\": \"language-text\"\n  }, `true`), ` returns a `, mdx(\"code\", {\n    parentName: \"p\",\n    \"className\": \"language-text\"\n  }, `blob:`), ` URL. It's short and cacheable, so it's good for reusing in multiple DOM elements.`)), mdx(\"li\", {\n    parentName: \"ul\"\n  }, mdx(\"p\", {\n    parentName: \"li\"\n  }, mdx(\"code\", {\n    parentName: \"p\",\n    \"className\": \"language-text\"\n  }, `false`), ` returns a `, mdx(\"code\", {\n    parentName: \"p\",\n    \"className\": \"language-text\"\n  }, `data:`), ` URL. It's long so reusing it in DOM may be less performant due to the lack of caching, but it's particularly handy for direct synchronous decoding of the data on sites that forbid fetching `, mdx(\"code\", {\n    parentName: \"p\",\n    \"className\": \"language-text\"\n  }, `blob:`), ` in their CSP.`))))), mdx(\"p\", null, `Note: when setting this URL as `, mdx(\"code\", {\n    parentName: \"p\",\n    \"className\": \"language-text\"\n  }, `src`), ` or `, mdx(\"code\", {\n    parentName: \"p\",\n    \"className\": \"language-text\"\n  }, `href`), ` of a DOM element, it may fail on some sites with a particularly strict CSP that forbids `, mdx(\"code\", {\n    parentName: \"p\",\n    \"className\": \"language-text\"\n  }, `blob:`), ` or `, mdx(\"code\", {\n    parentName: \"p\",\n    \"className\": \"language-text\"\n  }, `data:`), ` URLs. Such sites are rare though. The workaround in Chrome is to use `, mdx(\"code\", {\n    parentName: \"p\",\n    \"className\": \"language-text\"\n  }, `GM_addElement`), `, whereas in Firefox you'll have to disable CSP either globally via `, mdx(\"code\", {\n    parentName: \"p\",\n    \"className\": \"language-text\"\n  }, `about:config`), ` or by using an additional extension that modifies HTTP headers selectively.`), mdx(\"h3\", {\n    \"id\": \"gm_addelement\",\n    \"style\": {\n      \"position\": \"relative\"\n    }\n  }, mdx(\"a\", {\n    parentName: \"h3\",\n    \"href\": \"#gm_addelement\",\n    \"aria-label\": \"gm_addelement permalink\",\n    \"className\": \"anchor before\"\n  }, mdx(\"svg\", {\n    parentName: \"a\",\n    \"aria-hidden\": \"true\",\n    \"focusable\": \"false\",\n    \"height\": \"16\",\n    \"version\": \"1.1\",\n    \"viewBox\": \"0 0 16 16\",\n    \"width\": \"16\"\n  }, mdx(\"path\", {\n    parentName: \"svg\",\n    \"fillRule\": \"evenodd\",\n    \"d\": \"M4 9h1v1H4c-1.5 0-3-1.69-3-3.5S2.55 3 4 3h4c1.45 0 3 1.69 3 3.5 0 1.41-.91 2.72-2 3.25V8.59c.58-.45 1-1.27 1-2.09C10 5.22 8.98 4 8 4H4c-.98 0-2 1.22-2 2.5S3 9 4 9zm9-3h-1v1h1c1 0 2 1.22 2 2.5S13.98 12 13 12H9c-.98 0-2-1.22-2-2.5 0-.83.42-1.64 1-2.09V6.25c-1.09.53-2 1.84-2 3.25C6 11.31 7.55 13 9 13h4c1.45 0 3-1.69 3-3.5S14.5 6 13 6z\"\n  }))), `GM_addElement`), mdx(\"p\", null, mdx(\"em\", {\n    parentName: \"p\"\n  }, `Since VM2.13.1`)), mdx(\"p\", null, `Appends and returns an element with the specified attributes.`), mdx(\"div\", {\n    \"className\": \"gatsby-highlight\",\n    \"data-language\": \"js\"\n  }, mdx(\"pre\", {\n    parentName: \"div\",\n    \"className\": \"language-js\"\n  }, mdx(\"code\", {\n    parentName: \"pre\",\n    \"className\": \"language-js\"\n  }, mdx(\"span\", {\n    parentName: \"code\",\n    \"className\": \"token keyword\"\n  }, `let`), ` element1 `, mdx(\"span\", {\n    parentName: \"code\",\n    \"className\": \"token operator\"\n  }, `=`), ` `, mdx(\"span\", {\n    parentName: \"code\",\n    \"className\": \"token function\"\n  }, `GM_addElement`), mdx(\"span\", {\n    parentName: \"code\",\n    \"className\": \"token punctuation\"\n  }, `(`), `tagName`, mdx(\"span\", {\n    parentName: \"code\",\n    \"className\": \"token punctuation\"\n  }, `,`), ` attributes`, mdx(\"span\", {\n    parentName: \"code\",\n    \"className\": \"token punctuation\"\n  }, `)`), mdx(\"span\", {\n    parentName: \"code\",\n    \"className\": \"token punctuation\"\n  }, `;`), `\n`, mdx(\"span\", {\n    parentName: \"code\",\n    \"className\": \"token keyword\"\n  }, `let`), ` element2 `, mdx(\"span\", {\n    parentName: \"code\",\n    \"className\": \"token operator\"\n  }, `=`), ` `, mdx(\"span\", {\n    parentName: \"code\",\n    \"className\": \"token function\"\n  }, `GM_addElement`), mdx(\"span\", {\n    parentName: \"code\",\n    \"className\": \"token punctuation\"\n  }, `(`), `parentNode`, mdx(\"span\", {\n    parentName: \"code\",\n    \"className\": \"token punctuation\"\n  }, `,`), ` tagName`, mdx(\"span\", {\n    parentName: \"code\",\n    \"className\": \"token punctuation\"\n  }, `,`), ` attributes`, mdx(\"span\", {\n    parentName: \"code\",\n    \"className\": \"token punctuation\"\n  }, `)`), mdx(\"span\", {\n    parentName: \"code\",\n    \"className\": \"token punctuation\"\n  }, `;`)))), mdx(\"ul\", null, mdx(\"li\", {\n    parentName: \"ul\"\n  }, mdx(\"p\", {\n    parentName: \"li\"\n  }, mdx(\"code\", {\n    parentName: \"p\",\n    \"className\": \"language-text\"\n  }, `parentNode`), ` `, mdx(\"em\", {\n    parentName: \"p\"\n  }, `Node | Element | ShadowRoot`), ` (optional)`), mdx(\"p\", {\n    parentName: \"li\"\n  }, `  The parent node to which the new node will be appended.`), mdx(\"p\", {\n    parentName: \"li\"\n  }, `  It can be inside ShadowDOM: `, mdx(\"code\", {\n    parentName: \"p\",\n    \"className\": \"language-text\"\n  }, `someElement.shadowRoot`), `.`), mdx(\"p\", {\n    parentName: \"li\"\n  }, `  When omitted, it'll be determined automatically:`), mdx(\"ol\", {\n    parentName: \"li\"\n  }, mdx(\"li\", {\n    parentName: \"ol\"\n  }, mdx(\"code\", {\n    parentName: \"li\",\n    \"className\": \"language-text\"\n  }, `document.head`), ` (`, mdx(\"code\", {\n    parentName: \"li\",\n    \"className\": \"language-text\"\n  }, `<head>`), `) for `, mdx(\"code\", {\n    parentName: \"li\",\n    \"className\": \"language-text\"\n  }, `script`), `, `, mdx(\"code\", {\n    parentName: \"li\",\n    \"className\": \"language-text\"\n  }, `link`), `, `, mdx(\"code\", {\n    parentName: \"li\",\n    \"className\": \"language-text\"\n  }, `style`), `, `, mdx(\"code\", {\n    parentName: \"li\",\n    \"className\": \"language-text\"\n  }, `meta`), ` tags.`), mdx(\"li\", {\n    parentName: \"ol\"\n  }, mdx(\"code\", {\n    parentName: \"li\",\n    \"className\": \"language-text\"\n  }, `document.body`), ` (`, mdx(\"code\", {\n    parentName: \"li\",\n    \"className\": \"language-text\"\n  }, `<body>`), `) for other tags or when there's no `, mdx(\"code\", {\n    parentName: \"li\",\n    \"className\": \"language-text\"\n  }, `<head>`), `.`), mdx(\"li\", {\n    parentName: \"ol\"\n  }, mdx(\"code\", {\n    parentName: \"li\",\n    \"className\": \"language-text\"\n  }, `document.documentElement`), ` (`, mdx(\"code\", {\n    parentName: \"li\",\n    \"className\": \"language-text\"\n  }, `<html>`), ` or an XML root node) otherwise.`))), mdx(\"li\", {\n    parentName: \"ul\"\n  }, mdx(\"p\", {\n    parentName: \"li\"\n  }, mdx(\"code\", {\n    parentName: \"p\",\n    \"className\": \"language-text\"\n  }, `tagName`), ` `, mdx(\"em\", {\n    parentName: \"p\"\n  }, `string`)), mdx(\"p\", {\n    parentName: \"li\"\n  }, `  A tag name like `, mdx(\"code\", {\n    parentName: \"p\",\n    \"className\": \"language-text\"\n  }, `'script'`), `. Any valid HTML tag can be used, but the only motivation for this API was to add `, mdx(\"code\", {\n    parentName: \"p\",\n    \"className\": \"language-text\"\n  }, `script`), `, `, mdx(\"code\", {\n    parentName: \"p\",\n    \"className\": \"language-text\"\n  }, `link`), `, `, mdx(\"code\", {\n    parentName: \"p\",\n    \"className\": \"language-text\"\n  }, `style`), ` elements when they are disallowed by a strict `, mdx(\"code\", {\n    parentName: \"p\",\n    \"className\": \"language-text\"\n  }, `Content-Security-Policy`), ` of the site e.g. github.com, twitter.com.`)), mdx(\"li\", {\n    parentName: \"ul\"\n  }, mdx(\"p\", {\n    parentName: \"li\"\n  }, mdx(\"code\", {\n    parentName: \"p\",\n    \"className\": \"language-text\"\n  }, `attributes`), ` `, mdx(\"em\", {\n    parentName: \"p\"\n  }, `object`), ` (optional)`), mdx(\"p\", {\n    parentName: \"li\"\n  }, `  The keys are HTML attributes, not DOM properties, except `, mdx(\"code\", {\n    parentName: \"p\",\n    \"className\": \"language-text\"\n  }, `textContent`), ` which sets DOM property `, mdx(\"code\", {\n    parentName: \"p\",\n    \"className\": \"language-text\"\n  }, `textContent`), `. The values are strings so if you want to assign a private function to `, mdx(\"code\", {\n    parentName: \"p\",\n    \"className\": \"language-text\"\n  }, `onload`), ` you can do it after the element is created. `))), mdx(\"p\", null, `Examples:`), mdx(\"div\", {\n    \"className\": \"gatsby-highlight\",\n    \"data-language\": \"js\"\n  }, mdx(\"pre\", {\n    parentName: \"div\",\n    \"className\": \"language-js\"\n  }, mdx(\"code\", {\n    parentName: \"pre\",\n    \"className\": \"language-js\"\n  }, mdx(\"span\", {\n    parentName: \"code\",\n    \"className\": \"token comment\"\n  }, `// using a private function in \\`onload\\``), `\n`, mdx(\"span\", {\n    parentName: \"code\",\n    \"className\": \"token keyword\"\n  }, `let`), ` el `, mdx(\"span\", {\n    parentName: \"code\",\n    \"className\": \"token operator\"\n  }, `=`), ` `, mdx(\"span\", {\n    parentName: \"code\",\n    \"className\": \"token function\"\n  }, `GM_addElement`), mdx(\"span\", {\n    parentName: \"code\",\n    \"className\": \"token punctuation\"\n  }, `(`), mdx(\"span\", {\n    parentName: \"code\",\n    \"className\": \"token string\"\n  }, `'script'`), mdx(\"span\", {\n    parentName: \"code\",\n    \"className\": \"token punctuation\"\n  }, `,`), ` `, mdx(\"span\", {\n    parentName: \"code\",\n    \"className\": \"token punctuation\"\n  }, `{`), ` `, mdx(\"span\", {\n    parentName: \"code\",\n    \"className\": \"token literal-property property\"\n  }, `src`), mdx(\"span\", {\n    parentName: \"code\",\n    \"className\": \"token operator\"\n  }, `:`), ` `, mdx(\"span\", {\n    parentName: \"code\",\n    \"className\": \"token string\"\n  }, `'https://....'`), ` `, mdx(\"span\", {\n    parentName: \"code\",\n    \"className\": \"token punctuation\"\n  }, `}`), mdx(\"span\", {\n    parentName: \"code\",\n    \"className\": \"token punctuation\"\n  }, `)`), mdx(\"span\", {\n    parentName: \"code\",\n    \"className\": \"token punctuation\"\n  }, `;`), `\nel`, mdx(\"span\", {\n    parentName: \"code\",\n    \"className\": \"token punctuation\"\n  }, `.`), mdx(\"span\", {\n    parentName: \"code\",\n    \"className\": \"token function-variable function\"\n  }, `onload`), ` `, mdx(\"span\", {\n    parentName: \"code\",\n    \"className\": \"token operator\"\n  }, `=`), ` `, mdx(\"span\", {\n    parentName: \"code\",\n    \"className\": \"token punctuation\"\n  }, `(`), mdx(\"span\", {\n    parentName: \"code\",\n    \"className\": \"token punctuation\"\n  }, `)`), ` `, mdx(\"span\", {\n    parentName: \"code\",\n    \"className\": \"token operator\"\n  }, `=>`), ` console`, mdx(\"span\", {\n    parentName: \"code\",\n    \"className\": \"token punctuation\"\n  }, `.`), mdx(\"span\", {\n    parentName: \"code\",\n    \"className\": \"token function\"\n  }, `log`), mdx(\"span\", {\n    parentName: \"code\",\n    \"className\": \"token punctuation\"\n  }, `(`), mdx(\"span\", {\n    parentName: \"code\",\n    \"className\": \"token string\"\n  }, `'loaded'`), mdx(\"span\", {\n    parentName: \"code\",\n    \"className\": \"token punctuation\"\n  }, `,`), ` el`, mdx(\"span\", {\n    parentName: \"code\",\n    \"className\": \"token punctuation\"\n  }, `)`), mdx(\"span\", {\n    parentName: \"code\",\n    \"className\": \"token punctuation\"\n  }, `;`)))), mdx(\"div\", {\n    \"className\": \"gatsby-highlight\",\n    \"data-language\": \"js\"\n  }, mdx(\"pre\", {\n    parentName: \"div\",\n    \"className\": \"language-js\"\n  }, mdx(\"code\", {\n    parentName: \"pre\",\n    \"className\": \"language-js\"\n  }, mdx(\"span\", {\n    parentName: \"code\",\n    \"className\": \"token comment\"\n  }, `// same as GM_addStyle('a { color:red }')`), `\n`, mdx(\"span\", {\n    parentName: \"code\",\n    \"className\": \"token keyword\"\n  }, `let`), ` el `, mdx(\"span\", {\n    parentName: \"code\",\n    \"className\": \"token operator\"\n  }, `=`), ` `, mdx(\"span\", {\n    parentName: \"code\",\n    \"className\": \"token function\"\n  }, `GM_addElement`), mdx(\"span\", {\n    parentName: \"code\",\n    \"className\": \"token punctuation\"\n  }, `(`), mdx(\"span\", {\n    parentName: \"code\",\n    \"className\": \"token string\"\n  }, `'style'`), mdx(\"span\", {\n    parentName: \"code\",\n    \"className\": \"token punctuation\"\n  }, `,`), ` `, mdx(\"span\", {\n    parentName: \"code\",\n    \"className\": \"token punctuation\"\n  }, `{`), ` `, mdx(\"span\", {\n    parentName: \"code\",\n    \"className\": \"token literal-property property\"\n  }, `textContent`), mdx(\"span\", {\n    parentName: \"code\",\n    \"className\": \"token operator\"\n  }, `:`), ` `, mdx(\"span\", {\n    parentName: \"code\",\n    \"className\": \"token string\"\n  }, `'a { color:red }'`), ` `, mdx(\"span\", {\n    parentName: \"code\",\n    \"className\": \"token punctuation\"\n  }, `}`), mdx(\"span\", {\n    parentName: \"code\",\n    \"className\": \"token punctuation\"\n  }, `)`), mdx(\"span\", {\n    parentName: \"code\",\n    \"className\": \"token punctuation\"\n  }, `;`)))), mdx(\"div\", {\n    \"className\": \"gatsby-highlight\",\n    \"data-language\": \"js\"\n  }, mdx(\"pre\", {\n    parentName: \"div\",\n    \"className\": \"language-js\"\n  }, mdx(\"code\", {\n    parentName: \"pre\",\n    \"className\": \"language-js\"\n  }, mdx(\"span\", {\n    parentName: \"code\",\n    \"className\": \"token comment\"\n  }, `// appending to an arbitrary node`), `\n`, mdx(\"span\", {\n    parentName: \"code\",\n    \"className\": \"token keyword\"\n  }, `let`), ` el `, mdx(\"span\", {\n    parentName: \"code\",\n    \"className\": \"token operator\"\n  }, `=`), ` `, mdx(\"span\", {\n    parentName: \"code\",\n    \"className\": \"token function\"\n  }, `GM_addElement`), mdx(\"span\", {\n    parentName: \"code\",\n    \"className\": \"token punctuation\"\n  }, `(`), `parentElement`, mdx(\"span\", {\n    parentName: \"code\",\n    \"className\": \"token punctuation\"\n  }, `.`), `shadowRoot`, mdx(\"span\", {\n    parentName: \"code\",\n    \"className\": \"token punctuation\"\n  }, `,`), ` `, mdx(\"span\", {\n    parentName: \"code\",\n    \"className\": \"token string\"\n  }, `'iframe'`), mdx(\"span\", {\n    parentName: \"code\",\n    \"className\": \"token punctuation\"\n  }, `,`), ` `, mdx(\"span\", {\n    parentName: \"code\",\n    \"className\": \"token punctuation\"\n  }, `{`), ` `, mdx(\"span\", {\n    parentName: \"code\",\n    \"className\": \"token literal-property property\"\n  }, `src`), mdx(\"span\", {\n    parentName: \"code\",\n    \"className\": \"token operator\"\n  }, `:`), ` url `, mdx(\"span\", {\n    parentName: \"code\",\n    \"className\": \"token punctuation\"\n  }, `}`), mdx(\"span\", {\n    parentName: \"code\",\n    \"className\": \"token punctuation\"\n  }, `)`), mdx(\"span\", {\n    parentName: \"code\",\n    \"className\": \"token punctuation\"\n  }, `;`)))), mdx(\"p\", null, `Notes:`), mdx(\"ul\", null, mdx(\"li\", {\n    parentName: \"ul\"\n  }, `The element is returned immediately (synchronously) even with `, mdx(\"code\", {\n    parentName: \"li\",\n    \"className\": \"language-text\"\n  }, `GM.addElement`), `, no need for `, mdx(\"code\", {\n    parentName: \"li\",\n    \"className\": \"language-text\"\n  }, `.then()`), `, but you can use it if you want, just once though as it's auto-removed to avoid recursion. The API is synchronous because Violentmonkey runs scripts only when the root element appears, so there's always a node to serve as a parent.`), mdx(\"li\", {\n    parentName: \"ul\"\n  }, `Invalid arguments will raise an exception, which can be caught using `, mdx(\"code\", {\n    parentName: \"li\",\n    \"className\": \"language-text\"\n  }, `try {} catch (e) {}`), `, just like standard DOM API `, mdx(\"code\", {\n    parentName: \"li\",\n    \"className\": \"language-text\"\n  }, `document.createElement`), `.`), mdx(\"li\", {\n    parentName: \"ul\"\n  }, `This API is experimental in Tampermonkey, and hence subject to change.`)), mdx(\"h3\", {\n    \"id\": \"gm_addstyle\",\n    \"style\": {\n      \"position\": \"relative\"\n    }\n  }, mdx(\"a\", {\n    parentName: \"h3\",\n    \"href\": \"#gm_addstyle\",\n    \"aria-label\": \"gm_addstyle permalink\",\n    \"className\": \"anchor before\"\n  }, mdx(\"svg\", {\n    parentName: \"a\",\n    \"aria-hidden\": \"true\",\n    \"focusable\": \"false\",\n    \"height\": \"16\",\n    \"version\": \"1.1\",\n    \"viewBox\": \"0 0 16 16\",\n    \"width\": \"16\"\n  }, mdx(\"path\", {\n    parentName: \"svg\",\n    \"fillRule\": \"evenodd\",\n    \"d\": \"M4 9h1v1H4c-1.5 0-3-1.69-3-3.5S2.55 3 4 3h4c1.45 0 3 1.69 3 3.5 0 1.41-.91 2.72-2 3.25V8.59c.58-.45 1-1.27 1-2.09C10 5.22 8.98 4 8 4H4c-.98 0-2 1.22-2 2.5S3 9 4 9zm9-3h-1v1h1c1 0 2 1.22 2 2.5S13.98 12 13 12H9c-.98 0-2-1.22-2-2.5 0-.83.42-1.64 1-2.09V6.25c-1.09.53-2 1.84-2 3.25C6 11.31 7.55 13 9 13h4c1.45 0 3-1.69 3-3.5S14.5 6 13 6z\"\n  }))), `GM_addStyle`), mdx(\"p\", null, `Appends and returns a `, mdx(\"code\", {\n    parentName: \"p\",\n    \"className\": \"language-text\"\n  }, `<style>`), ` element with the specified CSS.`), mdx(\"div\", {\n    \"className\": \"gatsby-highlight\",\n    \"data-language\": \"js\"\n  }, mdx(\"pre\", {\n    parentName: \"div\",\n    \"className\": \"language-js\"\n  }, mdx(\"code\", {\n    parentName: \"pre\",\n    \"className\": \"language-js\"\n  }, mdx(\"span\", {\n    parentName: \"code\",\n    \"className\": \"token keyword\"\n  }, `let`), ` styleElement `, mdx(\"span\", {\n    parentName: \"code\",\n    \"className\": \"token operator\"\n  }, `=`), ` `, mdx(\"span\", {\n    parentName: \"code\",\n    \"className\": \"token function\"\n  }, `GM_addStyle`), mdx(\"span\", {\n    parentName: \"code\",\n    \"className\": \"token punctuation\"\n  }, `(`), `css`, mdx(\"span\", {\n    parentName: \"code\",\n    \"className\": \"token punctuation\"\n  }, `)`), mdx(\"span\", {\n    parentName: \"code\",\n    \"className\": \"token punctuation\"\n  }, `;`)))), mdx(\"ul\", null, mdx(\"li\", {\n    parentName: \"ul\"\n  }, mdx(\"p\", {\n    parentName: \"li\"\n  }, mdx(\"code\", {\n    parentName: \"p\",\n    \"className\": \"language-text\"\n  }, `css`), ` `, mdx(\"em\", {\n    parentName: \"p\"\n  }, `string`)), mdx(\"p\", {\n    parentName: \"li\"\n  }, `  The CSS code to inject.`))), mdx(\"p\", null, `Older versions of Violentmonkey (prior to 2.12.0) returned an imitation of Promise,\nwhich is still maintained for compatibility, so don't be surprised if you see code like\n`, mdx(\"code\", {\n    parentName: \"p\",\n    \"className\": \"language-text\"\n  }, `GM_addStyle(css).then(el => { /* whatever */ });`)), mdx(\"h3\", {\n    \"id\": \"gm_openintab\",\n    \"style\": {\n      \"position\": \"relative\"\n    }\n  }, mdx(\"a\", {\n    parentName: \"h3\",\n    \"href\": \"#gm_openintab\",\n    \"aria-label\": \"gm_openintab permalink\",\n    \"className\": \"anchor before\"\n  }, mdx(\"svg\", {\n    parentName: \"a\",\n    \"aria-hidden\": \"true\",\n    \"focusable\": \"false\",\n    \"height\": \"16\",\n    \"version\": \"1.1\",\n    \"viewBox\": \"0 0 16 16\",\n    \"width\": \"16\"\n  }, mdx(\"path\", {\n    parentName: \"svg\",\n    \"fillRule\": \"evenodd\",\n    \"d\": \"M4 9h1v1H4c-1.5 0-3-1.69-3-3.5S2.55 3 4 3h4c1.45 0 3 1.69 3 3.5 0 1.41-.91 2.72-2 3.25V8.59c.58-.45 1-1.27 1-2.09C10 5.22 8.98 4 8 4H4c-.98 0-2 1.22-2 2.5S3 9 4 9zm9-3h-1v1h1c1 0 2 1.22 2 2.5S13.98 12 13 12H9c-.98 0-2-1.22-2-2.5 0-.83.42-1.64 1-2.09V6.25c-1.09.53-2 1.84-2 3.25C6 11.31 7.55 13 9 13h4c1.45 0 3-1.69 3-3.5S14.5 6 13 6z\"\n  }))), `GM_openInTab`), mdx(\"p\", null, `Opens URL in a new tab.`), mdx(\"ol\", null, mdx(\"li\", {\n    parentName: \"ol\"\n  }, mdx(\"p\", {\n    parentName: \"li\"\n  }, `using an object`), mdx(\"div\", {\n    parentName: \"li\",\n    \"className\": \"gatsby-highlight\",\n    \"data-language\": \"js\"\n  }, mdx(\"pre\", {\n    parentName: \"div\",\n    \"className\": \"language-js\"\n  }, mdx(\"code\", {\n    parentName: \"pre\",\n    \"className\": \"language-js\"\n  }, mdx(\"span\", {\n    parentName: \"code\",\n    \"className\": \"token keyword\"\n  }, `let`), ` tabControl `, mdx(\"span\", {\n    parentName: \"code\",\n    \"className\": \"token operator\"\n  }, `=`), ` `, mdx(\"span\", {\n    parentName: \"code\",\n    \"className\": \"token function\"\n  }, `GM_openInTab`), mdx(\"span\", {\n    parentName: \"code\",\n    \"className\": \"token punctuation\"\n  }, `(`), `url`, mdx(\"span\", {\n    parentName: \"code\",\n    \"className\": \"token punctuation\"\n  }, `,`), ` options`, mdx(\"span\", {\n    parentName: \"code\",\n    \"className\": \"token punctuation\"\n  }, `)`)))), mdx(\"ul\", {\n    parentName: \"li\"\n  }, mdx(\"li\", {\n    parentName: \"ul\"\n  }, mdx(\"p\", {\n    parentName: \"li\"\n  }, mdx(\"code\", {\n    parentName: \"p\",\n    \"className\": \"language-text\"\n  }, `url`), ` `, mdx(\"em\", {\n    parentName: \"p\"\n  }, `string`)), mdx(\"p\", {\n    parentName: \"li\"\n  }, `  The URL to open in a new tab. URL relative to current page is also allowed.\nNote: Firefox does not support data URLs.`)), mdx(\"li\", {\n    parentName: \"ul\"\n  }, mdx(\"p\", {\n    parentName: \"li\"\n  }, mdx(\"code\", {\n    parentName: \"p\",\n    \"className\": \"language-text\"\n  }, `options`), ` `, mdx(\"em\", {\n    parentName: \"p\"\n  }, `object`), ` (optional)`), mdx(\"ul\", {\n    parentName: \"li\"\n  }, mdx(\"li\", {\n    parentName: \"ul\"\n  }, mdx(\"p\", {\n    parentName: \"li\"\n  }, mdx(\"code\", {\n    parentName: \"p\",\n    \"className\": \"language-text\"\n  }, `active`), ` `, mdx(\"em\", {\n    parentName: \"p\"\n  }, `boolean`), `, default: `, mdx(\"code\", {\n    parentName: \"p\",\n    \"className\": \"language-text\"\n  }, `true`), ` `), mdx(\"p\", {\n    parentName: \"li\"\n  }, `  Make the new tab active (i.e. open in foreground).\n`)), mdx(\"li\", {\n    parentName: \"ul\"\n  }, mdx(\"p\", {\n    parentName: \"li\"\n  }, mdx(\"code\", {\n    parentName: \"p\",\n    \"className\": \"language-text\"\n  }, `container`), ` `, mdx(\"em\", {\n    parentName: \"p\"\n  }, `number`), ` `, mdx(\"em\", {\n    parentName: \"p\"\n  }, `(since VM2.12.5, Firefox-only)`)), mdx(\"p\", {\n    parentName: \"li\"\n  }, `  Set `, mdx(\"a\", {\n    parentName: \"p\",\n    \"href\": \"https://wiki.mozilla.org/Security/Contextual_Identity_Project/Containers\",\n    \"target\": \"_blank\",\n    \"rel\": \"noopener noreferrer\"\n  }, `tab's container`), ` in Firefox:`), mdx(\"ul\", {\n    parentName: \"li\"\n  }, mdx(\"li\", {\n    parentName: \"ul\"\n  }, `not specified = reuse script's tab container`), mdx(\"li\", {\n    parentName: \"ul\"\n  }, mdx(\"code\", {\n    parentName: \"li\",\n    \"className\": \"language-text\"\n  }, `0`), ` = default (main) container`), mdx(\"li\", {\n    parentName: \"ul\"\n  }, mdx(\"code\", {\n    parentName: \"li\",\n    \"className\": \"language-text\"\n  }, `1`), `, `, mdx(\"code\", {\n    parentName: \"li\",\n    \"className\": \"language-text\"\n  }, `2`), `, etc. = internal container index`))), mdx(\"li\", {\n    parentName: \"ul\"\n  }, mdx(\"p\", {\n    parentName: \"li\"\n  }, mdx(\"code\", {\n    parentName: \"p\",\n    \"className\": \"language-text\"\n  }, `insert`), ` `, mdx(\"em\", {\n    parentName: \"p\"\n  }, `boolean`), ` `, mdx(\"em\", {\n    parentName: \"p\"\n  }, `(since VM2.11.0)`), `, default: `, mdx(\"code\", {\n    parentName: \"p\",\n    \"className\": \"language-text\"\n  }, `true`)), mdx(\"p\", {\n    parentName: \"li\"\n  }, `  Insert the new tab next to the current tab and set its \"openerTab\" so when it's closed the original tab will be focused automatically. When `, mdx(\"code\", {\n    parentName: \"p\",\n    \"className\": \"language-text\"\n  }, `false`), ` or not specified, the usual browser behavior is to open the tab at the end of the tab list.`)), mdx(\"li\", {\n    parentName: \"ul\"\n  }, mdx(\"p\", {\n    parentName: \"li\"\n  }, mdx(\"code\", {\n    parentName: \"p\",\n    \"className\": \"language-text\"\n  }, `pinned`), ` `, mdx(\"em\", {\n    parentName: \"p\"\n  }, `boolean`), ` `, mdx(\"em\", {\n    parentName: \"p\"\n  }, `(since VM2.12.5)`), `, default: `, mdx(\"code\", {\n    parentName: \"p\",\n    \"className\": \"language-text\"\n  }, `false`)), mdx(\"p\", {\n    parentName: \"li\"\n  }, `  Pin the tab (i.e. show without a title at the beginning of the tab list).\n`)))))), mdx(\"li\", {\n    parentName: \"ol\"\n  }, mdx(\"p\", {\n    parentName: \"li\"\n  }, `Using a boolean, compatible with Greasemonkey:`), mdx(\"div\", {\n    parentName: \"li\",\n    \"className\": \"gatsby-highlight\",\n    \"data-language\": \"js\"\n  }, mdx(\"pre\", {\n    parentName: \"div\",\n    \"className\": \"language-js\"\n  }, mdx(\"code\", {\n    parentName: \"pre\",\n    \"className\": \"language-js\"\n  }, mdx(\"span\", {\n    parentName: \"code\",\n    \"className\": \"token keyword\"\n  }, `let`), ` tabControl `, mdx(\"span\", {\n    parentName: \"code\",\n    \"className\": \"token operator\"\n  }, `=`), ` `, mdx(\"span\", {\n    parentName: \"code\",\n    \"className\": \"token function\"\n  }, `GM_openInTab`), mdx(\"span\", {\n    parentName: \"code\",\n    \"className\": \"token punctuation\"\n  }, `(`), `url`, mdx(\"span\", {\n    parentName: \"code\",\n    \"className\": \"token punctuation\"\n  }, `,`), ` openInBackground`, mdx(\"span\", {\n    parentName: \"code\",\n    \"className\": \"token punctuation\"\n  }, `)`)))), mdx(\"ul\", {\n    parentName: \"li\"\n  }, mdx(\"li\", {\n    parentName: \"ul\"\n  }, mdx(\"p\", {\n    parentName: \"li\"\n  }, mdx(\"code\", {\n    parentName: \"p\",\n    \"className\": \"language-text\"\n  }, `openInBackground`), ` `, mdx(\"em\", {\n    parentName: \"p\"\n  }, `boolean`)), mdx(\"p\", {\n    parentName: \"li\"\n  }, `  Open the tab in background.\nNote, this is a reverse of the first usage method so for example `, mdx(\"code\", {\n    parentName: \"p\",\n    \"className\": \"language-text\"\n  }, `true`), ` is the same as `, mdx(\"code\", {\n    parentName: \"p\",\n    \"className\": \"language-text\"\n  }, `{ active: false }`), `.`))))), mdx(\"p\", null, `Returns an object with following properties:`), mdx(\"ul\", null, mdx(\"li\", {\n    parentName: \"ul\"\n  }, mdx(\"p\", {\n    parentName: \"li\"\n  }, mdx(\"code\", {\n    parentName: \"p\",\n    \"className\": \"language-text\"\n  }, `onclose`)), mdx(\"p\", {\n    parentName: \"li\"\n  }, `  Сan be assigned to a function. If provided, it will be called when the opened tab is closed.`)), mdx(\"li\", {\n    parentName: \"ul\"\n  }, mdx(\"p\", {\n    parentName: \"li\"\n  }, mdx(\"code\", {\n    parentName: \"p\",\n    \"className\": \"language-text\"\n  }, `closed`), ` `, mdx(\"em\", {\n    parentName: \"p\"\n  }, `boolean`)), mdx(\"p\", {\n    parentName: \"li\"\n  }, `  Whether the opened tab is closed.`)), mdx(\"li\", {\n    parentName: \"ul\"\n  }, mdx(\"p\", {\n    parentName: \"li\"\n  }, mdx(\"code\", {\n    parentName: \"p\",\n    \"className\": \"language-text\"\n  }, `close`), ` `, mdx(\"em\", {\n    parentName: \"p\"\n  }, `function`)), mdx(\"p\", {\n    parentName: \"li\"\n  }, `  A function to explicitly close the opened tab.`))), mdx(\"div\", {\n    \"className\": \"gatsby-highlight\",\n    \"data-language\": \"js\"\n  }, mdx(\"pre\", {\n    parentName: \"div\",\n    \"className\": \"language-js\"\n  }, mdx(\"code\", {\n    parentName: \"pre\",\n    \"className\": \"language-js\"\n  }, mdx(\"span\", {\n    parentName: \"code\",\n    \"className\": \"token keyword\"\n  }, `let`), ` tabControl `, mdx(\"span\", {\n    parentName: \"code\",\n    \"className\": \"token operator\"\n  }, `=`), ` `, mdx(\"span\", {\n    parentName: \"code\",\n    \"className\": \"token function\"\n  }, `GM_openInTab`), mdx(\"span\", {\n    parentName: \"code\",\n    \"className\": \"token punctuation\"\n  }, `(`), `url`, mdx(\"span\", {\n    parentName: \"code\",\n    \"className\": \"token punctuation\"\n  }, `)`), mdx(\"span\", {\n    parentName: \"code\",\n    \"className\": \"token punctuation\"\n  }, `;`), `\ntabControl`, mdx(\"span\", {\n    parentName: \"code\",\n    \"className\": \"token punctuation\"\n  }, `.`), mdx(\"span\", {\n    parentName: \"code\",\n    \"className\": \"token function-variable function\"\n  }, `onclose`), ` `, mdx(\"span\", {\n    parentName: \"code\",\n    \"className\": \"token operator\"\n  }, `=`), ` `, mdx(\"span\", {\n    parentName: \"code\",\n    \"className\": \"token punctuation\"\n  }, `(`), mdx(\"span\", {\n    parentName: \"code\",\n    \"className\": \"token punctuation\"\n  }, `)`), ` `, mdx(\"span\", {\n    parentName: \"code\",\n    \"className\": \"token operator\"\n  }, `=>`), ` console`, mdx(\"span\", {\n    parentName: \"code\",\n    \"className\": \"token punctuation\"\n  }, `.`), mdx(\"span\", {\n    parentName: \"code\",\n    \"className\": \"token function\"\n  }, `log`), mdx(\"span\", {\n    parentName: \"code\",\n    \"className\": \"token punctuation\"\n  }, `(`), mdx(\"span\", {\n    parentName: \"code\",\n    \"className\": \"token string\"\n  }, `'tab is closed'`), mdx(\"span\", {\n    parentName: \"code\",\n    \"className\": \"token punctuation\"\n  }, `)`), mdx(\"span\", {\n    parentName: \"code\",\n    \"className\": \"token punctuation\"\n  }, `;`), `\ntabControl`, mdx(\"span\", {\n    parentName: \"code\",\n    \"className\": \"token punctuation\"\n  }, `.`), mdx(\"span\", {\n    parentName: \"code\",\n    \"className\": \"token function\"\n  }, `close`), mdx(\"span\", {\n    parentName: \"code\",\n    \"className\": \"token punctuation\"\n  }, `(`), mdx(\"span\", {\n    parentName: \"code\",\n    \"className\": \"token punctuation\"\n  }, `)`), mdx(\"span\", {\n    parentName: \"code\",\n    \"className\": \"token punctuation\"\n  }, `;`)))), mdx(\"h3\", {\n    \"id\": \"gm_registermenucommand\",\n    \"style\": {\n      \"position\": \"relative\"\n    }\n  }, mdx(\"a\", {\n    parentName: \"h3\",\n    \"href\": \"#gm_registermenucommand\",\n    \"aria-label\": \"gm_registermenucommand permalink\",\n    \"className\": \"anchor before\"\n  }, mdx(\"svg\", {\n    parentName: \"a\",\n    \"aria-hidden\": \"true\",\n    \"focusable\": \"false\",\n    \"height\": \"16\",\n    \"version\": \"1.1\",\n    \"viewBox\": \"0 0 16 16\",\n    \"width\": \"16\"\n  }, mdx(\"path\", {\n    parentName: \"svg\",\n    \"fillRule\": \"evenodd\",\n    \"d\": \"M4 9h1v1H4c-1.5 0-3-1.69-3-3.5S2.55 3 4 3h4c1.45 0 3 1.69 3 3.5 0 1.41-.91 2.72-2 3.25V8.59c.58-.45 1-1.27 1-2.09C10 5.22 8.98 4 8 4H4c-.98 0-2 1.22-2 2.5S3 9 4 9zm9-3h-1v1h1c1 0 2 1.22 2 2.5S13.98 12 13 12H9c-.98 0-2-1.22-2-2.5 0-.83.42-1.64 1-2.09V6.25c-1.09.53-2 1.84-2 3.25C6 11.31 7.55 13 9 13h4c1.45 0 3-1.69 3-3.5S14.5 6 13 6z\"\n  }))), `GM_registerMenuCommand`), mdx(\"p\", null, `Registers a command in Violentmonkey popup menu.`), mdx(\"div\", {\n    \"className\": \"gatsby-highlight\",\n    \"data-language\": \"js\"\n  }, mdx(\"pre\", {\n    parentName: \"div\",\n    \"className\": \"language-js\"\n  }, mdx(\"code\", {\n    parentName: \"pre\",\n    \"className\": \"language-js\"\n  }, mdx(\"span\", {\n    parentName: \"code\",\n    \"className\": \"token function\"\n  }, `GM_registerMenuCommand`), mdx(\"span\", {\n    parentName: \"code\",\n    \"className\": \"token punctuation\"\n  }, `(`), `caption`, mdx(\"span\", {\n    parentName: \"code\",\n    \"className\": \"token punctuation\"\n  }, `,`), ` onClick`, mdx(\"span\", {\n    parentName: \"code\",\n    \"className\": \"token punctuation\"\n  }, `)`), `\n`, mdx(\"span\", {\n    parentName: \"code\",\n    \"className\": \"token comment\"\n  }, `// v2.12.5 and newer return an \\`id\\` equal to \\`caption\\` for compatibility with TM`), `\n`, mdx(\"span\", {\n    parentName: \"code\",\n    \"className\": \"token keyword\"\n  }, `const`), ` id `, mdx(\"span\", {\n    parentName: \"code\",\n    \"className\": \"token operator\"\n  }, `=`), ` `, mdx(\"span\", {\n    parentName: \"code\",\n    \"className\": \"token function\"\n  }, `GM_registerMenuCommand`), mdx(\"span\", {\n    parentName: \"code\",\n    \"className\": \"token punctuation\"\n  }, `(`), `caption`, mdx(\"span\", {\n    parentName: \"code\",\n    \"className\": \"token punctuation\"\n  }, `,`), ` onClick`, mdx(\"span\", {\n    parentName: \"code\",\n    \"className\": \"token punctuation\"\n  }, `)`)))), mdx(\"ul\", null, mdx(\"li\", {\n    parentName: \"ul\"\n  }, mdx(\"p\", {\n    parentName: \"li\"\n  }, mdx(\"code\", {\n    parentName: \"p\",\n    \"className\": \"language-text\"\n  }, `caption`), ` `, mdx(\"em\", {\n    parentName: \"p\"\n  }, `string`)), mdx(\"p\", {\n    parentName: \"li\"\n  }, `  The name to show in the popup menu.`)), mdx(\"li\", {\n    parentName: \"ul\"\n  }, mdx(\"p\", {\n    parentName: \"li\"\n  }, mdx(\"code\", {\n    parentName: \"p\",\n    \"className\": \"language-text\"\n  }, `onClick`), ` `, mdx(\"em\", {\n    parentName: \"p\"\n  }, `function`)), mdx(\"p\", {\n    parentName: \"li\"\n  }, `  When the command is clicked in the menu, this function will run with the following parameter:`), mdx(\"ul\", {\n    parentName: \"li\"\n  }, mdx(\"li\", {\n    parentName: \"ul\"\n  }, mdx(\"code\", {\n    parentName: \"li\",\n    \"className\": \"language-text\"\n  }, `event`), ` `, mdx(\"em\", {\n    parentName: \"li\"\n  }, mdx(\"a\", {\n    parentName: \"em\",\n    \"href\": \"https://developer.mozilla.org/docs/Web/API/MouseEvent\",\n    \"target\": \"_blank\",\n    \"rel\": \"noopener noreferrer\"\n  }, `MouseEvent`), ` | `, mdx(\"a\", {\n    parentName: \"em\",\n    \"href\": \"https://developer.mozilla.org/docs/Web/API/KeyboardEvent\",\n    \"target\": \"_blank\",\n    \"rel\": \"noopener noreferrer\"\n  }, `KeyboardEvent`)), ` `, mdx(\"em\", {\n    parentName: \"li\"\n  }, `(since VM2.13.1)`), ` is the event that activated the command so you can check `, mdx(\"code\", {\n    parentName: \"li\",\n    \"className\": \"language-text\"\n  }, `event.button`), `, `, mdx(\"code\", {\n    parentName: \"li\",\n    \"className\": \"language-text\"\n  }, `event.shiftKey`), `, `, mdx(\"code\", {\n    parentName: \"li\",\n    \"className\": \"language-text\"\n  }, `event.key`), `, and so on. `)))), mdx(\"p\", null, `If you want to add a shortcut, please see `, mdx(\"a\", {\n    parentName: \"p\",\n    \"href\": \"https://github.com/violentmonkey/vm-shortcut\",\n    \"target\": \"_blank\",\n    \"rel\": \"noopener noreferrer\"\n  }, `vm.shortcut`), `.`), mdx(\"h3\", {\n    \"id\": \"gm_unregistermenucommand\",\n    \"style\": {\n      \"position\": \"relative\"\n    }\n  }, mdx(\"a\", {\n    parentName: \"h3\",\n    \"href\": \"#gm_unregistermenucommand\",\n    \"aria-label\": \"gm_unregistermenucommand permalink\",\n    \"className\": \"anchor before\"\n  }, mdx(\"svg\", {\n    parentName: \"a\",\n    \"aria-hidden\": \"true\",\n    \"focusable\": \"false\",\n    \"height\": \"16\",\n    \"version\": \"1.1\",\n    \"viewBox\": \"0 0 16 16\",\n    \"width\": \"16\"\n  }, mdx(\"path\", {\n    parentName: \"svg\",\n    \"fillRule\": \"evenodd\",\n    \"d\": \"M4 9h1v1H4c-1.5 0-3-1.69-3-3.5S2.55 3 4 3h4c1.45 0 3 1.69 3 3.5 0 1.41-.91 2.72-2 3.25V8.59c.58-.45 1-1.27 1-2.09C10 5.22 8.98 4 8 4H4c-.98 0-2 1.22-2 2.5S3 9 4 9zm9-3h-1v1h1c1 0 2 1.22 2 2.5S13.98 12 13 12H9c-.98 0-2-1.22-2-2.5 0-.83.42-1.64 1-2.09V6.25c-1.09.53-2 1.84-2 3.25C6 11.31 7.55 13 9 13h4c1.45 0 3-1.69 3-3.5S14.5 6 13 6z\"\n  }))), `GM_unregisterMenuCommand`), mdx(\"p\", null, `Unregisters a command which has been registered to Violentmonkey popup menu.`), mdx(\"div\", {\n    \"className\": \"gatsby-highlight\",\n    \"data-language\": \"js\"\n  }, mdx(\"pre\", {\n    parentName: \"div\",\n    \"className\": \"language-js\"\n  }, mdx(\"code\", {\n    parentName: \"pre\",\n    \"className\": \"language-js\"\n  }, mdx(\"span\", {\n    parentName: \"code\",\n    \"className\": \"token function\"\n  }, `GM_unregisterMenuCommand`), mdx(\"span\", {\n    parentName: \"code\",\n    \"className\": \"token punctuation\"\n  }, `(`), `caption`, mdx(\"span\", {\n    parentName: \"code\",\n    \"className\": \"token punctuation\"\n  }, `)`)))), mdx(\"ul\", null, mdx(\"li\", {\n    parentName: \"ul\"\n  }, mdx(\"p\", {\n    parentName: \"li\"\n  }, mdx(\"code\", {\n    parentName: \"p\",\n    \"className\": \"language-text\"\n  }, `caption`), ` `, mdx(\"em\", {\n    parentName: \"p\"\n  }, `string`)), mdx(\"p\", {\n    parentName: \"li\"\n  }, `  The name of command to unregister.`))), mdx(\"h3\", {\n    \"id\": \"gm_notification\",\n    \"style\": {\n      \"position\": \"relative\"\n    }\n  }, mdx(\"a\", {\n    parentName: \"h3\",\n    \"href\": \"#gm_notification\",\n    \"aria-label\": \"gm_notification permalink\",\n    \"className\": \"anchor before\"\n  }, mdx(\"svg\", {\n    parentName: \"a\",\n    \"aria-hidden\": \"true\",\n    \"focusable\": \"false\",\n    \"height\": \"16\",\n    \"version\": \"1.1\",\n    \"viewBox\": \"0 0 16 16\",\n    \"width\": \"16\"\n  }, mdx(\"path\", {\n    parentName: \"svg\",\n    \"fillRule\": \"evenodd\",\n    \"d\": \"M4 9h1v1H4c-1.5 0-3-1.69-3-3.5S2.55 3 4 3h4c1.45 0 3 1.69 3 3.5 0 1.41-.91 2.72-2 3.25V8.59c.58-.45 1-1.27 1-2.09C10 5.22 8.98 4 8 4H4c-.98 0-2 1.22-2 2.5S3 9 4 9zm9-3h-1v1h1c1 0 2 1.22 2 2.5S13.98 12 13 12H9c-.98 0-2-1.22-2-2.5 0-.83.42-1.64 1-2.09V6.25c-1.09.53-2 1.84-2 3.25C6 11.31 7.55 13 9 13h4c1.45 0 3-1.69 3-3.5S14.5 6 13 6z\"\n  }))), `GM_notification`), mdx(\"p\", null, `Shows an HTML5 desktop notification.`), mdx(\"ol\", null, mdx(\"li\", {\n    parentName: \"ol\"\n  }, mdx(\"p\", {\n    parentName: \"li\"\n  }, `using an object:`), mdx(\"div\", {\n    parentName: \"li\",\n    \"className\": \"gatsby-highlight\",\n    \"data-language\": \"js\"\n  }, mdx(\"pre\", {\n    parentName: \"div\",\n    \"className\": \"language-js\"\n  }, mdx(\"code\", {\n    parentName: \"pre\",\n    \"className\": \"language-js\"\n  }, mdx(\"span\", {\n    parentName: \"code\",\n    \"className\": \"token keyword\"\n  }, `let`), ` control `, mdx(\"span\", {\n    parentName: \"code\",\n    \"className\": \"token operator\"\n  }, `=`), ` `, mdx(\"span\", {\n    parentName: \"code\",\n    \"className\": \"token function\"\n  }, `GM_notification`), mdx(\"span\", {\n    parentName: \"code\",\n    \"className\": \"token punctuation\"\n  }, `(`), `options`, mdx(\"span\", {\n    parentName: \"code\",\n    \"className\": \"token punctuation\"\n  }, `)`)))), mdx(\"ul\", {\n    parentName: \"li\"\n  }, mdx(\"li\", {\n    parentName: \"ul\"\n  }, mdx(\"p\", {\n    parentName: \"li\"\n  }, mdx(\"code\", {\n    parentName: \"p\",\n    \"className\": \"language-text\"\n  }, `options`), ` `, mdx(\"em\", {\n    parentName: \"p\"\n  }, `object`)), mdx(\"ul\", {\n    parentName: \"li\"\n  }, mdx(\"li\", {\n    parentName: \"ul\"\n  }, mdx(\"p\", {\n    parentName: \"li\"\n  }, mdx(\"code\", {\n    parentName: \"p\",\n    \"className\": \"language-text\"\n  }, `text`), ` `, mdx(\"em\", {\n    parentName: \"p\"\n  }, `string`), ` (required)`), mdx(\"p\", {\n    parentName: \"li\"\n  }, `  Main text of the notification.`)), mdx(\"li\", {\n    parentName: \"ul\"\n  }, mdx(\"p\", {\n    parentName: \"li\"\n  }, mdx(\"code\", {\n    parentName: \"p\",\n    \"className\": \"language-text\"\n  }, `title`), ` `, mdx(\"em\", {\n    parentName: \"p\"\n  }, `string`)), mdx(\"p\", {\n    parentName: \"li\"\n  }, `  Title of the notification.`)), mdx(\"li\", {\n    parentName: \"ul\"\n  }, mdx(\"p\", {\n    parentName: \"li\"\n  }, mdx(\"code\", {\n    parentName: \"p\",\n    \"className\": \"language-text\"\n  }, `image`), ` `, mdx(\"em\", {\n    parentName: \"p\"\n  }, `string`)), mdx(\"p\", {\n    parentName: \"li\"\n  }, `  URL of an image to show in the notification.`)), mdx(\"li\", {\n    parentName: \"ul\"\n  }, mdx(\"p\", {\n    parentName: \"li\"\n  }, mdx(\"code\", {\n    parentName: \"p\",\n    \"className\": \"language-text\"\n  }, `onclick`), ` `, mdx(\"em\", {\n    parentName: \"p\"\n  }, `function`)), mdx(\"p\", {\n    parentName: \"li\"\n  }, `  Callback when the notification is clicked by user.`)), mdx(\"li\", {\n    parentName: \"ul\"\n  }, mdx(\"p\", {\n    parentName: \"li\"\n  }, mdx(\"code\", {\n    parentName: \"p\",\n    \"className\": \"language-text\"\n  }, `ondone`), ` `, mdx(\"em\", {\n    parentName: \"p\"\n  }, `function`)), mdx(\"p\", {\n    parentName: \"li\"\n  }, `  Callback when the notification is closed, either by user or by system.`)))))), mdx(\"li\", {\n    parentName: \"ol\"\n  }, mdx(\"p\", {\n    parentName: \"li\"\n  }, `Using separate parameters, compatible with Greasemonkey:`), mdx(\"div\", {\n    parentName: \"li\",\n    \"className\": \"gatsby-highlight\",\n    \"data-language\": \"js\"\n  }, mdx(\"pre\", {\n    parentName: \"div\",\n    \"className\": \"language-js\"\n  }, mdx(\"code\", {\n    parentName: \"pre\",\n    \"className\": \"language-js\"\n  }, mdx(\"span\", {\n    parentName: \"code\",\n    \"className\": \"token function\"\n  }, `GM_notification`), mdx(\"span\", {\n    parentName: \"code\",\n    \"className\": \"token punctuation\"\n  }, `(`), `text`, mdx(\"span\", {\n    parentName: \"code\",\n    \"className\": \"token punctuation\"\n  }, `,`), ` title`, mdx(\"span\", {\n    parentName: \"code\",\n    \"className\": \"token punctuation\"\n  }, `,`), ` image`, mdx(\"span\", {\n    parentName: \"code\",\n    \"className\": \"token punctuation\"\n  }, `,`), ` onclick`, mdx(\"span\", {\n    parentName: \"code\",\n    \"className\": \"token punctuation\"\n  }, `)`)))), mdx(\"ul\", {\n    parentName: \"li\"\n  }, mdx(\"li\", {\n    parentName: \"ul\"\n  }, mdx(\"p\", {\n    parentName: \"li\"\n  }, mdx(\"code\", {\n    parentName: \"p\",\n    \"className\": \"language-text\"\n  }, `text`), ` `, mdx(\"em\", {\n    parentName: \"p\"\n  }, `string`), ` (required)`), mdx(\"p\", {\n    parentName: \"li\"\n  }, `  Main text of the notification.`)), mdx(\"li\", {\n    parentName: \"ul\"\n  }, mdx(\"p\", {\n    parentName: \"li\"\n  }, mdx(\"code\", {\n    parentName: \"p\",\n    \"className\": \"language-text\"\n  }, `title`), ` `, mdx(\"em\", {\n    parentName: \"p\"\n  }, `string`)), mdx(\"p\", {\n    parentName: \"li\"\n  }, `  Title of the notification.`)), mdx(\"li\", {\n    parentName: \"ul\"\n  }, mdx(\"p\", {\n    parentName: \"li\"\n  }, mdx(\"code\", {\n    parentName: \"p\",\n    \"className\": \"language-text\"\n  }, `image`), ` `, mdx(\"em\", {\n    parentName: \"p\"\n  }, `string`)), mdx(\"p\", {\n    parentName: \"li\"\n  }, `  URL of an image to show in the notification.`)), mdx(\"li\", {\n    parentName: \"ul\"\n  }, mdx(\"p\", {\n    parentName: \"li\"\n  }, mdx(\"code\", {\n    parentName: \"p\",\n    \"className\": \"language-text\"\n  }, `onclick`), ` `, mdx(\"em\", {\n    parentName: \"p\"\n  }, `function`)), mdx(\"p\", {\n    parentName: \"li\"\n  }, `  Callback when the notification is clicked by user.`))))), mdx(\"p\", null, mdx(\"strong\", {\n    parentName: \"p\"\n  }, `As of VM2.12.8`), ` returns a control object with the following properties:`), mdx(\"ul\", null, mdx(\"li\", {\n    parentName: \"ul\"\n  }, mdx(\"p\", {\n    parentName: \"li\"\n  }, mdx(\"code\", {\n    parentName: \"p\",\n    \"className\": \"language-text\"\n  }, `remove`), ` `, mdx(\"em\", {\n    parentName: \"p\"\n  }, `function(): Promise`)), mdx(\"p\", {\n    parentName: \"li\"\n  }, `  A function to remove the notification.`))), mdx(\"h3\", {\n    \"id\": \"gm_setclipboard\",\n    \"style\": {\n      \"position\": \"relative\"\n    }\n  }, mdx(\"a\", {\n    parentName: \"h3\",\n    \"href\": \"#gm_setclipboard\",\n    \"aria-label\": \"gm_setclipboard permalink\",\n    \"className\": \"anchor before\"\n  }, mdx(\"svg\", {\n    parentName: \"a\",\n    \"aria-hidden\": \"true\",\n    \"focusable\": \"false\",\n    \"height\": \"16\",\n    \"version\": \"1.1\",\n    \"viewBox\": \"0 0 16 16\",\n    \"width\": \"16\"\n  }, mdx(\"path\", {\n    parentName: \"svg\",\n    \"fillRule\": \"evenodd\",\n    \"d\": \"M4 9h1v1H4c-1.5 0-3-1.69-3-3.5S2.55 3 4 3h4c1.45 0 3 1.69 3 3.5 0 1.41-.91 2.72-2 3.25V8.59c.58-.45 1-1.27 1-2.09C10 5.22 8.98 4 8 4H4c-.98 0-2 1.22-2 2.5S3 9 4 9zm9-3h-1v1h1c1 0 2 1.22 2 2.5S13.98 12 13 12H9c-.98 0-2-1.22-2-2.5 0-.83.42-1.64 1-2.09V6.25c-1.09.53-2 1.84-2 3.25C6 11.31 7.55 13 9 13h4c1.45 0 3-1.69 3-3.5S14.5 6 13 6z\"\n  }))), `GM_setClipboard`), mdx(\"p\", null, `Sets data to system clipboard.`), mdx(\"div\", {\n    \"className\": \"gatsby-highlight\",\n    \"data-language\": \"js\"\n  }, mdx(\"pre\", {\n    parentName: \"div\",\n    \"className\": \"language-js\"\n  }, mdx(\"code\", {\n    parentName: \"pre\",\n    \"className\": \"language-js\"\n  }, mdx(\"span\", {\n    parentName: \"code\",\n    \"className\": \"token function\"\n  }, `GM_setClipboard`), mdx(\"span\", {\n    parentName: \"code\",\n    \"className\": \"token punctuation\"\n  }, `(`), `data`, mdx(\"span\", {\n    parentName: \"code\",\n    \"className\": \"token punctuation\"\n  }, `,`), ` type`, mdx(\"span\", {\n    parentName: \"code\",\n    \"className\": \"token punctuation\"\n  }, `)`)))), mdx(\"ul\", null, mdx(\"li\", {\n    parentName: \"ul\"\n  }, mdx(\"p\", {\n    parentName: \"li\"\n  }, mdx(\"code\", {\n    parentName: \"p\",\n    \"className\": \"language-text\"\n  }, `data`), ` `, mdx(\"em\", {\n    parentName: \"p\"\n  }, `string`)), mdx(\"p\", {\n    parentName: \"li\"\n  }, `  The data to be copied to system clipboard.`)), mdx(\"li\", {\n    parentName: \"ul\"\n  }, mdx(\"p\", {\n    parentName: \"li\"\n  }, mdx(\"code\", {\n    parentName: \"p\",\n    \"className\": \"language-text\"\n  }, `type`), ` `, mdx(\"em\", {\n    parentName: \"p\"\n  }, `string`)), mdx(\"p\", {\n    parentName: \"li\"\n  }, `  The MIME type of data to copy. Default as `, mdx(\"code\", {\n    parentName: \"p\",\n    \"className\": \"language-text\"\n  }, `text/plain`), `.`))), mdx(\"h3\", {\n    \"id\": \"gm_xmlhttprequest\",\n    \"style\": {\n      \"position\": \"relative\"\n    }\n  }, mdx(\"a\", {\n    parentName: \"h3\",\n    \"href\": \"#gm_xmlhttprequest\",\n    \"aria-label\": \"gm_xmlhttprequest permalink\",\n    \"className\": \"anchor before\"\n  }, mdx(\"svg\", {\n    parentName: \"a\",\n    \"aria-hidden\": \"true\",\n    \"focusable\": \"false\",\n    \"height\": \"16\",\n    \"version\": \"1.1\",\n    \"viewBox\": \"0 0 16 16\",\n    \"width\": \"16\"\n  }, mdx(\"path\", {\n    parentName: \"svg\",\n    \"fillRule\": \"evenodd\",\n    \"d\": \"M4 9h1v1H4c-1.5 0-3-1.69-3-3.5S2.55 3 4 3h4c1.45 0 3 1.69 3 3.5 0 1.41-.91 2.72-2 3.25V8.59c.58-.45 1-1.27 1-2.09C10 5.22 8.98 4 8 4H4c-.98 0-2 1.22-2 2.5S3 9 4 9zm9-3h-1v1h1c1 0 2 1.22 2 2.5S13.98 12 13 12H9c-.98 0-2-1.22-2-2.5 0-.83.42-1.64 1-2.09V6.25c-1.09.53-2 1.84-2 3.25C6 11.31 7.55 13 9 13h4c1.45 0 3-1.69 3-3.5S14.5 6 13 6z\"\n  }))), `GM_xmlhttpRequest`), mdx(\"p\", null, `Makes a request like XMLHttpRequest, with some special capabilities, not restricted by same-origin policy.`), mdx(\"p\", null, mdx(\"strong\", {\n    parentName: \"p\"\n  }, `Note:`), ` `, mdx(\"code\", {\n    parentName: \"p\",\n    \"className\": \"language-text\"\n  }, `h`), ` is lowercase (the historical spelling)`), mdx(\"div\", {\n    \"className\": \"gatsby-highlight\",\n    \"data-language\": \"js\"\n  }, mdx(\"pre\", {\n    parentName: \"div\",\n    \"className\": \"language-js\"\n  }, mdx(\"code\", {\n    parentName: \"pre\",\n    \"className\": \"language-js\"\n  }, mdx(\"span\", {\n    parentName: \"code\",\n    \"className\": \"token keyword\"\n  }, `let`), ` control `, mdx(\"span\", {\n    parentName: \"code\",\n    \"className\": \"token operator\"\n  }, `=`), ` `, mdx(\"span\", {\n    parentName: \"code\",\n    \"className\": \"token function\"\n  }, `GM_xmlhttpRequest`), mdx(\"span\", {\n    parentName: \"code\",\n    \"className\": \"token punctuation\"\n  }, `(`), `details`, mdx(\"span\", {\n    parentName: \"code\",\n    \"className\": \"token punctuation\"\n  }, `)`)))), mdx(\"ul\", null, mdx(\"li\", {\n    parentName: \"ul\"\n  }, mdx(\"p\", {\n    parentName: \"li\"\n  }, mdx(\"code\", {\n    parentName: \"p\",\n    \"className\": \"language-text\"\n  }, `details`), ` `, mdx(\"em\", {\n    parentName: \"p\"\n  }, `object`), `:`), mdx(\"ul\", {\n    parentName: \"li\"\n  }, mdx(\"li\", {\n    parentName: \"ul\"\n  }, mdx(\"p\", {\n    parentName: \"li\"\n  }, mdx(\"code\", {\n    parentName: \"p\",\n    \"className\": \"language-text\"\n  }, `url`), ` `, mdx(\"em\", {\n    parentName: \"p\"\n  }, `string`), ` (required)`), mdx(\"p\", {\n    parentName: \"li\"\n  }, `  URL relative to current page is also allowed.`)), mdx(\"li\", {\n    parentName: \"ul\"\n  }, mdx(\"p\", {\n    parentName: \"li\"\n  }, mdx(\"code\", {\n    parentName: \"p\",\n    \"className\": \"language-text\"\n  }, `method`), ` `, mdx(\"em\", {\n    parentName: \"p\"\n  }, `string`)), mdx(\"p\", {\n    parentName: \"li\"\n  }, `  Usually `, mdx(\"code\", {\n    parentName: \"p\",\n    \"className\": \"language-text\"\n  }, `GET`), `.`)), mdx(\"li\", {\n    parentName: \"ul\"\n  }, mdx(\"p\", {\n    parentName: \"li\"\n  }, mdx(\"code\", {\n    parentName: \"p\",\n    \"className\": \"language-text\"\n  }, `user`), ` `, mdx(\"em\", {\n    parentName: \"p\"\n  }, `string`)), mdx(\"p\", {\n    parentName: \"li\"\n  }, `  User for authentication.`)), mdx(\"li\", {\n    parentName: \"ul\"\n  }, mdx(\"p\", {\n    parentName: \"li\"\n  }, mdx(\"code\", {\n    parentName: \"p\",\n    \"className\": \"language-text\"\n  }, `password`), ` `, mdx(\"em\", {\n    parentName: \"p\"\n  }, `string`)), mdx(\"p\", {\n    parentName: \"li\"\n  }, `  Password for authentication.`)), mdx(\"li\", {\n    parentName: \"ul\"\n  }, mdx(\"p\", {\n    parentName: \"li\"\n  }, mdx(\"code\", {\n    parentName: \"p\",\n    \"className\": \"language-text\"\n  }, `overrideMimeType`), ` `, mdx(\"em\", {\n    parentName: \"p\"\n  }, `string`)), mdx(\"p\", {\n    parentName: \"li\"\n  }, `  A MIME type to specify with the request.`)), mdx(\"li\", {\n    parentName: \"ul\"\n  }, mdx(\"p\", {\n    parentName: \"li\"\n  }, mdx(\"code\", {\n    parentName: \"p\",\n    \"className\": \"language-text\"\n  }, `headers`), ` `, mdx(\"em\", {\n    parentName: \"p\"\n  }, `object`)), mdx(\"p\", {\n    parentName: \"li\"\n  }, `  For example `, mdx(\"code\", {\n    parentName: \"p\",\n    \"className\": \"language-text\"\n  }, `{ 'name1': 'value1', 'name2': 'value2' }`), `.`), mdx(\"p\", {\n    parentName: \"li\"\n  }, `  Some special headers are also allowed:`), mdx(\"ul\", {\n    parentName: \"li\"\n  }, mdx(\"li\", {\n    parentName: \"ul\"\n  }, mdx(\"code\", {\n    parentName: \"li\",\n    \"className\": \"language-text\"\n  }, `'Cookie'`)), mdx(\"li\", {\n    parentName: \"ul\"\n  }, mdx(\"code\", {\n    parentName: \"li\",\n    \"className\": \"language-text\"\n  }, `'Host'`)), mdx(\"li\", {\n    parentName: \"ul\"\n  }, mdx(\"code\", {\n    parentName: \"li\",\n    \"className\": \"language-text\"\n  }, `'Origin'`)), mdx(\"li\", {\n    parentName: \"ul\"\n  }, mdx(\"code\", {\n    parentName: \"li\",\n    \"className\": \"language-text\"\n  }, `'Referer'`)), mdx(\"li\", {\n    parentName: \"ul\"\n  }, mdx(\"code\", {\n    parentName: \"li\",\n    \"className\": \"language-text\"\n  }, `'User-Agent'`)))), mdx(\"li\", {\n    parentName: \"ul\"\n  }, mdx(\"p\", {\n    parentName: \"li\"\n  }, mdx(\"code\", {\n    parentName: \"p\",\n    \"className\": \"language-text\"\n  }, `responseType`), ` `, mdx(\"em\", {\n    parentName: \"p\"\n  }, `string`)), mdx(\"p\", {\n    parentName: \"li\"\n  }, `  One of the following:`), mdx(\"ul\", {\n    parentName: \"li\"\n  }, mdx(\"li\", {\n    parentName: \"ul\"\n  }, mdx(\"code\", {\n    parentName: \"li\",\n    \"className\": \"language-text\"\n  }, `'text'`), ` `, mdx(\"em\", {\n    parentName: \"li\"\n  }, `(default value)`)), mdx(\"li\", {\n    parentName: \"ul\"\n  }, mdx(\"code\", {\n    parentName: \"li\",\n    \"className\": \"language-text\"\n  }, `'json'`)), mdx(\"li\", {\n    parentName: \"ul\"\n  }, mdx(\"code\", {\n    parentName: \"li\",\n    \"className\": \"language-text\"\n  }, `'blob'`)), mdx(\"li\", {\n    parentName: \"ul\"\n  }, mdx(\"code\", {\n    parentName: \"li\",\n    \"className\": \"language-text\"\n  }, `'arraybuffer'`)), mdx(\"li\", {\n    parentName: \"ul\"\n  }, mdx(\"code\", {\n    parentName: \"li\",\n    \"className\": \"language-text\"\n  }, `'document'`), ` `, mdx(\"em\", {\n    parentName: \"li\"\n  }, `(since VM2.12.0)`)))), mdx(\"li\", {\n    parentName: \"ul\"\n  }, mdx(\"p\", {\n    parentName: \"li\"\n  }, mdx(\"code\", {\n    parentName: \"p\",\n    \"className\": \"language-text\"\n  }, `timeout`), ` `, mdx(\"em\", {\n    parentName: \"p\"\n  }, `number`), ` `, mdx(\"em\", {\n    parentName: \"p\"\n  }, `(since VM2.9.5)`)), mdx(\"p\", {\n    parentName: \"li\"\n  }, `  Time to wait for the request, none by default.`)), mdx(\"li\", {\n    parentName: \"ul\"\n  }, mdx(\"p\", {\n    parentName: \"li\"\n  }, mdx(\"code\", {\n    parentName: \"p\",\n    \"className\": \"language-text\"\n  }, `data`), ` `, mdx(\"em\", {\n    parentName: \"p\"\n  }, `string | FormData | Blob`)), mdx(\"p\", {\n    parentName: \"li\"\n  }, `  Data to send with the request, usually for `, mdx(\"code\", {\n    parentName: \"p\",\n    \"className\": \"language-text\"\n  }, `POST`), ` and `, mdx(\"code\", {\n    parentName: \"p\",\n    \"className\": \"language-text\"\n  }, `PUT`), ` requests.`)), mdx(\"li\", {\n    parentName: \"ul\"\n  }, mdx(\"p\", {\n    parentName: \"li\"\n  }, mdx(\"code\", {\n    parentName: \"p\",\n    \"className\": \"language-text\"\n  }, `binary`), ` `, mdx(\"em\", {\n    parentName: \"p\"\n  }, `boolean`), ` `, mdx(\"em\", {\n    parentName: \"p\"\n  }, `(since VM2.12.2)`)), mdx(\"p\", {\n    parentName: \"li\"\n  }, `  Send the `, mdx(\"code\", {\n    parentName: \"p\",\n    \"className\": \"language-text\"\n  }, `data`), ` string as a `, mdx(\"code\", {\n    parentName: \"p\",\n    \"className\": \"language-text\"\n  }, `blob`), `. This is for compatibility with Tampermonkey/Greasemonkey, where only `, mdx(\"code\", {\n    parentName: \"p\",\n    \"className\": \"language-text\"\n  }, `string`), ` type is allowed in `, mdx(\"code\", {\n    parentName: \"p\",\n    \"className\": \"language-text\"\n  }, `data`), `.`)), mdx(\"li\", {\n    parentName: \"ul\"\n  }, mdx(\"p\", {\n    parentName: \"li\"\n  }, mdx(\"code\", {\n    parentName: \"p\",\n    \"className\": \"language-text\"\n  }, `context`), ` `, mdx(\"em\", {\n    parentName: \"p\"\n  }, `any`)), mdx(\"p\", {\n    parentName: \"li\"\n  }, `  Can be an object and will be assigned to `, mdx(\"code\", {\n    parentName: \"p\",\n    \"className\": \"language-text\"\n  }, `context`), ` of the response object.`)), mdx(\"li\", {\n    parentName: \"ul\"\n  }, mdx(\"p\", {\n    parentName: \"li\"\n  }, mdx(\"code\", {\n    parentName: \"p\",\n    \"className\": \"language-text\"\n  }, `anonymous`), ` `, mdx(\"em\", {\n    parentName: \"p\"\n  }, `boolean`), ` `, mdx(\"em\", {\n    parentName: \"p\"\n  }, `(since VM2.10.1)`)), mdx(\"div\", {\n    parentName: \"li\",\n    \"className\": \"gatsby-highlight\",\n    \"data-language\": \"text\"\n  }, mdx(\"pre\", {\n    parentName: \"div\",\n    \"className\": \"language-text\"\n  }, mdx(\"code\", {\n    parentName: \"pre\",\n    \"className\": \"language-text\"\n  }, `When set to \\`true\\`, no cookie will be sent with the request and since VM2.12.5 the response cookies will be ignored. The default value is \\`false\\`.`))), mdx(\"p\", {\n    parentName: \"li\"\n  }, `Event handlers:`)), mdx(\"li\", {\n    parentName: \"ul\"\n  }, mdx(\"p\", {\n    parentName: \"li\"\n  }, mdx(\"code\", {\n    parentName: \"p\",\n    \"className\": \"language-text\"\n  }, `onabort`))), mdx(\"li\", {\n    parentName: \"ul\"\n  }, mdx(\"p\", {\n    parentName: \"li\"\n  }, mdx(\"code\", {\n    parentName: \"p\",\n    \"className\": \"language-text\"\n  }, `onerror`))), mdx(\"li\", {\n    parentName: \"ul\"\n  }, mdx(\"p\", {\n    parentName: \"li\"\n  }, mdx(\"code\", {\n    parentName: \"p\",\n    \"className\": \"language-text\"\n  }, `onload`))), mdx(\"li\", {\n    parentName: \"ul\"\n  }, mdx(\"p\", {\n    parentName: \"li\"\n  }, mdx(\"code\", {\n    parentName: \"p\",\n    \"className\": \"language-text\"\n  }, `onloadend`))), mdx(\"li\", {\n    parentName: \"ul\"\n  }, mdx(\"p\", {\n    parentName: \"li\"\n  }, mdx(\"code\", {\n    parentName: \"p\",\n    \"className\": \"language-text\"\n  }, `onloadstart`), ` `, mdx(\"em\", {\n    parentName: \"p\"\n  }, `(since VM2.12.5)`))), mdx(\"li\", {\n    parentName: \"ul\"\n  }, mdx(\"p\", {\n    parentName: \"li\"\n  }, mdx(\"code\", {\n    parentName: \"p\",\n    \"className\": \"language-text\"\n  }, `onprogress`))), mdx(\"li\", {\n    parentName: \"ul\"\n  }, mdx(\"p\", {\n    parentName: \"li\"\n  }, mdx(\"code\", {\n    parentName: \"p\",\n    \"className\": \"language-text\"\n  }, `onreadystatechange`))), mdx(\"li\", {\n    parentName: \"ul\"\n  }, mdx(\"p\", {\n    parentName: \"li\"\n  }, mdx(\"code\", {\n    parentName: \"p\",\n    \"className\": \"language-text\"\n  }, `ontimeout`)), mdx(\"p\", {\n    parentName: \"li\"\n  }, `Each event handler is a `, mdx(\"em\", {\n    parentName: \"p\"\n  }, `function`), ` that accepts one argument `, mdx(\"code\", {\n    parentName: \"p\",\n    \"className\": \"language-text\"\n  }, `responseObject`)))))), mdx(\"blockquote\", null, mdx(\"p\", {\n    parentName: \"blockquote\"\n  }, `Note:`), mdx(\"ul\", {\n    parentName: \"blockquote\"\n  }, mdx(\"li\", {\n    parentName: \"ul\"\n  }, mdx(\"code\", {\n    parentName: \"li\",\n    \"className\": \"language-text\"\n  }, `synchronous`), ` is not supported.`))), mdx(\"p\", null, `Returns a control object with the following properties:`), mdx(\"ul\", null, mdx(\"li\", {\n    parentName: \"ul\"\n  }, mdx(\"p\", {\n    parentName: \"li\"\n  }, mdx(\"code\", {\n    parentName: \"p\",\n    \"className\": \"language-text\"\n  }, `abort`), ` `, mdx(\"em\", {\n    parentName: \"p\"\n  }, `function()`)), mdx(\"p\", {\n    parentName: \"li\"\n  }, `  A function to abort the request.`))), mdx(\"p\", null, `The response object is passed to each event handler with the following properties, most of which are identical to those provided by the standard `, mdx(\"a\", {\n    parentName: \"p\",\n    \"href\": \"https://developer.mozilla.org/docs/Web/API/XMLHttpRequest\",\n    \"target\": \"_blank\",\n    \"rel\": \"noopener noreferrer\"\n  }, `XMLHttpRequest`), `:`), mdx(\"ul\", null, mdx(\"li\", {\n    parentName: \"ul\"\n  }, mdx(\"code\", {\n    parentName: \"li\",\n    \"className\": \"language-text\"\n  }, `status`), ` `, mdx(\"em\", {\n    parentName: \"li\"\n  }, `number`)), mdx(\"li\", {\n    parentName: \"ul\"\n  }, mdx(\"code\", {\n    parentName: \"li\",\n    \"className\": \"language-text\"\n  }, `statusText`), ` `, mdx(\"em\", {\n    parentName: \"li\"\n  }, `string`)), mdx(\"li\", {\n    parentName: \"ul\"\n  }, mdx(\"code\", {\n    parentName: \"li\",\n    \"className\": \"language-text\"\n  }, `readyState`), ` `, mdx(\"em\", {\n    parentName: \"li\"\n  }, `number`)), mdx(\"li\", {\n    parentName: \"ul\"\n  }, mdx(\"code\", {\n    parentName: \"li\",\n    \"className\": \"language-text\"\n  }, `responseHeaders`), ` `, mdx(\"em\", {\n    parentName: \"li\"\n  }, `string`)), mdx(\"li\", {\n    parentName: \"ul\"\n  }, mdx(\"code\", {\n    parentName: \"li\",\n    \"className\": \"language-text\"\n  }, `response`), ` `, mdx(\"em\", {\n    parentName: \"li\"\n  }, `string | Blob | ArrayBuffer | Document | Object | null`)), mdx(\"li\", {\n    parentName: \"ul\"\n  }, mdx(\"code\", {\n    parentName: \"li\",\n    \"className\": \"language-text\"\n  }, `responseText`), ` `, mdx(\"em\", {\n    parentName: \"li\"\n  }, `string | undefined`), `, only provided when available`), mdx(\"li\", {\n    parentName: \"ul\"\n  }, mdx(\"code\", {\n    parentName: \"li\",\n    \"className\": \"language-text\"\n  }, `finalUrl`), ` `, mdx(\"em\", {\n    parentName: \"li\"\n  }, `string`), `, the final URL after redirection`), mdx(\"li\", {\n    parentName: \"ul\"\n  }, mdx(\"code\", {\n    parentName: \"li\",\n    \"className\": \"language-text\"\n  }, `context`), ` `, mdx(\"em\", {\n    parentName: \"li\"\n  }, `any`), `, the same `, mdx(\"code\", {\n    parentName: \"li\",\n    \"className\": \"language-text\"\n  }, `context`), ` object you specified in `, mdx(\"code\", {\n    parentName: \"li\",\n    \"className\": \"language-text\"\n  }, `details`))), mdx(\"h3\", {\n    \"id\": \"gm_download\",\n    \"style\": {\n      \"position\": \"relative\"\n    }\n  }, mdx(\"a\", {\n    parentName: \"h3\",\n    \"href\": \"#gm_download\",\n    \"aria-label\": \"gm_download permalink\",\n    \"className\": \"anchor before\"\n  }, mdx(\"svg\", {\n    parentName: \"a\",\n    \"aria-hidden\": \"true\",\n    \"focusable\": \"false\",\n    \"height\": \"16\",\n    \"version\": \"1.1\",\n    \"viewBox\": \"0 0 16 16\",\n    \"width\": \"16\"\n  }, mdx(\"path\", {\n    parentName: \"svg\",\n    \"fillRule\": \"evenodd\",\n    \"d\": \"M4 9h1v1H4c-1.5 0-3-1.69-3-3.5S2.55 3 4 3h4c1.45 0 3 1.69 3 3.5 0 1.41-.91 2.72-2 3.25V8.59c.58-.45 1-1.27 1-2.09C10 5.22 8.98 4 8 4H4c-.98 0-2 1.22-2 2.5S3 9 4 9zm9-3h-1v1h1c1 0 2 1.22 2 2.5S13.98 12 13 12H9c-.98 0-2-1.22-2-2.5 0-.83.42-1.64 1-2.09V6.25c-1.09.53-2 1.84-2 3.25C6 11.31 7.55 13 9 13h4c1.45 0 3-1.69 3-3.5S14.5 6 13 6z\"\n  }))), `GM_download`), mdx(\"p\", null, mdx(\"em\", {\n    parentName: \"p\"\n  }, `Since VM2.9.5`)), mdx(\"p\", null, `Downloads a URL to a local file.`), mdx(\"ol\", null, mdx(\"li\", {\n    parentName: \"ol\"\n  }, mdx(\"p\", {\n    parentName: \"li\"\n  }, `using an object:`), mdx(\"div\", {\n    parentName: \"li\",\n    \"className\": \"gatsby-highlight\",\n    \"data-language\": \"js\"\n  }, mdx(\"pre\", {\n    parentName: \"div\",\n    \"className\": \"language-js\"\n  }, mdx(\"code\", {\n    parentName: \"pre\",\n    \"className\": \"language-js\"\n  }, mdx(\"span\", {\n    parentName: \"code\",\n    \"className\": \"token function\"\n  }, `GM_download`), mdx(\"span\", {\n    parentName: \"code\",\n    \"className\": \"token punctuation\"\n  }, `(`), `options`, mdx(\"span\", {\n    parentName: \"code\",\n    \"className\": \"token punctuation\"\n  }, `)`)))), mdx(\"ul\", {\n    parentName: \"li\"\n  }, mdx(\"li\", {\n    parentName: \"ul\"\n  }, mdx(\"p\", {\n    parentName: \"li\"\n  }, mdx(\"code\", {\n    parentName: \"p\",\n    \"className\": \"language-text\"\n  }, `options`), ` `, mdx(\"em\", {\n    parentName: \"p\"\n  }, `object`), `:`), mdx(\"ul\", {\n    parentName: \"li\"\n  }, mdx(\"li\", {\n    parentName: \"ul\"\n  }, mdx(\"p\", {\n    parentName: \"li\"\n  }, mdx(\"code\", {\n    parentName: \"p\",\n    \"className\": \"language-text\"\n  }, `url`), ` `, mdx(\"em\", {\n    parentName: \"p\"\n  }, `string`), ` (required)`), mdx(\"p\", {\n    parentName: \"li\"\n  }, `  The URL to download.`)), mdx(\"li\", {\n    parentName: \"ul\"\n  }, mdx(\"p\", {\n    parentName: \"li\"\n  }, mdx(\"code\", {\n    parentName: \"p\",\n    \"className\": \"language-text\"\n  }, `name`), ` `, mdx(\"em\", {\n    parentName: \"p\"\n  }, `string`)), mdx(\"p\", {\n    parentName: \"li\"\n  }, `  The filename to save as.`)), mdx(\"li\", {\n    parentName: \"ul\"\n  }, mdx(\"p\", {\n    parentName: \"li\"\n  }, mdx(\"code\", {\n    parentName: \"p\",\n    \"className\": \"language-text\"\n  }, `onload`), ` `, mdx(\"em\", {\n    parentName: \"p\"\n  }, `function`)), mdx(\"div\", {\n    parentName: \"li\",\n    \"className\": \"gatsby-highlight\",\n    \"data-language\": \"text\"\n  }, mdx(\"pre\", {\n    parentName: \"div\",\n    \"className\": \"language-text\"\n  }, mdx(\"code\", {\n    parentName: \"pre\",\n    \"className\": \"language-text\"\n  }, `The function to call when download starts successfully.`))), mdx(\"p\", {\n    parentName: \"li\"\n  }, `These are the same as in `, mdx(\"a\", {\n    parentName: \"p\",\n    \"href\": \"#gm_xmlhttprequest\"\n  }, `GM_xmlhttpRequest`), `:`)), mdx(\"li\", {\n    parentName: \"ul\"\n  }, mdx(\"p\", {\n    parentName: \"li\"\n  }, mdx(\"code\", {\n    parentName: \"p\",\n    \"className\": \"language-text\"\n  }, `headers`), ` `, mdx(\"em\", {\n    parentName: \"p\"\n  }, `object`))), mdx(\"li\", {\n    parentName: \"ul\"\n  }, mdx(\"p\", {\n    parentName: \"li\"\n  }, mdx(\"code\", {\n    parentName: \"p\",\n    \"className\": \"language-text\"\n  }, `timeout`), ` `, mdx(\"em\", {\n    parentName: \"p\"\n  }, `number`))), mdx(\"li\", {\n    parentName: \"ul\"\n  }, mdx(\"p\", {\n    parentName: \"li\"\n  }, mdx(\"code\", {\n    parentName: \"p\",\n    \"className\": \"language-text\"\n  }, `onerror`), ` `, mdx(\"em\", {\n    parentName: \"p\"\n  }, `function`))), mdx(\"li\", {\n    parentName: \"ul\"\n  }, mdx(\"p\", {\n    parentName: \"li\"\n  }, mdx(\"code\", {\n    parentName: \"p\",\n    \"className\": \"language-text\"\n  }, `onprogress`), ` `, mdx(\"em\", {\n    parentName: \"p\"\n  }, `function`))), mdx(\"li\", {\n    parentName: \"ul\"\n  }, mdx(\"p\", {\n    parentName: \"li\"\n  }, mdx(\"code\", {\n    parentName: \"p\",\n    \"className\": \"language-text\"\n  }, `ontimeout`), ` `, mdx(\"em\", {\n    parentName: \"p\"\n  }, `function`))))))), mdx(\"li\", {\n    parentName: \"ol\"\n  }, mdx(\"p\", {\n    parentName: \"li\"\n  }, `using separate parameters:`), mdx(\"div\", {\n    parentName: \"li\",\n    \"className\": \"gatsby-highlight\",\n    \"data-language\": \"js\"\n  }, mdx(\"pre\", {\n    parentName: \"div\",\n    \"className\": \"language-js\"\n  }, mdx(\"code\", {\n    parentName: \"pre\",\n    \"className\": \"language-js\"\n  }, mdx(\"span\", {\n    parentName: \"code\",\n    \"className\": \"token function\"\n  }, `GM_download`), mdx(\"span\", {\n    parentName: \"code\",\n    \"className\": \"token punctuation\"\n  }, `(`), `url`, mdx(\"span\", {\n    parentName: \"code\",\n    \"className\": \"token punctuation\"\n  }, `,`), ` name`, mdx(\"span\", {\n    parentName: \"code\",\n    \"className\": \"token punctuation\"\n  }, `)`)))), mdx(\"ul\", {\n    parentName: \"li\"\n  }, mdx(\"li\", {\n    parentName: \"ul\"\n  }, mdx(\"p\", {\n    parentName: \"li\"\n  }, mdx(\"code\", {\n    parentName: \"p\",\n    \"className\": \"language-text\"\n  }, `url`), ` `, mdx(\"em\", {\n    parentName: \"p\"\n  }, `string`), ` (required)`), mdx(\"p\", {\n    parentName: \"li\"\n  }, `  The URL to download.`)), mdx(\"li\", {\n    parentName: \"ul\"\n  }, mdx(\"p\", {\n    parentName: \"li\"\n  }, mdx(\"code\", {\n    parentName: \"p\",\n    \"className\": \"language-text\"\n  }, `name`), ` `, mdx(\"em\", {\n    parentName: \"p\"\n  }, `string`)), mdx(\"p\", {\n    parentName: \"li\"\n  }, `  The filename to save as.`))))), mdx(\"h2\", {\n    \"id\": \"gm\",\n    \"style\": {\n      \"position\": \"relative\"\n    }\n  }, mdx(\"a\", {\n    parentName: \"h2\",\n    \"href\": \"#gm\",\n    \"aria-label\": \"gm permalink\",\n    \"className\": \"anchor before\"\n  }, mdx(\"svg\", {\n    parentName: \"a\",\n    \"aria-hidden\": \"true\",\n    \"focusable\": \"false\",\n    \"height\": \"16\",\n    \"version\": \"1.1\",\n    \"viewBox\": \"0 0 16 16\",\n    \"width\": \"16\"\n  }, mdx(\"path\", {\n    parentName: \"svg\",\n    \"fillRule\": \"evenodd\",\n    \"d\": \"M4 9h1v1H4c-1.5 0-3-1.69-3-3.5S2.55 3 4 3h4c1.45 0 3 1.69 3 3.5 0 1.41-.91 2.72-2 3.25V8.59c.58-.45 1-1.27 1-2.09C10 5.22 8.98 4 8 4H4c-.98 0-2 1.22-2 2.5S3 9 4 9zm9-3h-1v1h1c1 0 2 1.22 2 2.5S13.98 12 13 12H9c-.98 0-2-1.22-2-2.5 0-.83.42-1.64 1-2.09V6.25c-1.09.53-2 1.84-2 3.25C6 11.31 7.55 13 9 13h4c1.45 0 3-1.69 3-3.5S14.5 6 13 6z\"\n  }))), `GM.*`), mdx(\"p\", null, mdx(\"code\", {\n    parentName: \"p\",\n    \"className\": \"language-text\"\n  }, `GM`), ` `, mdx(\"em\", {\n    parentName: \"p\"\n  }, `(since VM2.12.0)`), ` is a single variable with `, mdx(\"a\", {\n    parentName: \"p\",\n    \"href\": \"https://wiki.greasespot.net/Greasemonkey_Manual:API\",\n    \"target\": \"_blank\",\n    \"rel\": \"noopener noreferrer\"\n  }, `Greasemonkey4-compatible`), ` aliases:`), mdx(\"ul\", null, mdx(\"li\", {\n    parentName: \"ul\"\n  }, mdx(\"a\", {\n    parentName: \"li\",\n    \"href\": \"#gm_addstyle\"\n  }, `GM.addStyle`)), mdx(\"li\", {\n    parentName: \"ul\"\n  }, mdx(\"a\", {\n    parentName: \"li\",\n    \"href\": \"#gm_addelement\"\n  }, `GM.addElement`), ` - `, mdx(\"em\", {\n    parentName: \"li\"\n  }, `since VM2.13.1`)), mdx(\"li\", {\n    parentName: \"ul\"\n  }, mdx(\"a\", {\n    parentName: \"li\",\n    \"href\": \"#gm_registermenucommand\"\n  }, `GM.registerMenuCommand`), ` - `, mdx(\"em\", {\n    parentName: \"li\"\n  }, `since VM2.12.10, GM4.11`)), mdx(\"li\", {\n    parentName: \"ul\"\n  }, mdx(\"a\", {\n    parentName: \"li\",\n    \"href\": \"#gm_deletevalue\"\n  }, `GM.deleteValue`), ` `, mdx(\"em\", {\n    parentName: \"li\"\n  }, `(async)`)), mdx(\"li\", {\n    parentName: \"ul\"\n  }, mdx(\"a\", {\n    parentName: \"li\",\n    \"href\": \"#gm_getresourceurl\"\n  }, `GM.getResourceUrl`), ` `, mdx(\"em\", {\n    parentName: \"li\"\n  }, `(async)`), ` - in VM2.12.0...2.13.0 it was misspelled as `, mdx(\"code\", {\n    parentName: \"li\",\n    \"className\": \"language-text\"\n  }, `GM.getResourceURL`)), mdx(\"li\", {\n    parentName: \"ul\"\n  }, mdx(\"a\", {\n    parentName: \"li\",\n    \"href\": \"#gm_getvalue\"\n  }, `GM.getValue`), ` `, mdx(\"em\", {\n    parentName: \"li\"\n  }, `(async)`)), mdx(\"li\", {\n    parentName: \"ul\"\n  }, mdx(\"a\", {\n    parentName: \"li\",\n    \"href\": \"#gm_info\"\n  }, `GM.info`)), mdx(\"li\", {\n    parentName: \"ul\"\n  }, mdx(\"a\", {\n    parentName: \"li\",\n    \"href\": \"#gm_listvalues\"\n  }, `GM.listValues`), ` `, mdx(\"em\", {\n    parentName: \"li\"\n  }, `(async)`)), mdx(\"li\", {\n    parentName: \"ul\"\n  }, mdx(\"a\", {\n    parentName: \"li\",\n    \"href\": \"#gm_notification\"\n  }, `GM.notification`)), mdx(\"li\", {\n    parentName: \"ul\"\n  }, mdx(\"a\", {\n    parentName: \"li\",\n    \"href\": \"#gm_openintab\"\n  }, `GM.openInTab`)), mdx(\"li\", {\n    parentName: \"ul\"\n  }, mdx(\"a\", {\n    parentName: \"li\",\n    \"href\": \"#gm_setclipboard\"\n  }, `GM.setClipboard`)), mdx(\"li\", {\n    parentName: \"ul\"\n  }, mdx(\"a\", {\n    parentName: \"li\",\n    \"href\": \"#gm_setvalue\"\n  }, `GM.setValue`), ` `, mdx(\"em\", {\n    parentName: \"li\"\n  }, `(async)`)), mdx(\"li\", {\n    parentName: \"ul\"\n  }, mdx(\"a\", {\n    parentName: \"li\",\n    \"href\": \"#gm_xmlhttprequest\"\n  }, `GM.xmlHttpRequest`), ` - note `, mdx(\"code\", {\n    parentName: \"li\",\n    \"className\": \"language-text\"\n  }, `H`), ` is uppercase`)), mdx(\"p\", null, `The `, mdx(\"code\", {\n    parentName: \"p\",\n    \"className\": \"language-text\"\n  }, `async`), ` functions return a `, mdx(\"code\", {\n    parentName: \"p\",\n    \"className\": \"language-text\"\n  }, `Promise`), ` that's resolved with the returned value.`));\n}\n;\nMDXContent.isMDXComponent = true;","tableOfContents":{"items":[{"url":"#gm_","title":"GM_*","items":[{"url":"#gm_info","title":"GM_info"},{"url":"#gm_getvalue","title":"GM_getValue"},{"url":"#gm_setvalue","title":"GM_setValue"},{"url":"#gm_deletevalue","title":"GM_deleteValue"},{"url":"#gm_listvalues","title":"GM_listValues"},{"url":"#gm_addvaluechangelistener","title":"GM_addValueChangeListener"},{"url":"#gm_removevaluechangelistener","title":"GM_removeValueChangeListener"},{"url":"#gm_getresourcetext","title":"GM_getResourceText"},{"url":"#gm_getresourceurl","title":"GM_getResourceURL"},{"url":"#gm_addelement","title":"GM_addElement"},{"url":"#gm_addstyle","title":"GM_addStyle"},{"url":"#gm_openintab","title":"GM_openInTab"},{"url":"#gm_registermenucommand","title":"GM_registerMenuCommand"},{"url":"#gm_unregistermenucommand","title":"GM_unregisterMenuCommand"},{"url":"#gm_notification","title":"GM_notification"},{"url":"#gm_setclipboard","title":"GM_setClipboard"},{"url":"#gm_xmlhttprequest","title":"GM_xmlhttpRequest"},{"url":"#gm_download","title":"GM_download"}]},{"url":"#gm","title":"GM.*"}]}}},"pageContext":{"id":"b5a05c86-b9ba-5449-b559-173e9ad36184","fields__slug":"/api/gm/","__params":{"fields__slug":"api"}}},"staticQueryHashes":["1878747374","2344890832","323714418"]}