{"componentChunkName":"component---src-pages-mdx-fields-slug-index-js","path":"/posts/violentmonkey-workflows/","result":{"data":{"mdx":{"fields":{"slug":"/posts/violentmonkey-workflows/"},"frontmatter":{"title":"Violentmonkey Workflows","date":"February 19, 2021","sidebar":null},"body":"const _excluded = [\"components\"];\n\nfunction _extends() { _extends = Object.assign ? Object.assign.bind() : function (target) { for (var i = 1; i < arguments.length; i++) { var source = arguments[i]; for (var key in source) { if (Object.prototype.hasOwnProperty.call(source, key)) { target[key] = source[key]; } } } return target; }; return _extends.apply(this, arguments); }\n\nfunction _objectWithoutProperties(source, excluded) { if (source == null) return {}; var target = _objectWithoutPropertiesLoose(source, excluded); var key, i; if (Object.getOwnPropertySymbols) { var sourceSymbolKeys = Object.getOwnPropertySymbols(source); for (i = 0; i < sourceSymbolKeys.length; i++) { key = sourceSymbolKeys[i]; if (excluded.indexOf(key) >= 0) continue; if (!Object.prototype.propertyIsEnumerable.call(source, key)) continue; target[key] = source[key]; } } return target; }\n\nfunction _objectWithoutPropertiesLoose(source, excluded) { if (source == null) return {}; var target = {}; var sourceKeys = Object.keys(source); var key, i; for (i = 0; i < sourceKeys.length; i++) { key = sourceKeys[i]; if (excluded.indexOf(key) >= 0) continue; target[key] = source[key]; } return target; }\n\n/* @jsxRuntime classic */\n\n/* @jsx mdx */\nconst _frontmatter = {\n  \"title\": \"Violentmonkey Workflows\",\n  \"date\": \"2021-02-19 21:21:04+0800\",\n  \"tags\": [\"development\"],\n  \"path\": \"/posts/violentmonkey-workflows/\"\n};\nconst layoutProps = {\n  _frontmatter\n};\nconst MDXLayout = \"wrapper\";\nreturn function MDXContent(_ref) {\n  let {\n    components\n  } = _ref,\n      props = _objectWithoutProperties(_ref, _excluded);\n\n  return mdx(MDXLayout, _extends({}, layoutProps, props, {\n    components: components,\n    mdxType: \"MDXLayout\"\n  }), mdx(\"p\", null, `Some facts:`), mdx(\"ul\", null, mdx(\"li\", {\n    parentName: \"ul\"\n  }, `There are some users worrying about privacy issues and malicious code in Violentmonkey's released versions (`, mdx(\"a\", {\n    parentName: \"li\",\n    \"href\": \"https://github.com/violentmonkey/violentmonkey/issues/1109\",\n    \"target\": \"_blank\",\n    \"rel\": \"noopener noreferrer\"\n  }, `#1109`), `).`), mdx(\"li\", {\n    parentName: \"ul\"\n  }, `There is some disingenuous guy `, mdx(\"a\", {\n    parentName: \"li\",\n    \"href\": \"https://www.reddit.com/r/firefox/comments/9uemks/greasemonkey_tampermonkey_violentmonkey_which_one/ehgky9a/\",\n    \"target\": \"_blank\",\n    \"rel\": \"noopener noreferrer\"\n  }, `telling that Violentmonkey is trying to \"disguise the bad things the addon is doing\"`), `. This is of course not true. Thanks to @Venryx for letting me know this (`, mdx(\"a\", {\n    parentName: \"li\",\n    \"href\": \"https://github.com/violentmonkey/violentmonkey/issues/587\",\n    \"target\": \"_blank\",\n    \"rel\": \"noopener noreferrer\"\n  }, `#587`), `).`)), mdx(\"p\", null, `This post is trying to clarify the development workflows and how the extension is reviewed before it can be published at CWS (Chrome Web Store), AMO (addons.mozilla.org), Microsoft Edge Addons (MEA), etc.`), mdx(\"h2\", {\n    \"id\": \"workflows\",\n    \"style\": {\n      \"position\": \"relative\"\n    }\n  }, mdx(\"a\", {\n    parentName: \"h2\",\n    \"href\": \"#workflows\",\n    \"aria-label\": \"workflows permalink\",\n    \"className\": \"anchor before\"\n  }, mdx(\"svg\", {\n    parentName: \"a\",\n    \"aria-hidden\": \"true\",\n    \"focusable\": \"false\",\n    \"height\": \"16\",\n    \"version\": \"1.1\",\n    \"viewBox\": \"0 0 16 16\",\n    \"width\": \"16\"\n  }, mdx(\"path\", {\n    parentName: \"svg\",\n    \"fillRule\": \"evenodd\",\n    \"d\": \"M4 9h1v1H4c-1.5 0-3-1.69-3-3.5S2.55 3 4 3h4c1.45 0 3 1.69 3 3.5 0 1.41-.91 2.72-2 3.25V8.59c.58-.45 1-1.27 1-2.09C10 5.22 8.98 4 8 4H4c-.98 0-2 1.22-2 2.5S3 9 4 9zm9-3h-1v1h1c1 0 2 1.22 2 2.5S13.98 12 13 12H9c-.98 0-2-1.22-2-2.5 0-.83.42-1.64 1-2.09V6.25c-1.09.53-2 1.84-2 3.25C6 11.31 7.55 13 9 13h4c1.45 0 3-1.69 3-3.5S14.5 6 13 6z\"\n  }))), `Workflows`), mdx(\"p\", null, `Basically we develop Violentmonkey with modern JavaScript syntax (ESNext) and build it with Babel, Webpack and their friends.`), mdx(\"p\", null, `The source code is all kept in `, mdx(\"code\", {\n    parentName: \"p\",\n    \"className\": \"language-text\"\n  }, `src`), `. All the dependencies are imported via standard ES modules from NPM installed packages. The dependencies are installed via `, mdx(\"code\", {\n    parentName: \"p\",\n    \"className\": \"language-text\"\n  }, `yarn`), ` so that we can leverage `, mdx(\"code\", {\n    parentName: \"p\",\n    \"className\": \"language-text\"\n  }, `yarn.lock`), ` to make sure every developer gets exactly the same dependencies installed.`), mdx(\"h3\", {\n    \"id\": \"development\",\n    \"style\": {\n      \"position\": \"relative\"\n    }\n  }, mdx(\"a\", {\n    parentName: \"h3\",\n    \"href\": \"#development\",\n    \"aria-label\": \"development permalink\",\n    \"className\": \"anchor before\"\n  }, mdx(\"svg\", {\n    parentName: \"a\",\n    \"aria-hidden\": \"true\",\n    \"focusable\": \"false\",\n    \"height\": \"16\",\n    \"version\": \"1.1\",\n    \"viewBox\": \"0 0 16 16\",\n    \"width\": \"16\"\n  }, mdx(\"path\", {\n    parentName: \"svg\",\n    \"fillRule\": \"evenodd\",\n    \"d\": \"M4 9h1v1H4c-1.5 0-3-1.69-3-3.5S2.55 3 4 3h4c1.45 0 3 1.69 3 3.5 0 1.41-.91 2.72-2 3.25V8.59c.58-.45 1-1.27 1-2.09C10 5.22 8.98 4 8 4H4c-.98 0-2 1.22-2 2.5S3 9 4 9zm9-3h-1v1h1c1 0 2 1.22 2 2.5S13.98 12 13 12H9c-.98 0-2-1.22-2-2.5 0-.83.42-1.64 1-2.09V6.25c-1.09.53-2 1.84-2 3.25C6 11.31 7.55 13 9 13h4c1.45 0 3-1.69 3-3.5S14.5 6 13 6z\"\n  }))), `Development`), mdx(\"p\", null, `By running `, mdx(\"code\", {\n    parentName: \"p\",\n    \"className\": \"language-text\"\n  }, `yarn dev`), `, we can get the development package in `, mdx(\"code\", {\n    parentName: \"p\",\n    \"className\": \"language-text\"\n  }, `dist`), `, which is unminified. The compiler keeps writing updates to `, mdx(\"code\", {\n    parentName: \"p\",\n    \"className\": \"language-text\"\n  }, `dist`), ` once the source code changes.`), mdx(\"p\", null, `The files in development mode contains a lot of code that should not run for users, such as development logs, helpful warnings for developers, etc. That is why the bundles generated during development are much larger (perhaps 10x) than those in the final release and runs much slower.`), mdx(\"h3\", {\n    \"id\": \"release\",\n    \"style\": {\n      \"position\": \"relative\"\n    }\n  }, mdx(\"a\", {\n    parentName: \"h3\",\n    \"href\": \"#release\",\n    \"aria-label\": \"release permalink\",\n    \"className\": \"anchor before\"\n  }, mdx(\"svg\", {\n    parentName: \"a\",\n    \"aria-hidden\": \"true\",\n    \"focusable\": \"false\",\n    \"height\": \"16\",\n    \"version\": \"1.1\",\n    \"viewBox\": \"0 0 16 16\",\n    \"width\": \"16\"\n  }, mdx(\"path\", {\n    parentName: \"svg\",\n    \"fillRule\": \"evenodd\",\n    \"d\": \"M4 9h1v1H4c-1.5 0-3-1.69-3-3.5S2.55 3 4 3h4c1.45 0 3 1.69 3 3.5 0 1.41-.91 2.72-2 3.25V8.59c.58-.45 1-1.27 1-2.09C10 5.22 8.98 4 8 4H4c-.98 0-2 1.22-2 2.5S3 9 4 9zm9-3h-1v1h1c1 0 2 1.22 2 2.5S13.98 12 13 12H9c-.98 0-2-1.22-2-2.5 0-.83.42-1.64 1-2.09V6.25c-1.09.53-2 1.84-2 3.25C6 11.31 7.55 13 9 13h4c1.45 0 3-1.69 3-3.5S14.5 6 13 6z\"\n  }))), `Release`), mdx(\"p\", null, `When we are ready for a new release, we run `, mdx(\"code\", {\n    parentName: \"p\",\n    \"className\": \"language-text\"\n  }, `yarn build`), ` to compile the source code in production mode, dropping all unnecessary spaces, debugging code, dead code, and optimizing statements to make them shorter.`), mdx(\"p\", null, `All the tools involved in the toolchain are either included in the source code or installed via NPM, in other words they are totally public, and you can always check the code and build your own version.`), mdx(\"p\", null, `Thanks to GitHub actions, the build process is triggered automatically once a tag is created in the repository, completely transparent to users. The action definitions can be found at `, mdx(\"a\", {\n    parentName: \"p\",\n    \"href\": \"https://github.com/violentmonkey/violentmonkey/blob/master/.github/workflows/release.yml\",\n    \"target\": \"_blank\",\n    \"rel\": \"noopener noreferrer\"\n  }, `.github/workflows/release.yml`), `.`), mdx(\"h3\", {\n    \"id\": \"publication\",\n    \"style\": {\n      \"position\": \"relative\"\n    }\n  }, mdx(\"a\", {\n    parentName: \"h3\",\n    \"href\": \"#publication\",\n    \"aria-label\": \"publication permalink\",\n    \"className\": \"anchor before\"\n  }, mdx(\"svg\", {\n    parentName: \"a\",\n    \"aria-hidden\": \"true\",\n    \"focusable\": \"false\",\n    \"height\": \"16\",\n    \"version\": \"1.1\",\n    \"viewBox\": \"0 0 16 16\",\n    \"width\": \"16\"\n  }, mdx(\"path\", {\n    parentName: \"svg\",\n    \"fillRule\": \"evenodd\",\n    \"d\": \"M4 9h1v1H4c-1.5 0-3-1.69-3-3.5S2.55 3 4 3h4c1.45 0 3 1.69 3 3.5 0 1.41-.91 2.72-2 3.25V8.59c.58-.45 1-1.27 1-2.09C10 5.22 8.98 4 8 4H4c-.98 0-2 1.22-2 2.5S3 9 4 9zm9-3h-1v1h1c1 0 2 1.22 2 2.5S13.98 12 13 12H9c-.98 0-2-1.22-2-2.5 0-.83.42-1.64 1-2.09V6.25c-1.09.53-2 1.84-2 3.25C6 11.31 7.55 13 9 13h4c1.45 0 3-1.69 3-3.5S14.5 6 13 6z\"\n  }))), `Publication`), mdx(\"p\", null, `After the release package is created by GitHub actions, we download the release package and upload it to different stores.`), mdx(\"p\", null, `There is a review step in all popular stores. In CWS we have to clarify why each permission is required in `, mdx(\"code\", {\n    parentName: \"p\",\n    \"className\": \"language-text\"\n  }, `manifest.json`), `. `, mdx(\"strong\", {\n    parentName: \"p\"\n  }, `In AMO and MEA we need to provide the source code and tell the reviewers how our project is built, then the reviewers build the package from scratch and compare it to the version we submitted to make sure they are the same.`), ` So if you are installing Violentmonkey from the official links, you don't need to worry about trackers or malicious code that is not shown in the source code because the reviewers have confirmed they are clean.`), mdx(\"p\", null, `One exception is the beta release for Firefox, which is self-signed and self-hosted, aka. unlisted version -- AMO has `, mdx(\"a\", {\n    parentName: \"p\",\n    \"href\": \"https://blog.mozilla.org/addons/2018/02/28/discontinuing-support-for-beta-versions/\",\n    \"target\": \"_blank\",\n    \"rel\": \"noopener noreferrer\"\n  }, `dropped support for beta versions and recommended the unlisted version for testing purpose`), ` since 2018. We serve our beta versions on top of this feature, and the whole process is automated via GitHub actions as mentioned above. The generated package is immediately uploaded to AMO and signed, and then uploaded to GitHub assets.`), mdx(\"h2\", {\n    \"id\": \"why-is-the-source-code-compiled\",\n    \"style\": {\n      \"position\": \"relative\"\n    }\n  }, mdx(\"a\", {\n    parentName: \"h2\",\n    \"href\": \"#why-is-the-source-code-compiled\",\n    \"aria-label\": \"why is the source code compiled permalink\",\n    \"className\": \"anchor before\"\n  }, mdx(\"svg\", {\n    parentName: \"a\",\n    \"aria-hidden\": \"true\",\n    \"focusable\": \"false\",\n    \"height\": \"16\",\n    \"version\": \"1.1\",\n    \"viewBox\": \"0 0 16 16\",\n    \"width\": \"16\"\n  }, mdx(\"path\", {\n    parentName: \"svg\",\n    \"fillRule\": \"evenodd\",\n    \"d\": \"M4 9h1v1H4c-1.5 0-3-1.69-3-3.5S2.55 3 4 3h4c1.45 0 3 1.69 3 3.5 0 1.41-.91 2.72-2 3.25V8.59c.58-.45 1-1.27 1-2.09C10 5.22 8.98 4 8 4H4c-.98 0-2 1.22-2 2.5S3 9 4 9zm9-3h-1v1h1c1 0 2 1.22 2 2.5S13.98 12 13 12H9c-.98 0-2-1.22-2-2.5 0-.83.42-1.64 1-2.09V6.25c-1.09.53-2 1.84-2 3.25C6 11.31 7.55 13 9 13h4c1.45 0 3-1.69 3-3.5S14.5 6 13 6z\"\n  }))), `Why is the source code compiled?`), mdx(\"p\", null, `Since we are in 2020s, this question should not be asked by a web developer. If you have employed such a guy, trust me, he/she should be fired.`), mdx(\"p\", null, `We are using many lovely features in our project, some from ESNext, and some are popular in development but not supported natively by any browser. So we compile those parts to legacy JavaScript code to make the extension work for more browsers.`), mdx(\"p\", null, `For example, we build UI in Violentmonkey with `, mdx(\"a\", {\n    parentName: \"p\",\n    \"href\": \"https://vuejs.org/\",\n    \"target\": \"_blank\",\n    \"rel\": \"noopener noreferrer\"\n  }, `Vue.js`), `, a popular framework good at building complexed UIs. It depends on quite a few custom annotations which need to be transformed to vanilla JavaScript and CSS so that the browser can understand.`), mdx(\"p\", null, `There are also some constants injected at compilation time so that we don't need to hard-code them.`), mdx(\"h2\", {\n    \"id\": \"why-is-the-generated-code-minified\",\n    \"style\": {\n      \"position\": \"relative\"\n    }\n  }, mdx(\"a\", {\n    parentName: \"h2\",\n    \"href\": \"#why-is-the-generated-code-minified\",\n    \"aria-label\": \"why is the generated code minified permalink\",\n    \"className\": \"anchor before\"\n  }, mdx(\"svg\", {\n    parentName: \"a\",\n    \"aria-hidden\": \"true\",\n    \"focusable\": \"false\",\n    \"height\": \"16\",\n    \"version\": \"1.1\",\n    \"viewBox\": \"0 0 16 16\",\n    \"width\": \"16\"\n  }, mdx(\"path\", {\n    parentName: \"svg\",\n    \"fillRule\": \"evenodd\",\n    \"d\": \"M4 9h1v1H4c-1.5 0-3-1.69-3-3.5S2.55 3 4 3h4c1.45 0 3 1.69 3 3.5 0 1.41-.91 2.72-2 3.25V8.59c.58-.45 1-1.27 1-2.09C10 5.22 8.98 4 8 4H4c-.98 0-2 1.22-2 2.5S3 9 4 9zm9-3h-1v1h1c1 0 2 1.22 2 2.5S13.98 12 13 12H9c-.98 0-2-1.22-2-2.5 0-.83.42-1.64 1-2.09V6.25c-1.09.53-2 1.84-2 3.25C6 11.31 7.55 13 9 13h4c1.45 0 3-1.69 3-3.5S14.5 6 13 6z\"\n  }))), `Why is the generated code minified?`), mdx(\"p\", null, `Generally, the larger the code is, the longer it takes for the parser to parse. So it is very common for web apps to minify the code before publication.`), mdx(\"p\", null, `Another reason which is even more important is to strip the debugging related code because it actually runs in browser and slowers the runtime. It may be important for developers to find bugs but useless for normal users.`), mdx(\"p\", null, `This is mainly what code minification does, but not code obfuscation. Code obfuscation usually encodes the minified code to make it harder to read. As a result, it becomes slower because decoding is required before the code can execute. We don't need this and we have never included such tools in our project.`), mdx(\"h2\", {\n    \"id\": \"how-to-build-the-code-by-yourself\",\n    \"style\": {\n      \"position\": \"relative\"\n    }\n  }, mdx(\"a\", {\n    parentName: \"h2\",\n    \"href\": \"#how-to-build-the-code-by-yourself\",\n    \"aria-label\": \"how to build the code by yourself permalink\",\n    \"className\": \"anchor before\"\n  }, mdx(\"svg\", {\n    parentName: \"a\",\n    \"aria-hidden\": \"true\",\n    \"focusable\": \"false\",\n    \"height\": \"16\",\n    \"version\": \"1.1\",\n    \"viewBox\": \"0 0 16 16\",\n    \"width\": \"16\"\n  }, mdx(\"path\", {\n    parentName: \"svg\",\n    \"fillRule\": \"evenodd\",\n    \"d\": \"M4 9h1v1H4c-1.5 0-3-1.69-3-3.5S2.55 3 4 3h4c1.45 0 3 1.69 3 3.5 0 1.41-.91 2.72-2 3.25V8.59c.58-.45 1-1.27 1-2.09C10 5.22 8.98 4 8 4H4c-.98 0-2 1.22-2 2.5S3 9 4 9zm9-3h-1v1h1c1 0 2 1.22 2 2.5S13.98 12 13 12H9c-.98 0-2-1.22-2-2.5 0-.83.42-1.64 1-2.09V6.25c-1.09.53-2 1.84-2 3.25C6 11.31 7.55 13 9 13h4c1.45 0 3-1.69 3-3.5S14.5 6 13 6z\"\n  }))), `How to build the code by yourself?`), mdx(\"p\", null, `If you don't believe us and want to build the code by yourself, you can clone the Violentmonkey project and follow the build steps in README.`));\n}\n;\nMDXContent.isMDXComponent = true;","tableOfContents":{"items":[{"url":"#workflows","title":"Workflows","items":[{"url":"#development","title":"Development"},{"url":"#release","title":"Release"},{"url":"#publication","title":"Publication"}]},{"url":"#why-is-the-source-code-compiled","title":"Why is the source code compiled?"},{"url":"#why-is-the-generated-code-minified","title":"Why is the generated code minified?"},{"url":"#how-to-build-the-code-by-yourself","title":"How to build the code by yourself?"}]}}},"pageContext":{"id":"f6f4bc0f-afdd-51e2-be80-02872646c104","fields__slug":"/posts/violentmonkey-workflows/","__params":{"fields__slug":"posts"}}},"staticQueryHashes":["1878747374","2344890832","323714418"]}